Job_ID,Role,Company,Location,Publish_Time,URL,job_desc,salary,work_type,country
83179484,Data Engineer (Technology Consultant),EY,Jakarta,2025-06-17 16:17:33,https://id.jobstreet.com/id/job/83179484,"About EY:; EY, a global leader operating in more than 150 countries delivers unparalleled service in Consulting and assists clients to transform and upskill their capabilities.; We serve our clients to build a better working world, helping them to create long-term value for people and society and build trust in the capital markets. That starts with a culture that believes in giving you the training, opportunities, and creative freedom to make things better. Whenever you join, however long you stay, the exceptional EY experience lasts a lifetime. And with a commitment to hiring and developing the most passionate people, we work towards our ambition to be the best employer.; At EY, you’ll have the chance to build a career as unique as you are, with the global scale, support, inclusive culture, and technology to become the best version of you. And we’re counting on your unique voice and perspective to help EY become even better, too. Join us and build an exceptional experience for yourself, and a better working world for all.; The exceptional EY experience. It’s yours to build.; We look forward you to joining us in the Data & Analytics Consultant team: ; For Managerial level: ; Years of experience: 6-10 solid years of Data engineering and architecture background; Experience:; Design the Logical Data Model based on technical specification requirement; Design ETL logic to transform raw data from source into target table as per the Logical Data Model; Design big data ingestion, loading, and unloading data into a data lake.; Automate data quality error resolution and enforce rules; Prepared test cases and test plan based on the Logical Data Model, Data Mapping and technical specification; Technical skill:; Proficient in data management, database design, ETL design, optimization and development; Proficient in BI development and visualization (optional); Tools:; Packaged ETL tools, i.e. Talend, HIVE and Hadoop, MapR platform; Any database and ETL tools; Cloud architecture; For Senior level:; Years of experience: 3-5 solid years of Data engineering background; Experience:; Translate and develop Physical data model design of transactional and master tables; Data cleansing and data profiling (basic); Develop big data ETL jobs, loading, and unloading data into a data lake.; Implement the delivery of enhancements for an existing Data Warehouse for a new data source system; ETL Unit testing and data validation; Technical skill:; Proficient in data management, database design, ETL design, optimization and development; Proficient in BI development and visualization (optional); Tools:; Packaged ETL tools, i.e. Talend, HIVE and Hadoop, MapR platform; Any database and ETL tools; Cloud architecture; The opportunity:; You will help our clients navigate the business and technology transformation vision. We’ll look to you to provide our clients with a unique business and technology perspective on how technology can transform and improve their entire organization – starting with key business issues they face. This is a high-growth, high-visibility area with plenty of opportunities to enhance your skill set and build your career.; Your key responsibilities:; You’ll spend most of your time working with a wide variety of clients and your colleagues to deliver the latest trends, practices, technologies, and architecture to design, build and maintain scalable and robust solutions that unify, enrich, collaborate and deliver value.; Skills and attributes for success:; Outstanding team player; High level of motivation; Strong work ethic; Self-starting attitude; Independent and able to manage and prioritize workload; Ability to quickly and positively adapt to change; Excellent written and verbal communication, presentation, client service, and technical writing skills, coupled with excellent executive presence.; Significant experience in managing and delivering medium to large teams on complex programs and projects.; Assessing, designing, architecting, and developing solutions leveraging the latest technologies and trends to exceed the business requirements; Unifying, enriching, and delivering value to derive insights and opportunities; Leveraging in-house and partners - platforms and solutions as needed and recommending and building new platforms/solutions as required to exceed business requirements; Communicating findings, recommendations, and opportunities to improve platforms and solutions; Demonstrating a deep understanding of technology, concepts, tools, features, functions, and benefits of different approaches; Seeking out information to learn about emerging methodologies and technologies; Clarifying problems by driving to understand the true issue; Looking for opportunities for improving methods and outcomes; Collaborating, influencing, and building consensus through constructive relationships and effective listening; Solving problems by incorporating data into decision making; Proven track record of sales and delivery in a consulting context with established client relationships and experience; Ideally, you must have a:; Bachelor’s Degree or above in Information Systems, Computer Science, Electronics and Communications, or related disciplines.; Minimum three (3) years of experience (for Senior level) and 5 to 7 years for Manager or Senior Manager level.; What we look for; We’re interested in passionate individuals with a strong vision and a desire to stay on top of trends. If you have a genuine passion for helping businesses achieve their full potential, then these role(s) are for you.; What we offer; Continuous learning: You’ll develop the mindset and skills to navigate whatever comes next; Success as defined by you: We’ll provide the tools and flexibility, so you can make a meaningful impact, on your way; Transformative leadership: We’ll give you the insights, coaching, and confidence to be the leader the world needs; Diverse and inclusive culture: You’ll be embraced for who you are and empowered to use your voice to help others find theirs; If you can demonstrate that you meet the criteria above, please contact us as soon as possible.; EY is an equal opportunity, affirmative action employer providing equal employment opportunities to applicants and employees without regard to race, color, religion, age, sex, sexual orientation, gender identity/expression, national origin, protected veteran status, disability status, or any other legally protected basis, including arrest and conviction records, by applicable law.; EY is committed to providing reasonable accommodation to individuals with special needs. If you are a qualified individual with special needs and need assistance applying online or need to request an accommodation during the interview process, please speak to our HR executives, and we will be happy to help you.",,Full time,indonesia
85617171,Data Engineer,PT. Entrepreneur Trust Digital,Tangerang,2025-07-10 16:17:33,https://id.jobstreet.com/id/job/85617171,"- SSIS, SQL Server; - Berpengalaman dengan Inner Join, Left & Right, Cross Join, Delete, Turncate, Drop Table, Execution Plan; - Bahasa pemograman, Framework : C#, .Net, Java; - Bersedia onsite WFO di project CIMB Niaga Bintaro",Rp 6.000.000 – Rp 8.000.000 per month,Kontrak/Temporer,indonesia
85235370,Cloud Data Engineer,PT Cybertrend Intrabuana,Pasar Minggu,2025-06-27 16:17:33,https://id.jobstreet.com/id/job/85235370,"We are SmartCyber, member of Cybertrend, one of the leader data science consultants in Indonesia. We believe as a company that can unlock its full performance capacity and for this purpose we need you to join us.; About the Role; As CLOUD DATA ENGINEER, you will be part of the core team, in ensuring that our product and solution delivered to customers are designed and developed with highly scalable, reliable and maintainable system. As a Cloud Data Engineer, you will responsible for expanding and optimizing data and pipeline architectures, and for enhancing data collection and flow across functional teams.; We are looking someone with:; A bachelor’s degree in Information Technology or similar field is preferred; Knowledge and proven track record experience with Cloud Data Warehouse technologies; Experience in data engineering and cloud data processing services (AWS, GCP or Azure); Experience building, cloud data migration and optimizing cloud big data data pipelines, architectures, and data sets; Good understanding of ETL tools and experience in Big Data technologies (Hadoop, Spark, Data Bricks, Snowflake); The work you’ll do:; Work along-side customers to delivery data warehouse migrations leveraging best-in-breed technology tooling; Design and build cloud data driven solutions for enterprise data warehouse and data lakes; Develop scalable and easy to understand data pipelines and data management integration solutions; Research, test and measure different optimization techniques, new technologies (e.g. data streaming) and advanced features of existing technologies (e.g. data warehouse configuration) aimed at speeding up data pipelines; What Cybertrend can offer you:; The unique opportunity to work within data science and artificial intelligence solution for various industries – real world data science, AI , Data Management and Governance experiences; Investment in your personal growth and skill development (clear career paths, mentorship and coaching, learning development, etc); Attractive compensation and benefits packages; An open-minded culture with innovative, autonomous teams; A clear set of company core values that guide everything we do: GROWTH mindset, SOLUTION oriented, INNOVATIVE achiever, COMPASSIONATE, GOTONG ROYONG and Cool & FUN",,Full time,indonesia
79661872,Data Engineer (IT Consulting),Data Engineer (IT Consulting),Kebayoran Lama,2025-06-17 16:17:33,https://id.jobstreet.com/id/job/79661872,"On behalf of our client, an IT Consulting company that is looking to hire a Data Engineer position with details below; Responsibilities; Design, develop, and maintain robust ETL processes for data transformation, quality, and reliability.; Build and manage data platforms based on server clusters such as Hadoop, Spark, and Kafka.; Utilize major cloud service providers (AWS, GCP, Azure) for data platform management.; Deliver high-quality, well-tested, reusable, and secure code in compliance; Collaborate with cross-functional teams to understand data requirements and translate them into technical specifications.; Ensure data integrity and availability for various applications and stakeholders.; Monitor and troubleshoot data pipelines to ensure seamless data flow.; Continuously improve data engineering processes and practices.; Qualifications; Bachelors degree in Computer Science, Information Technology, or a related major.; Minimum of 2 years of experience as a Data Engineer.; Proficiency in development languages such as Python, SQL, or other relevant languages.; Extensive experience in building and managing ETL processes.; Strong expertise in building data platforms based on server clusters (Hadoop, Spark, Kafka).; Familiarity with major cloud service providers (AWS, GCP, Azure).; Ability to deliver high-quality, well-tested, reusable, and secure code.; Strong technical expertise with various data sources and data types.",,Full time,indonesia
85191860,"Data Engineer (Data Warehouse), Business Intelligence",Shopee Internasional Indonesia,Jakarta,2025-06-26 16:17:33,https://id.jobstreet.com/id/job/85191860,"The Business Intelligence and Data Analytics team plays a critical role in conducting close-loop data-driven business iterations. As business intelligence specialists and data analysts, our scope of work is not limited to just performance monitoring and reporting, but also in proactively finding actionable insights to help drive high-impact business changes. Our end-to-end data solution reduces the gap between the business teams and technical teams, and achieves real ‘intelligence’ in the iteration cycle. Browse our Business Intelligence and Data Analytics team openings to see how you can make an impact with us.; Job Description:; Work closely with Data PM, Business Intelligence Analyst & other Engineers to turn data into information that can be used to make sound business decisions; Design and develop data marts and data warehouses that support business intelligence and data analytics initiatives.; Develop and implement best practices for data management, including data quality, data security, and data privacy.; Handle end to end data pipelines from multiple sources internally and externally and ensure its performance & scalability as Single Source of Truth; Adhere to software development best practices, including test-driven development.; Requirements:; Master's or bachelor degree in Computer Science/ Information Systems or any related fields; Expert in SQL, Spark, HDFS, and other data processing tools; Expert in Object Oriented & Functional Programming (preferably Python / Scala); Experience in UNIX environment; Proficient in data modeling concepts (preferably Kimball’s versions), batch processing and lambda architecture; Proficient in Software Development Life Cycle (SDLC) including code version control, test driven development and technical documentation; Excellent communication & collaboration skills; Analytical & data driven and have high curiosity with data; Ability to work in a fast-paced, dynamic environment",,Full time,indonesia
85622929,Data Engineer (Azure Data Factory),PT Kamoro Maxima Integra,South Jakarta,2025-07-10 16:17:33,https://id.jobstreet.com/id/job/85622929,"Responsibilities:; Developing and managing data pipelines solutions for the organization; Develop and execute database queries and conduct analyses; Generate reports, dashboards, and visualizations to present findings to stakeholders and support data-driven decision-making;  Requirements:; Strong English communication skills; interviews and meetings will be conducted in English.; Willing to work on-site at the South Jakarta office.; Bachelor’s degree in Information Systems, Computer Science, or a related field.; Minimum 2 years of hands-on experience in data engineering.; Solid knowledge of ETL processes, data warehousing, and data engineering best practices.; Proficient in Azure Data Factory, Snowflake, Python, MS SQL, and stored procedures.; Experienced in data migration across various systems and sources.; Skilled in using BI tools, especially Power BI.; Familiarity with SAP CPI, SNPGlue, and BizTalk is a plus.; Proven ability to develop and manage data integration between systems or external parties.;  Why join Us?; We offer very attractive salary and outstanding benefits.; Most of our clients are multinational company which you will be exposed to a large IT environment and valuable experience in international scale projects.; You will always learn new things as our projects always adopt latest technology and best practice available in the market.; Last but not least, we offer a supportive and encouraging environment that puts the emphasis on teamwork. Here, your soft skill (professional relationships, character, attitude) will grow as fast as your technical skill.",,Full time,indonesia
85535014,Data Engineer,Shipper,Central Jakarta,2025-07-07 16:17:33,https://id.jobstreet.com/id/job/85535014,"What is Shipper:; Shipper is Indonesia's leading digital logistics company, specializing in end-to-end supply chain solutions for e-commerce businesses and enterprises. Established in 2017, Shipper is on a mission to democratize top-tier logistics across Indonesia. We are backed by prominent investors, including Naspers, Floodgate, Y-Combinator, Lightspeed Venture Partners, Insignia Ventures Partners, DST Global Partners, and Sequoia Capital India.; ; About The Role: ; We’re on the lookout for a Data Engineer (or Data Analyst Engineer) to join our growing tech team. You’ll play a key role in building our data pipeline from scratch, ensuring data flows smoothly across systems to support real-time operations and critical business decisions. This isn’t just about ETL — we need someone who can design, build, and scale. If you've ever walked into a company with no data infra and built something others could rely on, we’d love to hear from you.; Tech Stack You’ll Work With:; BigQuery, Google Cloud Storage, AWS S3; Apache Airflow, Database Migration Service (DMS); Databricks, Python; Familiarity with datalake architectures and storage optimization; Optional nice-to-have: Kafka, dbt, PostgreSQL, MongoDB; ; What Will You Do:; Build and maintain scalable data pipelines to support both batch and near real-time needs.; Integrate data from operational systems into our BigQuery warehouse.; Set up workflows and scheduling using Airflow.; Handle database replication and transformation via DMS.; Use Databricks for large-scale data processing.; Manage and optimize data storage layers, including AWS S3, GCS, and datalake environments.; Collaborate with engineers, analysts, and product teams to understand and fulfill data needs; What Are The Requirements:; 5+ years of experience in Data Engineering or similar roles.; Hands-on experience building pipelines from scratch.; Strong grasp of cloud-based data platforms, especially GCP and AWS.; Proficient in Python for automation and transformation tasks.; Able to work independently and provide direction in a fast-moving environment",,Kontrak/Temporer,indonesia
85147318,Senior Data Engineer,Qoala,Jakarta,2025-06-24 16:17:33,https://id.jobstreet.com/id/job/85147318,"Summary of The Job; ; The Data Engineer is responsible for building and maintaining scalable data pipelines and platforms to ensure reliable and timely data availability across the organization. This role also manages data ingestion, orchestrates workflows, monitors platform performance and cost, and supports AI/ML engineering through clean, governed, and well-structured data.; ; Responsibilities:; Analyze and organize raw data; Combine raw information from different sources; Explore ways to enhance data quality and reliability; Develop and update technical documentation; Technical responsibility for ingesting data and data pipelines to ensure compliance with data standards, architectural standards, and achievement of documented requirements.; Develop and maintain current data ingestion processes and build an analytical layer with a state-of-art architecture.; Innovate new data solutions to achieve business mission.; Manage existing CI/CD process.; Work with data and analytics experts to strive for greater functionality in our data systems.; Collaborate with the Engineering team to keep the data integrity between systems.; Requirements:; Previous experience as a data engineer or other position in data field minimum 4 years; Knowledge of programming languages (e.g. Java and Python) with GIT as versioning tools; Hands-on experience with SQL (Oracle, MySQL, Redshift, Hive etc); Familiar with Airflow as workflow management tools; Crave for new technologies with fast learning and understanding process.",,Full time,indonesia
80249699,Software Engineer - Data,PT Samsung Electronics Indonesia,Jakarta,2025-06-17 16:17:33,https://id.jobstreet.com/id/job/80249699,"Position Summary; We're looking for passionate and adaptable software engineer data to join our team. Ideal candidates should have a strong experience in implement ETL to provide structured data. You will contribute to both the software engineer data.; Role and Responsibilities; 1. Understand and implement ETL to provide structured data that meets its purpose on time.; 2. Write clean, maintainable, and efficient code with well-documentation.; 3. Review code with best practices of readability, testing patterns, documentation, reliability, security, and performance considerations in mind.; 4. Ensure full visibility, error reporting, and monitoring of high-performing backend services; 5. Stay up-to-date on the latest backend technologies and trends.; Skills and Qualifications; 1. Generally, requires a bachelor's degree in computer science, Information System, Information Technology, Software Engineering and Electrical Engineering, Math, Physics, from Reputable Universities with a minimum 2 years related experience, or advanced degree without experience.; 2. [Maintain ETL Engine] Develop and maintain crawling and parser engine that meets requirement.; 3. [Maintain Data Quality] Participate in providing a clean data quality.; 4. [Maintaining and Optimizing Service] Participate in terms of system improvement that lead to the efficiency of cost operation.; 5. Have deep understanding of JavaScript and Object-Oriented Programming; 6. Have good communication skills in English; 7. Accustomed to using versioning systems (GitHub); 8. Have experience in SQL Database; 9. Have experience using AWS services ; ; Preferable:; - Have experience in web scraping tools (Puppeteer, Selenium, Beautiful Soup) is a plus; - Have experience in OCR tools (OpenCV, Tesseract, Python) is a plus; - Have experience in REST API Development (NodeJS) is a plus; - Have experience in Service Oriented Architecture / Microservices Architecture is a plus; - Excellent communication abilities in English and Bahasa Indonesia; * Samsung has a strict policy on trade secrets. In applying to Samsung and progressing through the recruitment process, you must not disclose any trade secrets of a current or previous employer.; * Please visit Samsung membership to see Privacy Policy, which defaults according to your location. You can change Country/Language at the bottom of the page. If you are European Economic Resident, please click here; .",,Full time,indonesia
