Job_ID,Role,Company,Location,Publish_Time,URL
84725218,Project Manager - Energy - Jakarta (B-119983),RGF HR Agent Indonesia,South Jakarta,2025-06-05 12:15:22,https://id.jobstreet.com/id/job/84725218
84712372,Junior Accountant,PT EDPMEDIA Multimitra Primanusa,West Jakarta,2025-06-05 12:15:22,https://id.jobstreet.com/id/job/84712372
81104830,DevOps Engineer (Senior/Middle Level),PT Amartha Mikro Fintek (Jakarta),Kebayoran Lama,2025-05-15 12:15:22,https://id.jobstreet.com/id/job/81104830
84252818,Purchasing Staff,,Bogor,2025-05-15 12:15:22,https://id.jobstreet.com/id/job/84252818
84367569,Procurement Staff (Service & Maintenance),Indofood Group,South Jakarta,2025-05-21 12:15:22,https://id.jobstreet.com/id/job/84367569
84401357,SALES ENGINEER (Jakarta & Surabaya),PT Teco Multiguna Elektro,Jakarta,2025-05-22 12:15:22,https://id.jobstreet.com/id/job/84401357
84907038,Engineering Production Staff,ADR Group Of Companies (PT Selamat Sempurna Tbk.),Curug,2025-06-13 12:15:22,https://id.jobstreet.com/id/job/84907038
84692302,QS Procurement Project Construction,"PT SMART,Tbk",Central Jakarta,2025-06-04 12:15:22,https://id.jobstreet.com/id/job/84692302
84724566,Production Manager,PT Triangle Motorindo (Semarang),Semarang,2025-06-05 12:15:22,https://id.jobstreet.com/id/job/84724566
84439876,Electrical Engineer (Open for Fresh Graduate) - Construction - Jakarta(B-119558),RGF HR Agent Indonesia,South Jakarta,2025-05-23 12:15:22,https://id.jobstreet.com/id/job/84439876
84666687,"Senior Software Engineer, Mobile (iOS) - Consumer Experience",PT Solusi Transportasi Indonesia,Jakarta,2025-06-03 12:15:22,https://id.jobstreet.com/id/job/84666687
84064258,Data Entry Specialist Intern,PT Permata Hijau Makmur,South Jakarta,2025-05-16 12:15:22,https://id.jobstreet.com/id/job/84064258
84635228,MINE SURVEYOR,PT Bumi Barito Mineral (COKAL Group),Murung Raya,2025-06-02 12:15:22,https://id.jobstreet.com/id/job/84635228
84635225,Operations Manager - Chemical Manufacturing - Jakarta (B-115408),RGF HR Agent Indonesia,East Jakarta,2025-06-02 12:15:22,https://id.jobstreet.com/id/job/84635225
84721983,Manager Surveyor - Coal Mining,PT Sumber Mitra Jaya,Berau,2025-06-05 12:15:22,https://id.jobstreet.com/id/job/84721983
84629620,Consulting Sales Engineer,PT Daikin Airconditioning Indonesia,Pekanbaru,2025-06-02 12:15:22,https://id.jobstreet.com/id/job/84629620
84816064,SQE (SUPPLIER QUALITY ENGINEERING),PT Changhong Electric Indonesia,Cikupa,2025-06-10 12:15:22,https://id.jobstreet.com/id/job/84816064
84244057,Backend Engineer (Node.js),PT Karisma Zona Kreatifku,South Jakarta,2025-05-15 12:15:22,https://id.jobstreet.com/id/job/84244057
84438781,Sales Engineer Industrial,PT Global Niaga Internusa,South Jakarta,2025-05-23 12:15:22,https://id.jobstreet.com/id/job/84438781
84820809,Engineering,PT Longhi Group International,Pasuruan,2025-06-11 12:15:22,https://id.jobstreet.com/id/job/84820809
84622326,Surveyor Process Plant,PT Petrosea Tbk,Luwu,2025-06-02 12:15:22,https://id.jobstreet.com/id/job/84622326
84631801,Continuous Improvement Manager - FMCG (Jabodetabek),PT Michael Page Internasional Indonesia,Jakarta,2025-06-02 12:15:22,https://id.jobstreet.com/id/job/84631801
84500149,Sales Engineer,PT Greatfield Technology Indonesia,Cengkareng,2025-06-12 12:15:22,https://id.jobstreet.com/id/job/84500149
84858604,Production Operator - Manufacturing - Pasuruan,Korn Ferry (Agensi Pekerjaan Futurestep Worldwide (M) Sdn Bhd),Pasuruan,2025-06-12 12:15:22,https://id.jobstreet.com/id/job/84858604
80675348,Infra-Ops Engineer,Coda Payments Pte Ltd,Jakarta,2025-05-15 12:15:22,https://id.jobstreet.com/id/job/80675348
84477743,IT Support Network Engineer,PT Swadharma Duta Data,Central Jakarta,2025-05-26 12:15:22,https://id.jobstreet.com/id/job/84477743
84338189,Estimator - QS Engineer Interior,Highpoint Group,West Jakarta,2025-05-20 12:15:22,https://id.jobstreet.com/id/job/84338189
84696261,QA Engineer,PT INDUSTRI PIPA INDONESIA,Batam,2025-06-04 12:15:22,https://id.jobstreet.com/id/job/84696261
84229030,Mine Plan Engineer Suptend,Batu Karang Group,Halmahera,2025-05-15 12:15:22,https://id.jobstreet.com/id/job/84229030
84499846,Python Developer,PT Tekno Gemilang Indonesia,Jakarta,2025-05-27 12:15:22,https://id.jobstreet.com/id/job/84499846
84680117,Production Engineer - Automotive - Cikarang - WFO (ID: 672786),PT. PERSOLKELLY Recruitment Indonesia,South Cikarang,2025-06-04 12:15:22,https://id.jobstreet.com/id/job/84680117
84483019,Project Service Engineer,PT Trust Recruit Indonesia,South Tangerang,2025-05-26 12:15:22,https://id.jobstreet.com/id/job/84483019
84650070,Fullstack Developer (Project Based),PT Adi Data Informatika,Jakarta,2025-06-03 12:15:22,https://id.jobstreet.com/id/job/84650070
84662470,Java Developer,PT. ALPEN FOOD INDUSTRY,North Jakarta,2025-06-03 12:15:22,https://id.jobstreet.com/id/job/84662470
83451500,Software Engineer (Campus Hiring),PT Trinusa Travelindo,Jakarta,2025-05-15 12:15:22,https://id.jobstreet.com/id/job/83451500
84005980,Associate Backend Engineer,"PT. BFI FINANCE INDONESIA, Tbk",Tangerang District,2025-05-15 12:15:22,https://id.jobstreet.com/id/job/84005980
84660026,Engineer,PT Acset Indonusa Tbk,Central Jakarta,2025-06-03 12:15:22,https://id.jobstreet.com/id/job/84660026
84878535,Associate Product Manager,PT. Fidac Inovasi Technology,Jakarta,2025-06-12 12:15:22,https://id.jobstreet.com/id/job/84878535
84430294,Civil Engineer Staff,PT. PALMA SERASIH TBK,South Jakarta,2025-05-23 12:15:22,https://id.jobstreet.com/id/job/84430294
84497617,"Engineering & Photography Intern (Serang, Banten)",ASIA PULP AND PAPER,Serang,2025-05-27 12:15:22,https://id.jobstreet.com/id/job/84497617
83900340,"Software Engineer, Mobile (Android)",PT Solusi Transportasi Indonesia,Jakarta,2025-05-15 12:15:22,https://id.jobstreet.com/id/job/83900340
84649321,Sales Manager,PT Laboratorium Solusi Indonesia,North Jakarta,2025-06-03 12:15:22,https://id.jobstreet.com/id/job/84649321
84775786,Staff - Industrial Engineering,PT MAS ARYA INDONESIA (Semarang),Semarang,2025-06-09 12:15:22,https://id.jobstreet.com/id/job/84775786
84659990,Supervisor QAQC,PT Advanex Precision Indonesia,South Cikarang,2025-06-03 12:15:22,https://id.jobstreet.com/id/job/84659990
84356599,Estimator Machining Custom,PT Astra Otoparts Tbk,Karawang,2025-05-21 12:15:22,https://id.jobstreet.com/id/job/84356599
84265255,CAD Inspector,PT Sulzer Indonesia,Purwakarta,2025-05-16 12:15:22,https://id.jobstreet.com/id/job/84265255
84380812,IT Software Engineer,pt mitra utama solusi telematika,South Jakarta,2025-05-21 12:15:22,https://id.jobstreet.com/id/job/84380812
84667768,Graduate Trainee Programme,PT Ninety Nine Dotco,Jakarta,2025-06-03 12:15:22,https://id.jobstreet.com/id/job/84667768
84869974,Senior/Staff Full Stack Engineer,Coda Payments Pte Ltd,Jakarta,2025-05-15 12:15:22,https://id.jobstreet.com/id/job/84869974
82235409,Senior Software Engineer,PT Aplikasi Karya Anak Bangsa (GO-JEK Indonesia),Jakarta,2025-05-15 12:15:22,https://id.jobstreet.com/id/job/82235409
84339516,SPV. MEKHANIK MESIN INDUSTRI (PLYWOOD),PT Karya Makmur Pratama Jaya,Jepara,2025-05-20 12:15:22,https://id.jobstreet.com/id/job/84339516
84608873,Manager Teknik,PT Matahari Putra Makmur,Pasuruan,2025-05-31 12:15:22,https://id.jobstreet.com/id/job/84608873
84849537,Junior PMC (Product Material Control),PT Adis Dimension Footwear,Balaraja,2025-06-12 12:15:22,https://id.jobstreet.com/id/job/84849537
84606352,Drafter,PT Sumber Data Indonesia,South Jakarta,2025-05-31 12:15:22,https://id.jobstreet.com/id/job/84606352
84440066,Mechanical Design Engineer - SPM - Cikarang (B-119565),RGF HR Agent Indonesia,South Cikarang,2025-05-23 12:15:22,https://id.jobstreet.com/id/job/84440066
84410806,Lead Software Engineer,PT Aplikasi Karya Anak Bangsa (GO-JEK Indonesia),Jakarta,2025-05-22 12:15:22,https://id.jobstreet.com/id/job/84410806
83549791,Transport Marketing Data Analyst,PT Aplikasi Karya Anak Bangsa (GO-JEK Indonesia),Jakarta,2025-05-15 12:15:22,https://id.jobstreet.com/id/job/83549791
84815034,Process Engineer,PT Dover Chemical,Cilegon,2025-06-10 12:15:22,https://id.jobstreet.com/id/job/84815034
84379117,Systems Spec Specialist,British American Tobacco Indonesia,Malang,2025-05-21 12:15:22,https://id.jobstreet.com/id/job/84379117
84509521,Network Security Engineer,PT Visionet Data Internasional,Central Jakarta,2025-05-27 12:15:22,https://id.jobstreet.com/id/job/84509521
84236639,CAD Engineer - Trading - Tambun (ID: 674233),PT. PERSOLKELLY Recruitment Indonesia,South Tambun,2025-05-15 12:15:22,https://id.jobstreet.com/id/job/84236639
84319824,Frontend Engineer,PT SOD Technology Indonesia,Jakarta,2025-05-19 12:15:22,https://id.jobstreet.com/id/job/84319824
84623848,Sales & Services Manager (Oil & Gas Industry),Geekhunter,Jakarta,2025-06-02 12:15:22,https://id.jobstreet.com/id/job/84623848
83801518,Logistics Strategic Insight Sr. Associate,PT Aplikasi Karya Anak Bangsa (GO-JEK Indonesia),Jakarta,2025-05-15 12:15:22,https://id.jobstreet.com/id/job/83801518
84351752,Mine Engineer,PT. FIVE STAR GENERAL RESOURCES,Gebe Island,2025-05-20 12:15:22,https://id.jobstreet.com/id/job/84351752
82222960,Salesforce - Associate to Senior Associate - Core Developer,PwC Indonesia,Jakarta,2025-05-15 12:15:22,https://id.jobstreet.com/id/job/82222960
84381176,Mechanical Electrical Engineer,PT. LIPPO KARAWACI TBK,Banten,2025-05-21 12:15:22,https://id.jobstreet.com/id/job/84381176
84633510,Software Quality Assurance,MEDITAP,Karawaci,2025-06-02 12:15:22,https://id.jobstreet.com/id/job/84633510
84786975,Commercial Management Analyst,"PT Tower Bersama Infrastructure, Tbk",Jakarta,2025-06-09 12:15:22,https://id.jobstreet.com/id/job/84786975
78475260,Software Backend Engineer,PT Trinusa Travelindo,Jakarta,2025-05-15 12:15:22,https://id.jobstreet.com/id/job/78475260
82876994,Associate Performance Marketing Manager,PT Trinusa Travelindo,Jakarta,2025-05-15 12:15:22,https://id.jobstreet.com/id/job/82876994
84835675,GC-MS Specialist (R&D),PT. Hertz Flavors Makmur Indonesia,East Java,2025-06-11 12:15:22,https://id.jobstreet.com/id/job/84835675
84834842,General Manager,PT Sahabat Agro Group (SAG),North Jakarta,2025-06-11 12:15:22,https://id.jobstreet.com/id/job/84834842
84872592,Chemist,PT Delta Djakarta Tbk,Bekasi,2025-06-12 12:15:22,https://id.jobstreet.com/id/job/84872592
84365964,Molding Design Engineer - Automotive - Cikarang (B-119423),RGF HR Agent Indonesia,Cikarang,2025-05-21 12:15:22,https://id.jobstreet.com/id/job/84365964
84247787,Electrical Engineer - Trading - Jakarta (B-119260),RGF HR Agent Indonesia,South Jakarta,2025-05-15 12:15:22,https://id.jobstreet.com/id/job/84247787
84537621,Cost Control Expert,ASIA PULP AND PAPER,Serpong,2025-05-28 12:15:22,https://id.jobstreet.com/id/job/84537621
84853215,People Partner (HRBP) Specialist - Projects (Manufacturing),PT Lemonilo Indonesia Sehat,Cikande,2025-06-12 12:15:22,https://id.jobstreet.com/id/job/84853215
84692810,CIVIL ENGINEER,PT Tri Daya Maxima,Gunung Putri,2025-06-04 12:15:22,https://id.jobstreet.com/id/job/84692810
84769307,Project Sales (HVAC),PT Global Kreasi Asia,East Jakarta,2025-06-09 12:15:22,https://id.jobstreet.com/id/job/84769307
84497680,"Engineering & Photography Intern (Perawang, Riau)",ASIA PULP AND PAPER,Riau,2025-05-27 12:15:22,https://id.jobstreet.com/id/job/84497680
84497849,"Intern, Engineering Training & Development (Semarang)",ASIA PULP AND PAPER,Bawen,2025-05-27 12:15:22,https://id.jobstreet.com/id/job/84497849
84834681,PPIC Manager,PT Sepatu Mas Idaman,Bogor,2025-06-11 12:15:22,https://id.jobstreet.com/id/job/84834681
84480741,Process Engineering Specialist,PT Willson Surya Unggul,Curug,2025-05-26 12:15:22,https://id.jobstreet.com/id/job/84480741
84633505,Sales Manager - Mining (Sulawesi/Kalimantan),PT Trust Recruit Indonesia,East Kalimantan,2025-06-02 12:15:22,https://id.jobstreet.com/id/job/84633505
84238071,Quality Assurance Engineer,PT Technomed Asia,Bandung,2025-05-15 12:15:22,https://id.jobstreet.com/id/job/84238071
84777513,Senior costing Controlling,Volex Finance,Batam,2025-06-09 12:15:22,https://id.jobstreet.com/id/job/84777513
84320692,PPIC Section Head,,Bandung,2025-05-19 12:15:22,https://id.jobstreet.com/id/job/84320692
83879283,Senior Associate Strategy & Planning (Supply & Pricing),PT Aplikasi Karya Anak Bangsa (GO-JEK Indonesia),Jakarta,2025-05-15 12:15:22,https://id.jobstreet.com/id/job/83879283
84779370,Mine Surveyor,PT Everde Global Mineral,North Morowali,2025-06-09 12:15:22,https://id.jobstreet.com/id/job/84779370
84407686,Production Engineer,PT KLK Dumai,Dumai City,2025-05-22 12:15:22,https://id.jobstreet.com/id/job/84407686
84366827,Mine Hydrology Engineer (Supervisor),PT Trimegah Bangun Persada,Obi,2025-05-21 12:15:22,https://id.jobstreet.com/id/job/84366827
84600226,Tender Manager,PT Schneider Electric,Cilandak,2025-05-30 12:15:22,https://id.jobstreet.com/id/job/84600226
84842587,Business Development Manager,PT SCHOTT Igar Glass,South Cikarang,2025-06-11 12:15:22,https://id.jobstreet.com/id/job/84842587
84236346,Admin Engineering Staff,Agung Sedayu Group,North Jakarta,2025-05-15 12:15:22,https://id.jobstreet.com/id/job/84236346
84514930,STAFF ACCOUNTING PAJAK,PT Simojoyo Engineering,East Java,2025-05-28 12:15:22,https://id.jobstreet.com/id/job/84514930
84507728,Senior SAN Engineer (Enterprise Storage),Ayo Berinovasi Internasional,Tangerang,2025-05-27 12:15:22,https://id.jobstreet.com/id/job/84507728
84550765,Engineer in Power Plant,IndoBNKPower,Simalungun,2025-05-29 12:15:22,https://id.jobstreet.com/id/job/84550765
78284509,Senior Associate Performance Marketing Manager - Metasearch,PT Trinusa Travelindo,Jakarta,2025-05-15 12:15:22,https://id.jobstreet.com/id/job/78284509
84533418,"Engineering Manager II, Backend (Lending)",PT Solusi Transportasi Indonesia,Jakarta,2025-05-28 12:15:22,https://id.jobstreet.com/id/job/84533418
84606442,NOC (Network Operations Center) Staff,PT Sumber Data Indonesia,South Jakarta,2025-05-31 12:15:22,https://id.jobstreet.com/id/job/84606442
84533516,Project & Engineering Supervisor,PT Indofood Fortuna Makmur,Cikupa,2025-05-28 12:15:22,https://id.jobstreet.com/id/job/84533516
84622822,3D Graphics Designer CAD,PT. INSPIRASI MAJU JAYA,Jakarta,2025-06-02 12:15:22,https://id.jobstreet.com/id/job/84622822
81976751,Voice and Collaboration Engineer,PT Trinusa Travelindo,Jakarta,2025-05-15 12:15:22,https://id.jobstreet.com/id/job/81976751
84401226,Facility Data Center,PT Supra Primatama Nusantara(Biznet),Gunung Putri,2025-05-22 12:15:22,https://id.jobstreet.com/id/job/84401226
84499022,ENGINEERING,PT Accel Multikikai Suksestama,Bekasi,2025-05-27 12:15:22,https://id.jobstreet.com/id/job/84499022
84448803,Business Analyst,PT Trinusa Travelindo,Jakarta,2025-05-23 12:15:22,https://id.jobstreet.com/id/job/84448803
84380063,"Head of Automation, AI & ML",PT Bank Multiarta Sentosa,Jakarta,2025-05-21 12:15:22,https://id.jobstreet.com/id/job/84380063
84477400,Back End Laravel Developer,Steradian Data Optima,Jakarta,2025-05-26 12:15:22,https://id.jobstreet.com/id/job/84477400
84477779,Production Supervisor,PT Willson Surya Unggul,Curug,2025-05-26 12:15:22,https://id.jobstreet.com/id/job/84477779
81897417,Software Engineering - Backend - Customer Care (Bot and Communication Channels),PT Trinusa Travelindo,Jakarta,2025-05-15 12:15:22,https://id.jobstreet.com/id/job/81897417
84877515,Industrial Hygienist Technician,,East Java,2025-06-12 12:15:22,https://id.jobstreet.com/id/job/84877515
84495290,IT Manager,BIENSI FESYENINDO (3SECOND GROUP),Bandung,2025-05-27 12:15:22,https://id.jobstreet.com/id/job/84495290
84854581,"Lead Product Designer, Fulfilment",PT Solusi Transportasi Indonesia,Jakarta,2025-06-12 12:15:22,https://id.jobstreet.com/id/job/84854581
84439682,Java Application Developer - IT Consulting - Jakarta (B-119562),RGF HR Agent Indonesia,Jakarta,2025-05-23 12:15:22,https://id.jobstreet.com/id/job/84439682
84481573,Data Center Shift Technician/ Teknisi Shift (Batam),PT CBRE Consultancy Services,Pekanbaru,2025-05-26 12:15:22,https://id.jobstreet.com/id/job/84481573
84442599,Project cost control coal Mining -Supervisor,PT Sumber Mitra Jaya,Berau,2025-05-23 12:15:22,https://id.jobstreet.com/id/job/84442599
82727220,Strategy & Planning Manager - Demand,PT Aplikasi Karya Anak Bangsa (GO-JEK Indonesia),Jakarta,2025-05-15 12:15:22,https://id.jobstreet.com/id/job/82727220
84278514,"Engineer Printer, PC & Notebook (Ternate)",PT Airmas Perkasa,Ternate,2025-05-16 12:15:22,https://id.jobstreet.com/id/job/84278514
83648665,Junior Business Analyst,PT Trinusa Travelindo,Jakarta,2025-05-15 12:15:22,https://id.jobstreet.com/id/job/83648665
84264451,Lead Frontend Engineer - Indonesia - Remote (29068),CSG International Sdn. Bhd.,Bali,2025-05-16 12:15:22,https://id.jobstreet.com/id/job/84264451
84405085,Project Kordinator / Site Engineer,PT Intergastra Nusantara,Central Jakarta,2025-05-22 12:15:22,https://id.jobstreet.com/id/job/84405085
84352292,IT/OT engineer (Karawang),PT Karya Solusi Prima Sejahtera,Karawang,2025-05-20 12:15:22,https://id.jobstreet.com/id/job/84352292
84341355,Sales and Operation Executive,,Jakarta,2025-05-20 12:15:22,https://id.jobstreet.com/id/job/84341355
84783241,Quality Assurance,PT KAPIT MAS,Bali,2025-06-09 12:15:22,https://id.jobstreet.com/id/job/84783241
84775589,Underwriting Staff,PT.INTERNATIONAL SERVICES PACIFIC CROSS,Central Jakarta,2025-06-09 12:15:22,https://id.jobstreet.com/id/job/84775589
84530328,MEP -Critical Operations Supervisor (Batam),CBRE,Batam,2025-05-28 12:15:22,https://id.jobstreet.com/id/job/84530328
84839563,Business Development Manager,PT Aten Technology Indonesia,Jakarta,2025-06-11 12:15:22,https://id.jobstreet.com/id/job/84839563
84857558,Project Support & Administration,"PT Bank JTrust Indonesia, Tbk",Central Jakarta,2025-06-12 12:15:22,https://id.jobstreet.com/id/job/84857558
81512533,Software Engineer - iOS,PT Trinusa Travelindo,Jakarta,2025-05-15 12:15:22,https://id.jobstreet.com/id/job/81512533
84483645,Data Center Shift Technician/ Teknisi Shift (Batam),PT CBRE Consultancy Services,Pekanbaru,2025-05-26 12:15:22,https://id.jobstreet.com/id/job/84483645
84323101,Mining Engineer (Tembagapura - Papua),PT Petrosea Tbk,Tembagapura,2025-05-19 12:15:22,https://id.jobstreet.com/id/job/84323101
80617025,Associate - Senior Associate - IFS - Application Development,PwC Indonesia,Jakarta,2025-05-15 12:15:22,https://id.jobstreet.com/id/job/80617025
84499785,Mobile Developer (Android) (6 Months Contract),"PT. Trimegah Sekuritas Indonesia, Tbk",South Jakarta,2025-05-27 12:15:22,https://id.jobstreet.com/id/job/84499785
84452224,Facility Supervisor ( GA ),PT Gameloft Indonesia (Yogyakarta),Yogyakarta Special Region,2025-05-24 12:15:22,https://id.jobstreet.com/id/job/84452224
84845719,Head of Marketing Development BPM,PT Adira Dinamika Multi Finance Tbk,Jakarta,2025-06-11 12:15:22,https://id.jobstreet.com/id/job/84845719
84353677,TKDN SPECIALIST,PT Korosi Specindo,Central Jakarta,2025-05-20 12:15:22,https://id.jobstreet.com/id/job/84353677
84773192,Manager Purchasing (manufaktur),PT Kemenangan,Central Jakarta,2025-06-09 12:15:22,https://id.jobstreet.com/id/job/84773192
84388712,Security Engineer - Product Security,PT Trinusa Travelindo,Jakarta,2025-05-21 12:15:22,https://id.jobstreet.com/id/job/84388712
84465958,TECHNICAL ANALYST,PT Mindo Small Business Solutions,Yogyakarta Special Region,2025-05-26 12:15:22,https://id.jobstreet.com/id/job/84465958
84497941,Engineering & Photography Intern Mojokerto,ASIA PULP AND PAPER,Mojokerto,2025-05-27 12:15:22,https://id.jobstreet.com/id/job/84497941
84057378,Senior Product Analyst,PT Trinusa Travelindo,Jakarta,2025-05-15 12:15:22,https://id.jobstreet.com/id/job/84057378
84863258,Key Account Manager - Based in Medan / Pekanbaru,PT SEW Eurodrive Indonesia,Medan,2025-06-12 12:15:22,https://id.jobstreet.com/id/job/84863258
81372118,Senior Digital and Embedded Lending Risk Lead,PT Amartha Mikro Fintek (Jakarta),Kebayoran Lama,2025-05-15 12:15:22,https://id.jobstreet.com/id/job/81372118
84774077,Product Design Specialist (NPD CAD & CAM),PT Doulton,Balaraja,2025-06-09 12:15:22,https://id.jobstreet.com/id/job/84774077
84353306,Demand Planner Staff,PT. Bangkit Lakuliner Indonesia,South Jakarta,2025-05-20 12:15:22,https://id.jobstreet.com/id/job/84353306
84247613,Sales Engineer (Open to Fresh Graduate) - Trading - Jakarta (B-119138),RGF HR Agent Indonesia,Central Jakarta,2025-05-15 12:15:22,https://id.jobstreet.com/id/job/84247613
84812542,Procurement Officer (Lubuk Gaung),"PT SMART,Tbk",Dumai,2025-06-10 12:15:22,https://id.jobstreet.com/id/job/84812542
84271690,Backend Developer,PT. Padepokan Tujuh Sembilan,West Jakarta,2025-05-19 12:15:22,https://id.jobstreet.com/id/job/84271690
84806734,Purchasing Secretary (English Speaker),,Jakarta,2025-06-10 12:15:22,https://id.jobstreet.com/id/job/84806734
84311531,Product Manager (with Crypto Data Insight Focus) — Moonbot,,Jakarta,2025-05-19 12:15:22,https://id.jobstreet.com/id/job/84311531
83020236,FY25 - Assurance - Manager & Senior Manager - IT Cybersecurity,PwC Indonesia,Jakarta,2025-05-15 12:15:22,https://id.jobstreet.com/id/job/83020236
84435511,Production Maintenance Technician,PT Smoore Technology Indonesia,East Java,2025-05-23 12:15:22,https://id.jobstreet.com/id/job/84435511
84223284,Demand & User Growth Analytics Lead,PT Solusi Transportasi Indonesia,Jakarta,2025-05-15 12:15:22,https://id.jobstreet.com/id/job/84223284
84804737,Kepala Teknik,PT Surya Tirta Mulia,Mojokerto,2025-06-10 12:15:22,https://id.jobstreet.com/id/job/84804737
84289791,Region Analytics Associate,PT Aplikasi Karya Anak Bangsa (GO-JEK Indonesia),Jakarta,2025-05-17 12:15:22,https://id.jobstreet.com/id/job/84289791
84382422,Foreman Engineering,Geo Energy Group,North Musi Rawas,2025-05-21 12:15:22,https://id.jobstreet.com/id/job/84382422
83684934,Electrical Engineer Junior / Teknisi Listrik,PT Daya Alam Surya,North Jakarta,2025-05-16 12:15:22,https://id.jobstreet.com/id/job/83684934
84237824,Part Coordinator Staff,PT. Agrinesia Raya,Bogor,2025-05-15 12:15:22,https://id.jobstreet.com/id/job/84237824
84539288,Raw Material Quality Control Supervisor,PT Minda Asean Automotive,Karawang,2025-05-28 12:15:22,https://id.jobstreet.com/id/job/84539288
84862611,Staff R&D,PT Youmi Medika Industri,Central Java,2025-06-12 12:15:22,https://id.jobstreet.com/id/job/84862611
84776440,Factory Maintenance Supervisor,PT Kartika Sari Indonesia,Bandung,2025-06-09 12:15:22,https://id.jobstreet.com/id/job/84776440
84297890,Technical Support & DevOps - ID,Hongkong Xiqi International,Jakarta,2025-05-18 12:15:22,https://id.jobstreet.com/id/job/84297890
84539347,MEP -Critical Facilities Ops. Supervisor (Batam),PT CBRE Consultancy Services,Dumai,2025-05-28 12:15:22,https://id.jobstreet.com/id/job/84539347
84652026,Sourcing Procurement Supervisor,PT Arya Noble,South Jakarta,2025-06-03 12:15:22,https://id.jobstreet.com/id/job/84652026
84815641,Mechanical Engineer - Workshop - Bekasi - WFO (ID : 669544),PT. PERSOLKELLY Recruitment Indonesia,Bekasi,2025-06-10 12:15:22,https://id.jobstreet.com/id/job/84815641
84579969,IT Infrastructure Manager,,South Jakarta,2025-05-30 12:15:22,https://id.jobstreet.com/id/job/84579969
84346763,Product Owner,Steradian Data Optima,Jakarta,2025-05-20 12:15:22,https://id.jobstreet.com/id/job/84346763
84398208,IT Senior System Analyst,PT Home Credit Indonesia,South Jakarta,2025-05-22 12:15:22,https://id.jobstreet.com/id/job/84398208
84695173,ERP Technical Consultant - IT Consulting - Jakarta (B-118692),RGF HR Agent Indonesia,South Jakarta,2025-06-04 12:15:22,https://id.jobstreet.com/id/job/84695173
84248061,PPIC Manager - Manufacture - Pasuruan - WFO,PT. PERSOLKELLY Recruitment Indonesia,Pasuruan,2025-05-15 12:15:22,https://id.jobstreet.com/id/job/84248061
84404616,Solution Design Specialist,PT. CJ Logistics Indonesia,North Jakarta,2025-05-22 12:15:22,https://id.jobstreet.com/id/job/84404616
84522405,IT SUPERVISOR - ERP&WMS IMPLEMENTOR,PT Chemico Surabaya,Sidoarjo,2025-05-28 12:15:22,https://id.jobstreet.com/id/job/84522405
84309187,Head of Geothermal Subsurface,"PT Dian Swastatika Sentosa, Tbk",Jakarta,2025-05-19 12:15:22,https://id.jobstreet.com/id/job/84309187
84367619,Planning Specialist,PT BYD AUTO INDONESIA,Subang,2025-05-21 12:15:22,https://id.jobstreet.com/id/job/84367619
84525024,Staff Purchasing (Kontraktor Pertambangan & Alat Berat),PT Belengkong Mineral Resources,North Jakarta,2025-06-02 12:15:22,https://id.jobstreet.com/id/job/84525024
84802194,Country Manager,Korea Trade Investment Promotion Agency,Jakarta,2025-06-10 12:15:22,https://id.jobstreet.com/id/job/84802194
84805142,"Tank Yard Officer (Tarjun, South Kalimantan)","PT SMART,Tbk",South Kalimantan,2025-06-10 12:15:22,https://id.jobstreet.com/id/job/84805142
84636550,"Head, Product Commercialization",,Central Jakarta,2025-06-02 12:15:22,https://id.jobstreet.com/id/job/84636550
84304034,ENGINEERING / SALES ENGINEERING,PT Fleksindo Wijaya Teknik,East Jakarta,2025-05-19 12:15:22,https://id.jobstreet.com/id/job/84304034
84812457,Carbon Project Officer,"PT SMART,Tbk",Central Jakarta,2025-06-10 12:15:22,https://id.jobstreet.com/id/job/84812457
84799698,HR Training Manager,PT. LIANMEI INDUSTRIAL INDONESIA,Surakarta,2025-06-10 12:15:22,https://id.jobstreet.com/id/job/84799698
84784048,Mill Audit,PT Union Sampoerna Triputra Persada,South Jakarta,2025-06-09 12:15:22,https://id.jobstreet.com/id/job/84784048
77969264,Associate - Enterprise System and Transformation Assurance,PwC Indonesia,Jakarta,2025-05-15 12:15:22,https://id.jobstreet.com/id/job/77969264
84482553,"Engineering, Electrical, Mechanical, Architechture/Drafter.",PT Sepuluh Sumber Anugrah,Banten,2025-05-26 12:15:22,https://id.jobstreet.com/id/job/84482553
84723777,Factory Manager - Steel Manufacture - Karawang (B-119973),RGF HR Agent Indonesia,Karawang,2025-06-05 12:15:22,https://id.jobstreet.com/id/job/84723777
84250644,Production Manager,PT Arisamandiri Pratama,Demak Regency,2025-05-17 12:15:22,https://id.jobstreet.com/id/job/84250644
