Job_ID,Role,Company,Location,Publish_Time,URL
84266811,Data Engineer Supervisor,PT. Cakra Radha Mustika,East Jakarta,2025-05-16 12:15:22,https://id.jobstreet.com/id/job/84266811
84876562,Data Engineer,"PT Japfa Comfeed Indonesia, Tbk",South Jakarta,2025-06-12 12:15:22,https://id.jobstreet.com/id/job/84876562
84696656,Data Engineer,"PT. Metrodata Electronics, Tbk",West Jakarta,2025-06-04 12:15:22,https://id.jobstreet.com/id/job/84696656
84906678,Junior Engineer,PT Supra Aluminium Industri,Pandaan,2025-06-13 12:15:22,https://id.jobstreet.com/id/job/84906678
84835847,Data Specialist (Engineer/Scientist/Governance),PT PESONNA OPTIMA JASA,Central Jakarta,2025-06-11 12:15:22,https://id.jobstreet.com/id/job/84835847
84715077,Data Engineer,PT SWAPRO INTERNATIONAL,East Jakarta,2025-06-05 12:15:22,https://id.jobstreet.com/id/job/84715077
84832865,Data Center Extra Low Voltage (ELV) Engineer,PT DIAN GRAHA ELEKTRIKA,Jakarta,2025-06-11 12:15:22,https://id.jobstreet.com/id/job/84832865
84663427,Data Engineer Management Cost,SCG,South Jakarta,2025-06-03 12:15:22,https://id.jobstreet.com/id/job/84663427
84692696,Data Engineer (ETL Developer),PT Informasi Teknologi Indonesia,South Jakarta,2025-06-04 12:15:22,https://id.jobstreet.com/id/job/84692696
84649780,AI & Data Engineer,Deep Symbolics Indonesia,Jakarta,2025-06-03 12:15:22,https://id.jobstreet.com/id/job/84649780
84904185,EHS Manager,PT Avery Dennison,South Cikarang,2025-06-13 12:15:22,https://id.jobstreet.com/id/job/84904185
84532584,Data Engineer,Siloam Hospitals Group (Tbk),Karawaci,2025-05-28 12:15:22,https://id.jobstreet.com/id/job/84532584
84662814,Data Engineer (ETL SSIS),PT Bumi Amartha Teknologi Mandiri,South Jakarta,2025-06-03 12:15:22,https://id.jobstreet.com/id/job/84662814
84645827,Data Analyst Staff,PT Perindustrian Bapak Djenggot (Orang Tua Group),West Jakarta,2025-06-03 12:15:22,https://id.jobstreet.com/id/job/84645827
84483011,Data Engineer,PT Solusi Pembayaran Elektronik,Cipondoh,2025-05-26 12:15:22,https://id.jobstreet.com/id/job/84483011
84382912,Data Engineer,PT IDStar Cipta Teknologi,Jakarta,2025-05-21 12:15:22,https://id.jobstreet.com/id/job/84382912
84263719,Data Engineer (Yogyakarta),PT Dipo Star Finance,Yogyakarta,2025-05-16 12:15:22,https://id.jobstreet.com/id/job/84263719
84442480,QNB Indonesia Aspire Internship Program (IT Internship),PT Bank QNB Indonesia Tbk,Central Jakarta,2025-05-23 12:15:22,https://id.jobstreet.com/id/job/84442480
84845967,Mechanical Engineer,PT Softex Indonesia,Karawang,2025-06-11 12:15:22,https://id.jobstreet.com/id/job/84845967
84275159,Data Engineer,PT Indocyber Global Teknologi,Jakarta,2025-05-16 12:15:22,https://id.jobstreet.com/id/job/84275159
83584141,Data Engineer,"PT. BFI FINANCE INDONESIA, Tbk",Tangerang District,2025-05-15 12:15:22,https://id.jobstreet.com/id/job/83584141
84905630,Warranty & Quality Planning Staff,PT Mitsubishi Motors Krama Yudha Indonesia,Cikarang Pusat,2025-06-13 12:15:22,https://id.jobstreet.com/id/job/84905630
84778124,Head of ME (Mechanical engineering),PT Tri Sinar Purnama,Semarang,2025-06-09 12:15:22,https://id.jobstreet.com/id/job/84778124
84472215,"General Manager, Renewable Energy",LYS ENERGY SOLUTIONS PTE. LTD.,Bekasi,2025-05-26 12:15:22,https://id.jobstreet.com/id/job/84472215
84798931,Production Staff (Assistant Leader),PT Maxxis International Indonesia,Cikarang,2025-06-10 12:15:22,https://id.jobstreet.com/id/job/84798931
84921987,Grease Formulation Analyst (Saponification R&D),CHAMPOIL Indonesia,North Jakarta,2025-06-14 11:15:22,https://id.jobstreet.com/id/job/84921987
84690202,Production Engineering Engineer,PT TDK ELECTRONICS INDONESIA,Batam,2025-06-04 12:15:22,https://id.jobstreet.com/id/job/84690202
84254883,Data Analyst Staff,Agung Sedayu Group,North Jakarta,2025-05-16 12:15:22,https://id.jobstreet.com/id/job/84254883
84528660,Product Flavorist/Testing Engineer (Surabaya Placement),PT. Warlbor International Indonesia,Surabaya,2025-05-28 12:15:22,https://id.jobstreet.com/id/job/84528660
84813814,IT Data Center - System Engineer Officer,OTO Group,South Jakarta,2025-06-10 12:15:22,https://id.jobstreet.com/id/job/84813814
84904601,System Engineer,APTECH RECRUITMENT SERVICE,Jakarta,2025-06-13 12:15:22,https://id.jobstreet.com/id/job/84904601
84916129,Warehouse Staff,Superior Prima Sukses Tbk,Central Java,2025-06-14 02:15:22,https://id.jobstreet.com/id/job/84916129
84697196,PURCHASING ENGINEERING,PT. OCWSB Pratama Indonesia,West Jakarta,2025-06-05 12:15:22,https://id.jobstreet.com/id/job/84697196
84512076,Lead Data Engineer,PT Solusi Pembayaran Elektronik,Cipondoh,2025-05-27 12:15:22,https://id.jobstreet.com/id/job/84512076
84313097,Supervisor Finance Accounting & Tax (FAT),PT Patria Menara Abadi,South Jakarta,2025-06-13 12:15:22,https://id.jobstreet.com/id/job/84313097
84832544,Data Center Facility Fire Protection System,PT DIAN GRAHA ELEKTRIKA,Jakarta,2025-06-11 12:15:22,https://id.jobstreet.com/id/job/84832544
84887433,Data Center & System Management Specialist,PT SGMW Motor Indonesia,Cikarang Pusat,2025-06-13 12:15:22,https://id.jobstreet.com/id/job/84887433
84921866,Polymer Chemistry and Materials Science Specialist,CHAMPOIL Indonesia,North Jakarta,2025-06-14 11:15:22,https://id.jobstreet.com/id/job/84921866
84835791,Junior Backend Engineer,PT. SUMMIT GLOBAL TEKNOLOGI,Tangerang,2025-06-11 12:15:22,https://id.jobstreet.com/id/job/84835791
84878664,Production Data Clerk,PT Smoore Technology Indonesia,Malang,2025-06-12 12:15:22,https://id.jobstreet.com/id/job/84878664
84350265,Senior Manufacturing Systems Developer (OTG),PT Excelitas Technologies Batam,Batam,2025-05-20 12:15:22,https://id.jobstreet.com/id/job/84350265
84412798,Senior Data Engineer,PT Amartha Mikro Fintek (Jakarta),Kebayoran Lama,2025-05-22 12:15:22,https://id.jobstreet.com/id/job/84412798
84353021,IoT Backend Engineer,PT. Bobobox Mitra Indonesia,Bandung,2025-05-20 12:15:22,https://id.jobstreet.com/id/job/84353021
84907312,POWERBI ENGINEER,PT Delta Marine Consultants,Bekasi,2025-06-13 12:15:22,https://id.jobstreet.com/id/job/84907312
84846013,Data Analitics,PT Kinarya Alihdaya Mandiri,South Jakarta,2025-06-11 12:15:22,https://id.jobstreet.com/id/job/84846013
84908095,Senior Software Engineer in Test (SDET),PT BLANKA JAYA INDONESIA,South Jakarta,2025-06-13 12:15:22,https://id.jobstreet.com/id/job/84908095
84719327,ENDP _IT Data System Engineer Of HSE Mining (Location: Kalsel),,South Kalimantan,2025-06-05 12:15:22,https://id.jobstreet.com/id/job/84719327
84866297,DevOps Engineer,PT Depoguna Bangunan Online,Jakarta,2025-06-12 12:15:22,https://id.jobstreet.com/id/job/84866297
84843604,Project Manager – Web Application Development,PT Radian Solusi Integral,South Jakarta,2025-06-11 12:15:22,https://id.jobstreet.com/id/job/84843604
84847681,Credit Risk Analyst (Fintech Data Scientist),PT Kuaikuai Tech Indonesia,West Jakarta,2025-06-11 12:15:22,https://id.jobstreet.com/id/job/84847681
84709914,Data Analyst Staff,PT Sukanda Djaya,Jakarta,2025-06-05 12:15:22,https://id.jobstreet.com/id/job/84709914
84249725,Planning Engineer,PT Oil States Indonesia,Batam Kota,2025-05-15 12:15:22,https://id.jobstreet.com/id/job/84249725
84346655,Data Analyst,PT Amman Mineral Nusa Tenggara,West Sumbawa,2025-05-20 12:15:22,https://id.jobstreet.com/id/job/84346655
84581731,Data Scientis,PT. IDX CONSULTING,Jakarta,2025-05-30 12:15:22,https://id.jobstreet.com/id/job/84581731
84495663,Capacity & Data Center Infra Engineer,PT Netciti Persada,Tangerang,2025-05-27 12:15:22,https://id.jobstreet.com/id/job/84495663
84896364,Electrical Maintenance- Spring Manufacture - Cikarang - WFO (ID: 662764),PT. PERSOLKELLY Recruitment Indonesia,South Cikarang,2025-06-13 12:15:22,https://id.jobstreet.com/id/job/84896364
84622129,Senior Network Security Engineer,PT Dinamika Sistem Integrasi Solusi,Jakarta,2025-06-02 12:15:22,https://id.jobstreet.com/id/job/84622129
84891805,Geology Geotech Team Leader,Sinarmas Mining,South Sumatra,2025-06-13 12:15:22,https://id.jobstreet.com/id/job/84891805
84842293,Chief Engineer,PT Sodexo Sinergi Indonesia,Karawang,2025-06-11 12:15:22,https://id.jobstreet.com/id/job/84842293
84676774,PRODUCT ENGINEERING ENGINEER,PT Communication Cable Systems Indonesia Tbk,Cilegon,2025-06-04 12:15:22,https://id.jobstreet.com/id/job/84676774
84890789,Compliance & QSHE Manager – Terminal Nusantara,PT. Meratus Line & Group,Surabaya,2025-06-13 12:15:22,https://id.jobstreet.com/id/job/84890789
84919134,Commisioning engineer,PT Modano Energi Indonesia,West Java,2025-06-14 07:15:22,https://id.jobstreet.com/id/job/84919134
84660679,ADMIN IT (ON-SITE),PT. INTERNET PRATAMA INDONESIA TBK,Jakarta,2025-06-03 12:15:22,https://id.jobstreet.com/id/job/84660679
84891280,Network Engineer (Tangerang),PT Karya Solusi Prima Sejahtera,Tangerang,2025-06-13 12:15:22,https://id.jobstreet.com/id/job/84891280
84367193,Environmental & Safety Engineer,PT BYD AUTO INDONESIA,Subang,2025-05-21 12:15:22,https://id.jobstreet.com/id/job/84367193
84847914,Logistic Engineer,PT Anugerah Tangkas Transportindo,West Jakarta,2025-06-11 12:15:22,https://id.jobstreet.com/id/job/84847914
84876187,Quality Assurance Officer,"PT SMART,Tbk",Jakarta,2025-06-12 12:15:22,https://id.jobstreet.com/id/job/84876187
84587155,Senior System Engineer,,South Jakarta,2025-05-30 12:15:22,https://id.jobstreet.com/id/job/84587155
84777317,Admin Marketing,PT. MASUYA GRAHA TRIKENCANA (Surabaya),Malang,2025-06-09 12:15:22,https://id.jobstreet.com/id/job/84777317
84894508,Business Development Analyst,SKINTIFIC,Jakarta,2025-06-13 12:15:22,https://id.jobstreet.com/id/job/84894508
84709226,Warehouse Manager,PT Sinergi Ayu Semesta,Bogor,2025-06-05 12:15:22,https://id.jobstreet.com/id/job/84709226
84534079,Inventory Data Analyst,PT Sukanda Djaya,Cibitung,2025-05-28 12:15:22,https://id.jobstreet.com/id/job/84534079
84722227,Well Site Geologist - Field Geotechnical Engineer,PT Groundcheck Inti Indonesia,Morowali,2025-06-05 12:15:22,https://id.jobstreet.com/id/job/84722227
84146753,Software Engineer – Data Platform,PT Trinusa Travelindo,Jakarta,2025-05-15 12:15:22,https://id.jobstreet.com/id/job/84146753
84659869,IT DATA CENTER (ON-SITE),PT. INTERNET PRATAMA INDONESIA TBK,Jakarta,2025-06-03 12:15:22,https://id.jobstreet.com/id/job/84659869
84281297,"Technician, Project Engineering",ASIA PULP AND PAPER,Karawang,2025-05-16 12:15:22,https://id.jobstreet.com/id/job/84281297
84862408,civil engineer,PT Kashiwabara Engineering Indonesia,South Jakarta,2025-06-12 12:15:22,https://id.jobstreet.com/id/job/84862408
84470537,Quality Control Analyst (Raw Material),PT Hadir Mengharumkan Nusantara,Bekasi,2025-06-05 12:15:22,https://id.jobstreet.com/id/job/84470537
84776738,Junior Process Engineer,PT Tirta Putra Malindo Sejati,Batam,2025-06-09 12:15:22,https://id.jobstreet.com/id/job/84776738
84786088,QUALITY ENGINEER,PT Simatelex Manufactory Batam,Batam,2025-06-09 12:15:22,https://id.jobstreet.com/id/job/84786088
84405349,ETL Developer,PT Adecco Personnel Indonesia,South Jakarta,2025-05-22 12:15:22,https://id.jobstreet.com/id/job/84405349
84844481,Field Service Engineer I (BMS/Energy Building),Honeywell PH/MY/SG/ID (Korn Ferry),Jakarta,2025-06-11 12:15:22,https://id.jobstreet.com/id/job/84844481
84866160,"Intern, Organizational Development",ASIA PULP AND PAPER,Tangerang,2025-06-12 12:15:22,https://id.jobstreet.com/id/job/84866160
84714439,Long Term Material Planner (Supply Chain) - Third Party/ Outsource,Danone Indonesia,South Jakarta,2025-06-05 12:15:22,https://id.jobstreet.com/id/job/84714439
84508053,Business Intelligence - Data Operations,PT Bank Seabank Indonesia,Jakarta,2025-05-27 12:15:22,https://id.jobstreet.com/id/job/84508053
84375677,"IT Intern (2 positions : Application Dev, AI & Machine Learning)",IDS Medical Systems Group,West Jakarta,2025-05-21 12:15:22,https://id.jobstreet.com/id/job/84375677
84902719,DAFTER MECHANICAL DAN FABRIKASI,PT Bodhi Cipta Sentosa,Cilegon,2025-06-13 12:15:22,https://id.jobstreet.com/id/job/84902719
84789095,AI Engineer,PT United Tractors Tbk,Pulo Gadung,2025-06-09 12:15:22,https://id.jobstreet.com/id/job/84789095
84875415,Production Supervisor,PT Jumbo Power International,North Jakarta,2025-06-12 12:15:22,https://id.jobstreet.com/id/job/84875415
84831890,ERP Implementation Associate (Graduate Trainee),POINTSTAR (PSGC),Jakarta,2025-06-11 12:15:22,https://id.jobstreet.com/id/job/84831890
84860178,Quality Engineer,PT Hongfa Electronic Indonesia,South Tangerang,2025-06-12 12:15:22,https://id.jobstreet.com/id/job/84860178
84694168,Application Consultant,PT PROPHIX INDO SOLUSI,West Jakarta,2025-06-04 12:15:22,https://id.jobstreet.com/id/job/84694168
84713384,Junior Project Control,PT Rapid Infrastruktur,South Jakarta,2025-06-05 12:15:22,https://id.jobstreet.com/id/job/84713384
84236062,Data Analyst,A&W Restaurants Indonesia,North Jakarta,2025-05-15 12:15:22,https://id.jobstreet.com/id/job/84236062
84431034,IT Service Desk Engineer - IT Consulting - Jakarta (B-119547),RGF HR Agent Indonesia,South Jakarta,2025-05-23 12:15:22,https://id.jobstreet.com/id/job/84431034
84577119,STAFF IT,PT Gunanusa Eramandiri,South Cikarang,2025-05-30 12:15:22,https://id.jobstreet.com/id/job/84577119
84726151,Vendor Management (Procurement) - Contract,Siloam Hospitals Group (Tbk),Karawaci,2025-06-05 12:15:22,https://id.jobstreet.com/id/job/84726151
84495434,Sales Engineer,PT. Indomitra Prima Lestari,Cikarang,2025-05-27 12:15:22,https://id.jobstreet.com/id/job/84495434
84684916,"IT Support Engineer (Batam, Indonesia Stationed)",Simatelex Manufactory Co Ltd,Batam,2025-06-04 12:15:22,https://id.jobstreet.com/id/job/84684916
84847869,Field Mechanical Engineer,Obayashi-Wijaya Karya-Jaya Konstruksi-JFE Engineering Joint Venture,North Jakarta,2025-06-11 12:15:22,https://id.jobstreet.com/id/job/84847869
83021060,Data Analytics Operation,"PT. BFI FINANCE INDONESIA, Tbk",Tangerang District,2025-05-15 12:15:22,https://id.jobstreet.com/id/job/83021060
84822334,Senior Data Scientist (Product Analytics),PT Solusi Transportasi Indonesia,Jakarta,2025-06-11 12:15:22,https://id.jobstreet.com/id/job/84822334
84871797,AI IMPLEMENTATION SPECIALIST (ARTIFICIAL INTELLIGENCE),PT Trimitra Putra Mandiri,South Jakarta,2025-06-12 12:15:22,https://id.jobstreet.com/id/job/84871797
84729613,Estimator Machining,PT Herman Industries,Cikupa,2025-06-06 12:15:22,https://id.jobstreet.com/id/job/84729613
84249527,Sourcing Engineer (Stationed Batam Indonesia),Wise Ally Holdings Limited,Batam,2025-05-15 12:15:22,https://id.jobstreet.com/id/job/84249527
84246991,Senior (Full Stack) Software Engineer,PT Formulatrix Indonesia,Salatiga,2025-05-15 12:15:22,https://id.jobstreet.com/id/job/84246991
84477577,IT Infrastructure Specialist REDHAT JUNIPER,PT Palung Data Sistem,Jakarta,2025-05-26 12:15:22,https://id.jobstreet.com/id/job/84477577
84325270,Mechanical Engineering,PT Donlim Technology Indonesia,Demak,2025-05-20 12:15:22,https://id.jobstreet.com/id/job/84325270
84649489,Team Leader - Engineering (Coil winding operations),PT Patco Elektronik Teknologi,Cikarang,2025-06-03 12:15:22,https://id.jobstreet.com/id/job/84649489
84528483,Mechanical Engineer,PT Prakarsalanggeng Majubersama,South Jakarta,2025-05-28 12:15:22,https://id.jobstreet.com/id/job/84528483
84242815,Process Integration Engineer (Stationed Batam Indonesia),Wise Ally Holdings Limited,Batam,2025-05-15 12:15:22,https://id.jobstreet.com/id/job/84242815
79647458,Application Developer Jr.,"PT. Metrodata Electronics, Tbk",Jakarta,2025-05-15 12:15:22,https://id.jobstreet.com/id/job/79647458
84875105,Kualifikasi Document Control Staff / Quality Control Staff (ISO 9001 & 45001),PT Promisco Sinergi Indonesia,Bandung,2025-06-12 12:15:22,https://id.jobstreet.com/id/job/84875105
84784252,SALES ENGINEER,PT Simtex Mechatronic Indojaya,West Jakarta,2025-06-09 12:15:22,https://id.jobstreet.com/id/job/84784252
84631023,Leaf Operation Planner,PT TEMPU REJO,Jember,2025-06-02 12:15:22,https://id.jobstreet.com/id/job/84631023
84406788,AI Engineer,PT Informasi Teknologi Indonesia,Mampang Prapatan,2025-05-22 12:15:22,https://id.jobstreet.com/id/job/84406788
84628784,Artificial Intelligence (AI) & Machine Learning Engineer (ML),PT. Bukit Silikon Indonesia,Grogol Petamburan,2025-06-02 12:15:22,https://id.jobstreet.com/id/job/84628784
84541688,Java Developer,PT Datacaraka Solusindo,Jakarta,2025-05-28 12:15:22,https://id.jobstreet.com/id/job/84541688
84412751,Web scraper Engineer,PT. MONARCH INTI TEKNOLOGI,West Jakarta,2025-05-24 12:15:22,https://id.jobstreet.com/id/job/84412751
83068821,Data Scientist - Pricing,PT Trinusa Travelindo,Jakarta,2025-05-15 12:15:22,https://id.jobstreet.com/id/job/83068821
84312531,Engineer,Waterindo Primatech Bekasi (WPB),Cibitung,2025-05-19 12:15:22,https://id.jobstreet.com/id/job/84312531
84530193,QUALITY ASSURANCE (QA) STAFF,PT Epson Batam,Batam,2025-05-28 12:15:22,https://id.jobstreet.com/id/job/84530193
84507109,Process Engineer,PT Formulatrix Indonesia,Central Java,2025-05-27 12:15:22,https://id.jobstreet.com/id/job/84507109
84847155,Lecturer in IT,Jakarta International College,West Jakarta,2025-06-11 12:15:22,https://id.jobstreet.com/id/job/84847155
84679267,Sales Admin/Coordinator,PT. Newark Engineering Indonesia,Jakarta,2025-06-04 12:15:22,https://id.jobstreet.com/id/job/84679267
84719291,AI Team Coordinator,PT Akulaku Silvrr Indonesia,Jakarta,2025-06-05 12:15:22,https://id.jobstreet.com/id/job/84719291
84785028,Building & Facility Maintenance Dept Head - SCN Logistics Groups,PT Citra Tubindo Tbk,Batam,2025-06-09 12:15:22,https://id.jobstreet.com/id/job/84785028
84717239,Head of Production Line,PT Mitra Prodin,Jembrana,2025-06-05 12:15:22,https://id.jobstreet.com/id/job/84717239
84903465,Data Center Project Manager - Mandarin Speaking,PT Trust Recruit Indonesia,South Jakarta,2025-06-13 12:15:22,https://id.jobstreet.com/id/job/84903465
84598567,Database Section Head (IT),,West Jakarta,2025-05-30 12:15:22,https://id.jobstreet.com/id/job/84598567
84305864,Senior Metallurgist - Slag Concentrator Plant,PT Amman Mineral Nusa Tenggara,West Sumbawa,2025-05-19 12:15:22,https://id.jobstreet.com/id/job/84305864
83648798,Senior Data Scientist (Analytics),PT Solusi Transportasi Indonesia,Jakarta,2025-05-15 12:15:22,https://id.jobstreet.com/id/job/83648798
84560405,Lead Data Scientist (Analytics),PT Solusi Transportasi Indonesia,Jakarta,2025-05-29 12:15:22,https://id.jobstreet.com/id/job/84560405
84813573,Threat Hunting Engineer,PT. Lintas Teknologi Indonesia,South Jakarta,2025-06-10 12:15:22,https://id.jobstreet.com/id/job/84813573
84635927,Senior Estimator,PT TETRA DESAINDO,Central Jakarta,2025-06-02 12:15:22,https://id.jobstreet.com/id/job/84635927
84243647,DevOps (Oracle) Engineer,PT Avows Technologies,South Jakarta,2025-05-15 12:15:22,https://id.jobstreet.com/id/job/84243647
84725119,Senior Data Analyst - Geospatial,PT Aplikasi Karya Anak Bangsa (GO-JEK Indonesia),Jakarta,2025-06-05 12:15:22,https://id.jobstreet.com/id/job/84725119
84500636,Mechanical Robotics Engineer,PT Formulatrix Indonesia,Central Java,2025-05-27 12:15:22,https://id.jobstreet.com/id/job/84500636
84667148,Internal Systems Integrator & In-House Automation Consultant,,South Jakarta,2025-06-04 12:15:22,https://id.jobstreet.com/id/job/84667148
84658772,ANALYST STRATEGIC PLANNING,PT Amman Mineral Nusa Tenggara,West Sumbawa,2025-06-03 12:15:22,https://id.jobstreet.com/id/job/84658772
84318083,Robotics and Coding Trainer,PT Indobit Digital Raya,Tangerang,2025-05-19 12:15:22,https://id.jobstreet.com/id/job/84318083
84713795,AI Solutions Architect - Tech Company (Mandarin-speaking),PT Michael Page Internasional Indonesia,Jakarta,2025-06-05 12:15:22,https://id.jobstreet.com/id/job/84713795
84813073,Kotlin Backend Engineer,PT Majura Digital Solusi,Surabaya,2025-06-13 12:15:22,https://id.jobstreet.com/id/job/84813073
84651017,COST ESTIMATOR,PT Amman Mineral Nusa Tenggara,West Sumbawa,2025-06-03 12:15:22,https://id.jobstreet.com/id/job/84651017
84896889,Network Security Engineer (L3),PT ABISHAR TECHNOLOGIES INDONESIA,Jakarta,2025-06-13 12:15:22,https://id.jobstreet.com/id/job/84896889
84780151,Field Service Non-Mining Deputy Manager,PT KSB Indonesia,Cikarang,2025-06-09 12:15:22,https://id.jobstreet.com/id/job/84780151
84782578,Senior Backend Developer (Rust),Tripedge,Jakarta,2025-06-09 12:15:22,https://id.jobstreet.com/id/job/84782578
84538326,IT Business Analyst,PT Nextalent Talenta Nusantara,Jakarta,2025-05-28 12:15:22,https://id.jobstreet.com/id/job/84538326
84336598,Project Manager,,Pasuruan,2025-05-20 12:15:22,https://id.jobstreet.com/id/job/84336598
84229709,Data Scientist,,South Jakarta,2025-05-15 12:15:22,https://id.jobstreet.com/id/job/84229709
84875191,QC Lean Analyst - Manufacture - Karawang (B-120220),RGF HR Agent Indonesia,Karawang,2025-06-12 12:15:22,https://id.jobstreet.com/id/job/84875191
84915343,"Software Engineer, Fullstack (Payment)",PT Solusi Transportasi Indonesia,Jakarta,2025-06-13 23:15:22,https://id.jobstreet.com/id/job/84915343
84652945,Engineer Staff,PT.SINOMA DEVELOPMENT INDONESIA,South Jakarta,2025-06-03 12:15:22,https://id.jobstreet.com/id/job/84652945
84368182,Data Scientist,PT. Padepokan Tujuh Sembilan,Central Jakarta,2025-05-21 12:15:22,https://id.jobstreet.com/id/job/84368182
84470448,Branch Manager,PT Wedison Green Energy Group,Bali,2025-05-26 12:15:22,https://id.jobstreet.com/id/job/84470448
84272029,"Project Coordinator (Canggu, Bali)",The Global Business Factory,Bali,2025-05-19 12:15:22,https://id.jobstreet.com/id/job/84272029
84363685,AI Engineer,PT IT Group Indonesia,Jakarta,2025-05-21 12:15:22,https://id.jobstreet.com/id/job/84363685
84915342,"Software Engineer, Fullstack - Payments Experience",PT Solusi Transportasi Indonesia,Sawah Besar,2025-06-13 23:15:22,https://id.jobstreet.com/id/job/84915342
84778519,Production Manager (Contract),PT Ecolab International Indonesia,Cikarang,2025-06-09 12:15:22,https://id.jobstreet.com/id/job/84778519
84779126,Estimator Supervisor (Shipping),SOECHI GROUP,Jakarta,2025-06-09 12:15:22,https://id.jobstreet.com/id/job/84779126
84785197,New Product Development,PT Garuda Metalindo,North Jakarta,2025-06-09 12:15:22,https://id.jobstreet.com/id/job/84785197
84828883,Sales & Marketing Manager,PT Jayatama Selaras,Cileungsi,2025-06-11 12:15:22,https://id.jobstreet.com/id/job/84828883
84873527,Sales Leader,PT Indonesia Applicad,Kelapa Gading,2025-06-12 12:15:22,https://id.jobstreet.com/id/job/84873527
84395471,Process Engineering Manager (Yield Improvement – Electronics Manufacturing),PT TDK ELECTRONICS INDONESIA,Batam,2025-05-22 12:15:22,https://id.jobstreet.com/id/job/84395471
84866406,Mill Manager,Eagle High Plantations,East Kalimantan,2025-06-12 12:15:22,https://id.jobstreet.com/id/job/84866406
84814447,Sales Manager,PT Metrix Inspira,South Tangerang,2025-06-10 12:15:22,https://id.jobstreet.com/id/job/84814447
84599587,PPIC / Material Planning Supervisor,,Bekasi,2025-05-30 12:15:22,https://id.jobstreet.com/id/job/84599587
84247099,Server Back-Up Engineer (Azure),"PT. Metrodata Electronics, Tbk",Jakarta,2025-05-15 12:15:22,https://id.jobstreet.com/id/job/84247099
84716118,Sales Engineer (Area Batam),PT Goltens Jakarta,Batam,2025-06-05 12:15:22,https://id.jobstreet.com/id/job/84716118
84387031,Senior Data Scientist (Analytics) - Transaction Platform,PT Solusi Transportasi Indonesia,Jakarta,2025-05-22 12:15:22,https://id.jobstreet.com/id/job/84387031
84816358,MANAGER QC,PT Changhong Electric Indonesia,Cikupa,2025-06-10 12:15:22,https://id.jobstreet.com/id/job/84816358
84817062,Technical Support (Mandarin Speaker),PT Sisindokom Lintasbuana,Central Jakarta,2025-06-10 12:15:22,https://id.jobstreet.com/id/job/84817062
84726723,Mobile Developer (iOS) (6 Months Contract),"PT. Trimegah Sekuritas Indonesia, Tbk",South Jakarta,2025-06-05 12:15:22,https://id.jobstreet.com/id/job/84726723
84879075,Cloud Engineer,PT Accelist Lentera Indonesia,West Jakarta,2025-06-13 12:15:22,https://id.jobstreet.com/id/job/84879075
84412141,Senior QA Engineer (Manual Testing),,South Jakarta,2025-05-22 12:15:22,https://id.jobstreet.com/id/job/84412141
84622520,"Engineer, Quality Assurance / Technician (Batam, Indonesia Stationed)",Simatelex Manufactory Co Ltd,Batam,2025-06-02 12:15:22,https://id.jobstreet.com/id/job/84622520
84072388,Production Planning and Control Mandarin Speaker,,Tangerang,2025-06-05 12:15:22,https://id.jobstreet.com/id/job/84072388
84407454,Secretary & Personal Assistant to Director - SURABAYA,Kitchenware Indonesia,Surabaya,2025-05-22 12:15:22,https://id.jobstreet.com/id/job/84407454
84712240,Inprocess Specialist,PT Prasadha Pamunah Limbah Industri,Bogor,2025-06-05 12:15:22,https://id.jobstreet.com/id/job/84712240
84479152,SAP Application Head,PT Tata Consultancy Services Indonesia,Jakarta,2025-05-26 12:15:22,https://id.jobstreet.com/id/job/84479152
84623298,MEP Engineer (Mandarin Speaker) - Real Estate -Kalimantan(A-119724),RGF HR Agent Indonesia,East Kalimantan,2025-06-02 12:15:22,https://id.jobstreet.com/id/job/84623298
84681345,Part Analyst,"PT SMART,Tbk",Central Jakarta,2025-06-04 12:15:22,https://id.jobstreet.com/id/job/84681345
84408840,Technical Sales (Metal detector & Checkweigher),PT Kamindo Makmur,Jakarta,2025-05-22 12:15:22,https://id.jobstreet.com/id/job/84408840
84409182,Warranty Officer,PT Mitra Angkutan Sejati,North Jakarta,2025-05-22 12:15:22,https://id.jobstreet.com/id/job/84409182
84688912,Secretary,PT. SHINSUNG ENC INDONESIA,Bekasi Regency,2025-06-04 12:15:22,https://id.jobstreet.com/id/job/84688912
84662409,Site Reliability Engineer [Malang],Shipper,Malang,2025-06-03 12:15:22,https://id.jobstreet.com/id/job/84662409
84394289,CIVIL ENGINEER,PT Surya Sakti Sukses,Tangerang,2025-05-22 12:15:22,https://id.jobstreet.com/id/job/84394289
84871656,HARDLINE LAB ENGINEER,EUROFINS MODERN TESTING SERVICES CPT INDONESIA,Tangerang,2025-06-13 12:15:22,https://id.jobstreet.com/id/job/84871656
84802778,Purchasing Section Head,,Karawang,2025-06-10 12:15:22,https://id.jobstreet.com/id/job/84802778
