Job_ID,Role,Company,Location,Publish_Time,URL,job_desc,salary,work_type,country
85779459,Data Warehouse Engineer,PT Bali Towerindo Sentra Tbk,Central Jakarta,2025-07-15 16:17:33,https://id.jobstreet.com/id/job/85779459,"Responsibilities :; Design, build, and maintain the company’s source of truth (data lake, data warehouse, and data mart), dashboarding/reporting platforms, and/or any other data products; Work closely with BI analysts and data scientists to implement a variety of descriptive and predictive analytic solutions; Work closely with the product and engineering team to ensure the data ecosystem quality and accountability; Requirements :; Candidate must possess at least bachelor degree in Computer Science or Information Technology; At least 1-2 years of experience as data engineer (have experience data science course online school); Proficient with a variety of data engineering ETL Tools (Pentaho, Talend, SSIS, etc); Good understanding of the basics of data pipeline, and experience in implementing data-lake/data-warehouse/data-mart, with most recent data tech-stacks; Firm grasp in SQL Queries.",,Full time,indonesia
85768605,Data Warehouse and Power BI Specialist,PT Bina Karya Prima,North Jakarta,2025-07-15 16:17:33,https://id.jobstreet.com/id/job/85768605,"Jobdesc:; Memastikan efektivitas, integritas, dan ketersediaan data yang digunakan untuk analisis dan pelaporan.; Merancang dan mengembangkan skema data warehouse untuk mendukung kebutuhan bisnis dengan memanfaatkan teknologi baru maupun yang sudah ada.; Menangani proses ekstraksi, transformasi, dan pemuatan data (ETL) ke dalam data warehouse dari berbagai sumber data secara efisien.; Menjaga integritas dan kualitas data yang terjadi di dalam proses ETL.; Membuat dan memelihara metadata untuk memudahkan pemahaman dan penggunaan data, dokumentasi dan pelacakan perubahan.; Memantau dan mengoptimalkan kinerja data warehouse dengan indeks, partisi, dan struktur data lainnya untuk meningkatkan performa. (seperti indexing, partitioning dan lain-lain); Menjaga keamanan data dan memberlakukan kebijakan akses yang tepat dan melakukan audit secara berkala untuk memastikan kepatuhan.; Berkomunikasi secara efektif dengan tim bisnis untuk memahami kebutuhan dan memastikan solusi yang relevan.;  Requirements:; Gelar sarjana atau lebih tinggi dalam bidang terkait seperti Ilmu Komputer, Teknologi Informasi, atau bidang terkait.; Pengalaman kerja minimal 3 tahun dalam pengelolaan data warehouse, ETL, dan pelaporan.; Pengetahuan mendalam tentang desain dan pengembangan skema data warehouse.; Keahlian dalam teknologi data warehouse seperti SQL Server, dan Power BI.; Kemampuan memahami dan mengimplementasikan proses ETL untuk mentransformasi data dari berbagai sumber.; Penguasaan teknik pemeliharaan metadata dan dokumentasi data.; Pengalaman dalam memantau dan mengoptimalkan kinerja data warehouse dengan menggunakan indeks, partisi, dan struktur data lainnya.",,Full time,indonesia
85033491,IT Data Engineer Specialist,PT Bussan Auto Finance (BAF),South Jakarta,2025-06-19 16:17:33,https://id.jobstreet.com/id/job/85033491,"Join our team as an IT Data Engineer Specialist and play a critical role in designing, optimizing, and maintaining our data transformation and warehousing processes. If you’re passionate about data, performance, and collaboration, this role is for you.; Key Responsibilities:; Design, develop, and maintain data transformation processes to cleanse, transform, and aggregate data within the data warehouse.; Optimize and streamline data workflows to ensure efficient processing and storage.; Collaborate with data analysts and business stakeholders to understand data requirements and implement the right data transformations.; Develop and maintain database schemas, tables, and views to support reporting and analytics needs.; Implement data governance policies to ensure data quality, security, and compliance.; Monitor and maintain system performance, troubleshoot issues, and optimize scalability and efficiency in the data warehouse and data pipelines.; Qualifications:; Minimum 3 years of experience in data engineering or a related field.; Strong understanding of data transformation and warehousing concepts and have skill about Python, Bash Linux, SQL Server, PostgresSQL, Docker, Apache Airflow; Familiarity with data governance and security best practices.; Excellent analytical and problem-solving skills.",,Full time,indonesia
85776532,Data Engineer Supervisor,PT. Cakra Radha Mustika,East Jakarta,2025-07-15 16:17:33,https://id.jobstreet.com/id/job/85776532,"Job Description; Establish data engineering frameworks, standards, and guidelines; Design, develop, and maintain efficient and scalable data pipelines; Optimize pipeline performance to reduce latency and improve efficiency; Build and manage scalable, secure, and reliable data storage systems; Provide technical guidance and support to engineering teams; Promote collaboration among teams involved in data initiatives; Ensure compliance with data privacy, security, retention, and disposal regulations; Qualification; Min 4 years of experience in data engineering; Advanced proficiency in SQL and experience with PostgreSQL, MSSQL, or BigQuery; Hands-on experience with ETL tools such as Pentaho, Apache Airflow, Prefect, or dbt; Proficient in Python programming; Experience with cloud platforms (GCP, AWS, Azure); Solid understanding of data warehousing and data modelling concepts; Excellent problem-solving skills and attention to detail; Proven experience in leading and managing a team.; Key Competencies:; SQL; ETL (Extract-Transform-Load); Database and Data Warehouse; Programming Languages (Python, Java, Scala); Cloud Technologies (GCP, AWS, Azure); Data Modelling; BI Tools (Tableau, Power BI)",Rp 10.000.000 – Rp 13.000.000 per month,Full time,indonesia
85364813,Data Engineer,PT IDStar Cipta Teknologi,Jakarta,2025-07-02 16:17:33,https://id.jobstreet.com/id/job/85364813,"Job Description; Core Banking Migration: Participating in the migration of core banking systems.; Reconciliation of Core Banking Migration Results: Ensuring the accuracy and consistency of data after core banking migrations.; ETL DWH Migration: Assisting with the migration of ETL (Extract, Transform, Load) processes for the Data Warehouse.; Regulator Report: Contributing to the generation of reports required by regulators.; Transaction Reconciliation: Performing reconciliation of transactions.; Code Analysis and Workflow Design: Being able to analyze problems and read code, as well as designing workflows using flowcharts.; ETL Tools and Database Understanding: Mastering ETL tools and demonstrating a strong understanding of databases.; Programming: Applying knowledge of one or more programming languages.; Job Qualifications; Education: Minimum D3 (Diploma Three), preferably S1 (Bachelor's degree), or equivalent from any major with experience in the IT field.; Work Experience: Minimum 1 - 5 years of experience in the relevant field.; General Knowledge: Understanding of general banking flow.; Ability to analyze problems and read code.; Ability to design workflows using flowcharts.; Technical Skills (Skillset): Databases and Data Management: Proficiency in SQL, Data Warehouse concepts, MySQL/Postgres/MS SQL, Oracle, DB2, and Big Data technologies.; ETL Tools: Mastery of ETL tools such as ODI, IBM DataStage, Talend, or Pentaho.; Programming Languages: Knowledge of one or more programming languages, with PHP specifically mentioned.; Other Technologies: Familiarity with SOA, ISO 8583, SOAP Web Service, and API.",,Kontrak/Temporer,indonesia
85063591,System Administrator [Enterprise Data Warehouse],PT Triputra Investindo Arya (Triputra Group),South Jakarta,2025-06-20 16:17:33,https://id.jobstreet.com/id/job/85063591,"Job Description:; - Develop and maintain enterprise-wide data warehouse architectures and solutions.; - Collaborate with stakeholders to gather business and data requirements.; - Design and implement ETL (Extract, Transform, Load) processes for data integration.; - Ensure data quality, data governance, and compliance with security standards.; - Optimize data storage, query performance, and reporting efficiency.; - Work closely with BI developers, data analysts, and business users to support data-driven decision-making.; - Monitor, troubleshoot, and tune data warehouse systems and processes.; - Document data models, metadata, and data mapping.; Job Requirement:; - Min. experienced 5 years as a system administrator handling Data Warehouse; - Proficient in and understands the use of SSIS as an ETL tool.; - Knowledgeable and experienced in using SQL.; - Proficient in Windows Server OS.; - Proficient in Linux OS.; - Has strong teamwork skills (Team Player).; - Able to communicate effectively.; - Proactive, creative, and highly initiative-driven in performing continuous improvement.; - Willing to be placed in Banking Industry",,Kontrak/Temporer,indonesia
85252349,Data Engineer (Officer),Dexa Group,South Tangerang,2025-06-30 16:17:33,https://id.jobstreet.com/id/job/85252349,"Job Description:; To analyze and validate data source readiness and integrity; To build and organize a data pipeline (ETL/ELT) procedure for usage in a data warehouse environment; Routine work of monitoring and troubleshooting data processing performance; To identify potential problems and create solutions for more robust and efficient data processing; To assess and implement new cloud technology and big data platforms; Requirements :; A Bachelor's Degree in Computer Science, Information Technology, or relevant disciplines from a top university; Minimum 1 year of working experience as a Data Engineer or ETL Developer; Strong analytical skills & high sense of logical thinking; Experience developing data warehouse schemas with OWB, ODI, or other enterprise ETL technologies; Have expertise and experience with a cloud solution, preferably a GCP Platform.; Willing to work onsite & fulltime in Bintaro, Tangerang Selatan",,Full time,indonesia
84622042,Data Engineer,PT Data Labs Analytics,Central Jakarta,2025-06-30 16:17:33,https://id.jobstreet.com/id/job/84622042,"Requirements:; Minimum 1 year of experience as a Data Engineer.; Proven experience with ETL tool setup and usage, especially Informatica; Talend is a plus.; Experience in building and maintaining data warehouses.; Solid understanding of ELT/ETL concepts, data integration, and data modeling.; Hands-on experience with cloud platforms like AWS, Google Cloud, Azure, Alibaba Cloud, etc.; Strong skills in SQL and relational databases.; Self-driven with good problem-solving skills and the ability to work both independently and in a team environment.; Willing to work in 24x7 rotating shifts including weekends and holidays.; Job desc:; Install, configure, and maintain ETL tools, primarily Informatica (preferred) or Talend.; Design and develop scalable ELT/ETL pipelines to support data integration and transformation.; Build and manage data warehouse infrastructure and architecture.; Monitor and optimize data pipeline performance and reliability.; Collaborate with data analysts, data scientists, and business teams to deliver efficient data solutions.; Document data architectures, pipelines, and processes.",,Full time,indonesia
85025945,Senior Data Engineer,PT BCI CENTRAL INDONESIA,South Jakarta,2025-06-19 16:17:33,https://id.jobstreet.com/id/job/85025945,"About the Role As Sr. Data Engineer for our global Data Enrichment squad, you will be responsible for implementing data flows using Apache Airflow and AWS, incorporating functionalities such as external API’s, AI/ML components, and GenAI. You will work in close collaboration with your ETL Lead and Product Owner to translate the requirements of our customers and stakeholders to ETL data flow features and then build and run them. You improve the operations of the ETL data flows by improving our monitoring capabilities, automated error recovery, and scalability.; Responsibilities:; ● Develop and maintain ETL workflows using Apache Airflow and AWS services.; ● Take ownership of complex ETL tasks and AWS Lambda functions.; ● Design ETL pipelines and review work from junior team members.; ● Contribute to building secure and scalable data solutions.; ● Operate and monitor data flows in production environments, supporting junior colleagues as needed.; ● Improve the resilience, reliability, and performance of ETL systems.; ● Automate recurring operations and optimize performance.; ● Guide junior team members in testing practices and setting up automated tests.; ● Promote and model best practices for documentation across the team.; Requirements:; ● 5+ years of experience as a full-time Data Engineer; ● Hands-on experience delivering projects using Apache Airflow in the past 2 years.; ● Proficiency with AWS; ● Experience with PostgreSQL and/or OpenSearch.; ● Strong SQL skills demonstrated through past roles and projects.; ● Experience implementing and improving CI/CD pipelines for ETL processes.; ● Solid understanding and several years of experience working with Python in a production environment.",Rp 17.000.000 – Rp 25.000.000 per month,Full time,indonesia
85436252,Data Engineer,Sibernetik Integra Data,South Jakarta,2025-07-03 16:17:33,https://id.jobstreet.com/id/job/85436252,"Responsibilities :; Create and maintain optimal data pipeline architecture; Assemble large, complex data sets that meet functional / non-functional business requirements.; Identify, design, and implement internal process improvements: automating manual processes, optimizing data delivery, re-designing infrastructure for greater scalability, etc.;  Build the infrastructure required for optimal extraction, transformation, and loading of data from a wide variety of data sources using SQL and On-prem/ Cloud technologies.; Build analytics tools that utilize the data pipeline to provide actionable insights into customer acquisition, operational efficiency and other key business performance metrics; Qualifications :; 2-4 years of experience as a data engineer.; Advanced working SQL knowledge and experience working with relational databases, query authoring (SQL) as well as working familiarity with a variety of databases.; ETL tools knowledge is required.; Experience building and optimizing big data pipelines, architectures and data sets.; Experience performing root cause analysis on internal and external data and processes to answer specific business questions and identify opportunities for improvement.;  Strong analytic skills related to working with unstructured datasets.; Build processes supporting data transformation, data structures, metadata, dependency and workload management.; A successful history of manipulating, processing and extracting value from large disconnected datasets.",,Kontrak/Temporer,indonesia
85563748,IT Data Engineer,PT ABC KOGEN DAIRY,South Jakarta,2025-07-08 16:17:33,https://id.jobstreet.com/id/job/85563748,"Job Description; 1. Designing, developing, and maintaining data pipelines for ETL processes and orchestration workflows.; 2. Creating and managing data visualization dashboards to support business decision-making.; 3. Performing data cleansing and validation to ensure data quality and reliability.; 4. Developing and maintaining simple web applications to facilitate data input processes.; 5. Collaborating closely with other IT teams to ensure integrated and complementary system solutions.; Job Qualifications; 1. Minimum Bachelor's degree in Computer Science, Information Systems, Data Engineering, or a related field.; 2. At least 2 years of experience in a similar role, preferably in data engineering or a related domain.; 3. Proficient in core Data Engineering technologies such as Apache Airflow, SQL, and Python.; 4. Strong understanding and hands-on experience with ETL processes and data orchestration.; 5. Excellent communication skills, with a proactive and collaborative work attitude.; 6. Willing to travel and work in different locations.; 7. Placement in Tebet, South Jakarta.",,Full time,indonesia
85315540,"Analyst, Data Engineer",PT Bank DBS Indonesia,Indonesia,2025-06-24 16:17:33,https://id.jobstreet.com/id/job/85315540,"Business Function; DBSI T&O is the backbone that supports the bank as the central of operations and technology. With the spirit of OneTeam and PRIDE! Value, we serve Institutional Banking Operations and Consumer Banking Operations, manage Customer Centre and IT, provide Group Procurement and Corporate Real Estate, coordinate bank-wide Business Continuity Management program and framework, and deliver service quality for Digibank and IBG/GTS. Our Technology & Operations organization is a vital strategic partner to the business in providing competitive advantage that propels DBSI towards being the Best Bank for a Better World (#B3W).; Responsibilities; Collaborate with regional team, business unit, support unit and other related party for any projects.; Ensure user requirements on data needs are captured; Develop scripts/tools to support data requirements and ingestion from BU/SU; Maintain good relationships between IT and business, manage business expectations and negotiate compromise; Requirements; Minimum 4 years of relevant working experience; Understand key data concepts, develop data set processes, techniques and considerations in Machine learning and Data analytics; Training and relevant experience in one or more of the following areas \:; Statistical modelling tools such as\: R, Python, SAS, etc; Data manipulation using scripting languages like Python or using ETL tools; Visual analytics technologies like Tableau, Qlikview, PowerBI, etc; End-to-end analytics architecture, preferably with some working knowledge of big data stack; Passion towards automation where appropriate and beneficial; Unix Shell Scripting and knowledge of Job scheduler; Excellent understanding of technology life cycles and the concepts and practices required to build big data solutions; Ability to understand and build re-usable data assets or features to enable downstream data science models to read and use",,Full time,indonesia
83584141,Data Engineer,"PT. BFI FINANCE INDONESIA, Tbk",Tangerang District,2025-06-17 16:17:33,https://id.jobstreet.com/id/job/83584141,"Job Description; Design and implement scalable data pipeline using modern data platform (Spark, Flink, Kafka, Airflow); Build and manage ETL/ELT processes to ingest data from various sources (databases, APIs, files, message queues); Develop and maintain data models and data warehouse / datalake architectures; Ensure high data quslity and implement data validation, observability and monitoring frameworks; Collaborate with other team such as data analyst, data scientist and business stakeholders to understand data requirements and deliver data solutions; Optimize performance of big data processing jobs and ensure cost efficiencient data infrastructure; Advocate for best practices in data engineering, including documentation, testing, version control and other with team; Minimum Qualifications; Bachelor degree from Computer Science or Informatic Engineering; Min. 3 years experience as Data Engineer or similar role; Strong proficiency in SQL and programming language (Python, Java or Scala); Hands on with distributed data processing framework (Apache Spark, Kafka, Flink); Solid understanding of data modelling, data warehouse and query performance optimization; Experience with cloud platform such as Alibaba Cloud, AWS, GCP or Azure; Familiarity with modern orchestration tools like Apache AirFlow or other; Experience with CI/CD and DevOps practices in data engineering",,Full time,indonesia
85364324,Senior Data Analyst / Senior Data Engineer,PT INDONESIA LOGAM PRATAMA,South Tangerang,2025-07-02 16:17:33,https://id.jobstreet.com/id/job/85364324,"Main Responsibilities :; Deliver analysis, insights, reporting, data marts, and tools to support the business team; Writing SQL scripts, queries, and stored procedures to extract data; Develops complex advancement reports using SQL, Microsoft Office and other utilities or languages as necessary; Identify data issues proactively and flag them to respective stakeholders; Implements best practices in data management to ensure the integrity of the data, the quality of data processes and delivers analyzable or analyzed data to a variety of internal and external clients; Designing and running queries, generating reports, and helping other people in your organization interpret and use data;  Requirements :; More than 2 years of working experience in data-related fields; Strong experience with data raw collections and manipulation using Microsoft Excel; Strong experience with SQL Connection and SQL Query with problem solving; A strong business acumen and communication skill; Able to effectively deliver technical presentations to non-technical stakeholders; Comfortable working independently and collaboratively with minimal guidance",,Full time,indonesia
85567564,Data Analyst (Azure Synapse),PT Rsystems Ibizcs International,Central Jakarta,2025-07-08 16:17:33,https://id.jobstreet.com/id/job/85567564,"Qualifications:; Bachelor’s degree in Data Science, Computer Science, Information Technology, or a related field.; Minimum of 2 years of experience with Azure Synapse for ETL operations.; At least 2 years of experience building dashboards using Power BI and Tableau.; Proficiency in SQL, Tabelau and Azure Synapse; Strong analytical and problem-solving abilities with sharp attention to detail.; Excellent communication and interpersonal skills.; Ability to work independently and within a collaborative team environment.; Good communicate in English; Willing for contract based; Key Responsibilities:; Perform ETL processes using Azure Synapse to integrate and manage data from diverse sources.; Develop and maintain interactive dashboards using Power BI and Tableau to drive business decisions.; Collaborate with cross-functional teams to gather requirements and deliver actionable insights.; Monitor data quality and uphold integrity in data and processes.; Respond to ad-hoc analysis requests with clear, concise findings.",Rp 10.000.000 – Rp 15.000.000 per month,Full time,indonesia
85812908,Data Engineer (Middle),PT. SIGMA GLOBAL TEKNOLOGI (SIGMATECH),Jakarta,2025-07-16 16:17:33,https://id.jobstreet.com/id/job/85812908,"Job Description; Bertanggung jawab dalam membangun dan memelihara sistem data-platform, mulai dari tahapan proses pengumpulan data dari berbagai data-source (extract), data-cleansing (data quality) dan data transformasi (transform). Data-Platform sebagai tools memberikan insight kepada pengguna dalam melakukan pengambilan keputusan operasional maupun keputusan strategi.; Mengekstrak, mengubah, dan memuat (ETL) data dari berbagai sumber termasuk basis data, API, dan berkas log; Menerapkan pemeriksaan kualitas data dan sistem pemantauan untuk memastikan keakuratan dan konsistensi data; Mengembangkan dan memelihara model data dan data warehouse; Berkolaborasi dengan business-analyst untuk memahami kebutuhan data mereka dan menerjemahkannya menjadi technical-specification; Menganalisa dan melakukan perubahaan terhadap sistem data-platform untuk perbaikan system-error, pemeliharaan dan pengembangan; Menjaga kualitas sistem yang dihasilkan dengan mempertimbangkan user-friend, user-experience, speed performance dan system reliability; Melakukan test terhadap hasil pengembangan/pemeliharaan; Bertanggung jawab atas pengembangan dan pemeliharaan peranti lunak sesuai dengan objektif perusahaan dan kebutuhan pengguna; Qualification:; Berpengalaman min. 2 tahun bekerja sebagai ETL Developer mengembangkan memelihara dan mengelola RDBMS termasuk pembuatan script, store-procedure dan SQL Query; Membuat dan memelihara data pipeline architecture yang optimal untuk integrasi data menggunakan ETL tools seperti SSIS, Pentaho dan Talend; Build data ingestion workflow for data warehouse/data marts/operational data store7; Pengetahuan dan pengalaman terhadap data-warehouse, data-marts, operational-data-store dan master data management; Pengetahuan dan pengalaman dalam database-design dan membangun database; Pengetahuan dan pengalaman dalam pembuatan SQL script dan tuning SQL yang baik",,Kontrak/Temporer,indonesia
81625510,Data Engineer,Ctlyst,Jakarta,2025-06-17 16:17:33,https://id.jobstreet.com/id/job/81625510,"At Catalyst, People are the heartbeat of our company. We believe that good quality people will have a positive impact on our business. We are looking for a skilled Data Engineer to join our growing team. If you are passionate about being part of the team, building some of the most critical products, and Working alongside teams in the industry across product, engineering, and design, Let’s join us!; ; Job Description:; Develop data models and maintain company metrics and dashboard.; Develop and maintain ETL data pipelines.; Do automate testing to ensure data quality.; Translates complex functional and technical requirements into detailed design and high performing data applications.; Research or explore any new technologies to complement or improve requirements and current technologies.; Collaborate with management, business partners, analysts, developers, architects, and engineers to support data quality efforts.; ; Requirements:; Possess at least 2 years of experience in Data Engineering. Experienced working in e-commerce or marketplace is preferred.; Bachelor Degree in Computer Science, IT, Mathematics or related field.; Strong proficiency in Python, R, and SQL.; Strong data modeling knowledge.; Strong foundation in Data Query/Manipulation.; Have experience managing and designing data pipelines, debugging data issues.; Experienced in DBT (Data Build Tools) and Snowflake.; Experience working with complex ETL and Data warehouse will be a bonus.",,Kontrak/Temporer,indonesia
