Job_ID,Role,Company,Location,Publish_Time,URL,job_desc,salary,work_type,country
85808290,Senior Data Engineer,Yayasan Bina Nusantara,West Jakarta,2025-07-16 16:17:33,https://id.jobstreet.com/id/job/85808290,"Job Descriptions:; Create and maintain optimal data pipeline architecture for report, business intelligence (BI) dashboard.; Create report and business intelligence (BI) dashboard need by organization.; Identify, design, and implement internal process improvements: automating manual processes, optimizing data delivery that needed by BI and reporting services; Create the infrastructure required for optimal extraction, transformation, and loading of data from a wide variety of data sources using SQL and big data technologies.; Create analytics tools that utilize the data pipeline to provide actionable insights into customer acquisition, operational efficiency, and other key business performance metrics.; Create data tools for analytics in building and optimizing reporting services.; Ensure the effectiveness and efficiency of operational database system.; Monitor database & system operational activities in Bina Nusantara.; Maintain data security and accuracy in Bina Nusantara; Provide excellent service towards users, in relation to database authorization, change and withdrawal (web & workgroup); ; Requirements :; Minimum Bachelor Degree in Computer Science or related field; Had experience 2 years as Data Analyst or related field is a plus; Understanding of structured query language (SQL); Demonstrated experience with BI Tools (Tableau, Power BI, OBIEE, Qlikview).; Experience interpreting data and analyzing results using statistical techniques; Experience presenting findings to business partners across the organization, including executive leadership; Experience with database software/web applications; Strong analytical and organisational skills; Ability to work well in a fast paced environment, where the technology is constantly changing",,Full time,indonesia
82974109,Data & Analytics Engineer,Vida,Jakarta,2025-06-17 16:17:33,https://id.jobstreet.com/id/job/82974109,"About the Role; We are seeking a highly skilled Data & Analytics Engineer to drive data-driven decision-making by designing, optimizing, and maintaining scalable data pipelines and analytical solutions. This role involves working with Amazon Athena, MySQL, Google Sheets, and Holistics to manage, analyze, and visualize key business data. You will play a crucial role in building a scalable budget and forecasting tool, integrating transaction data with HubSpot data, and optimizing data workflows to support financial and operational insights.; Key Responsibilities; Data Engineering & Management:; Design and develop SQL-based data pipelines to integrate HubSpot, MySQL transaction data, and Athena.; Develop and optimize queries for Athena (Presto-based SQL) to ensure efficient data retrieval and reporting.; Develop, maintain and enhance data models on dbt to support analytics and reporting needs.; Develop dynamic SQL scripts for extracting and transforming data that support cross functional requirements; Automate data ingestion from various sources, ensuring scalability and maintainability; Data Analytics & Reporting:; Work with Holistics BI to create dashboards and automate reporting using Athena queries.; Ensure data accuracy and consistency by implementing validation and reconciliation processes.; Develop Python scripts for ad-hoc data transformations; Budget & Forecasting Tool Development:; Work on a custom web-based budgeting and forecasting application integrated with Holistics.; Enable input capabilities for budget and forecast data using front-end tools.; Collaborate with stakeholders to define business logic and financial modeling requirements.; Key Skills & Experience Required; Strong expertise in SQL (Athena/Presto, MySQL) for complex queries and performance tuning.; Experience with BI tools (Holistics preferred) for dashboarding and reporting.; Proficiency in Python for data manipulation, automation, and scripting tasks.; Experience with Google Sheets API & Athena integrations.; Ability to translate business requirements into scalable data solutions.; Strong problem-solving skills and attention to detail.; Nice-to-Have Skills; Experience with cloud-based data lakes (AWS S3, Athena, Glue, etc.).; Familiarity with HubSpot data structures and CRM analytics.; Exposure to web-based data entry tools for budgeting & forecasting solutions..",,Full time,indonesia
83178851,TC - Data Exchange Platform Advisor,EY,Jakarta,2025-06-17 16:17:33,https://id.jobstreet.com/id/job/83178851,"About EY: EY, a global leader operating in over 150 countries, delivers exceptional service in Consulting, assisting clients in transforming and enhancing their capabilities. We are dedicated to helping our clients build a better working world, creating long-term value for people and society, and fostering trust in capital markets. This commitment begins with a culture that prioritizes training, opportunities, and creative freedom, empowering you to make impactful changes. Regardless of when you join or how long you stay, the exceptional EY experience is designed to last a lifetime. With a focus on hiring and developing passionate individuals, we strive to be the best employer in the industry. At EY, you’ll have the opportunity to build a career as unique as you are, supported by a global network, an inclusive culture, and cutting-edge technology. We value your unique voice and perspective, which will help us improve even further. Join us to create an exceptional experience for yourself and contribute to a better working world for all.; The Opportunity: You will play a crucial role in guiding our clients through their business and technology transformation journeys. We expect you to provide a unique perspective on how technology can enhance and transform their organizations, addressing key business challenges. This area is characterized by high growth and visibility, offering numerous opportunities for skill enhancement and career development.; Your Key Responsibilities: You will collaborate with a diverse range of clients and colleagues to deliver the latest trends, practices, technologies, and architectures. Your focus will be on designing, building, and maintaining scalable and robust solutions that unify, enrich, collaborate, and deliver value.; Requirements:; A minimum bachelor’s degree in Computer Science, Software Engineering, Computer Management, Information Technology, Information Systems, or Information Engineering.; At least 5 years of experience in data exchange, data integration, or data sharing projects specifically for national identity and digital ID programs.; Proven experience in at least 2 projects involving the design and implementation of data exchange solutions for large-scale national-level projects.; A strong background in consulting services and technical advice related to National Digital Identity and identity verification methods, including biometrics, document verification, and facial recognition.; What We Look For: We seek passionate individuals with a strong vision and a commitment to staying ahead of industry trends. If you have a genuine enthusiasm for helping businesses reach their full potential, this role is for you.; What We Offer:; Continuous Learning: Develop the mindset and skills to navigate future challenges.; Success as Defined by You: We provide the tools and flexibility to make a meaningful impact in your own way.; Transformative Leadership: Gain insights, coaching, and confidence to become the leader the world needs.; Diverse and Inclusive Culture: Be embraced for who you are and empowered to help others find their voice.; If you meet the criteria outlined above, please contact us as soon as possible.; EY is an equal opportunity, affirmative action employer, providing equal employment opportunities to applicants and employees without regard to race, color, religion, age, sex, sexual orientation, gender identity/expression, national origin, protected veteran status, disability status, or any other legally protected basis, including arrest and conviction records, as applicable by law. EY is committed to providing reasonable accommodations to individuals with special needs. If you are a qualified individual with special needs and require assistance applying online or need to request an accommodation during the interview process, please speak to our HR executives, and we will be happy to assist you.",,Full time,indonesia
85583068,Data Engineer,Code.id,Kebayoran Lama,2025-07-08 16:17:33,https://id.jobstreet.com/id/job/85583068,"Job Description; Design, build, and maintain robust and scalable data pipelines (ETL/ELT) using modern tools and technologies.; Integrate data from internal and external sources, ensuring data integrity and reliability.; Work closely with data scientists, analysts, and business teams to understand data needs and deliver efficient solutions.; Develop and maintain data models and data warehouses/lakes to support business intelligence and analytics.; Optimize data systems for performance, scalability, and cost efficiency.; Implement data quality checks, monitoring, and alerting systems.; Ensure data privacy, security, and compliance with regulations (e.g., GDPR, HIPAA).; Document data pipelines, architecture, and processes clearly and consistently.; Minimum Qualifications; 3+ years of experience in a Data Engineer or similar data-centric role.; Strong experience with SQL Server Integration Services (SSIS) for ETL development, deployment, and maintenance.; Proven ability to design, build, and manage ETL pipelines using SSIS.; Hands-on experience with Power BI for building reports, dashboards, and data visualizations.; Solid knowledge of T-SQL and working with SQL Server databases.; Understanding of data quality, data governance, and data lineage concepts.; Familiarity with performance tuning and optimization of ETL processes and SQL queries.",,Kontrak/Temporer,indonesia
85630516,Data Engineer,PT. Elabram Systems,Jakarta,2025-07-10 16:17:33,https://id.jobstreet.com/id/job/85630516,"Job Description; Design, develop, and maintain data transformation processes to cleanse, transform, and aggregate data within the data warehouse.; Optimize and streamline data workflows to ensure efficient data processing and storage in the data warehouse.; Collaborate with data analysts, data scientists, and business stakeholders to understand data requirements and implement appropriate data transformations.; Develop and maintain data warehouse schemas, tables, and views to support reporting and analytics needs.; Implement data governance policies and standards to ensure data quality, security, and compliance.; Monitor data warehouse performance, troubleshoot issues, and optimize for scalability and efficiency.; Requirement; Bachelor’s degree in Computer Science, Informatics Engineering, or a related field with data processing.; 2+ years of professional experience as a Data Engineer or similar role, with a focus on data warehousing, data pipelining, modeling, and transformation.; Proficiency in Python and SQL for data extraction, transformation, and analysis.; Proficiency in Tableau Desktop and Tableau Server, including advanced knowledge of dashboard development, data blending, calculated fields, parameters, and filters.; Experience with application orchestration, Docker and Kubernetes; Strong understanding of data warehousing concepts, methodologies, and best practices.; Experience with cloud platforms such as AWS, Google Cloud Platform for deploying and managing data pipelines; Experience with cloud data warehouses such as: Google BigQuery and Snowflake.; Understand with data modelling techniques including dimensional modelling, star schema design, and slowly changing dimension (SCD).; Have knowledge of ETL (Extract, Transform, Load) processes and tools to efficiently extract data from various sources, transform it, and load it into the data warehouse.; Familiarity with data quality assurance techniques and tools to ensure data accuracy, consistency, and completeness.; Ability to collaborate effectively with business and technical counterparts to understand requirements and translate them into technical solutions.; Strong analytical and problem-solving skills with attention to detail.; Excellent communication and documentation skills to convey technical concepts to non-technical stakeholders.; Ability to work independently and in a team-oriented environment, managing multiple tasks and priorities effectively","Rp 6,000,000 – Rp 8,500,000 per month",Kontrak/Temporer,indonesia
85269477,DATA ENGINEER,ICS Compute,Kebayoran Lama,2025-06-30 16:17:33,https://id.jobstreet.com/id/job/85269477,"Job Description; Develop ETL/ELT pipelines using tools like AWS Glue, Airflow, or DBT.; Integrate data from APIs, databases, files, and streams into data lakes or warehouses.; Deliver analytics- ready datasets with strong SQL and schema design (Star/Snowflake).; Maintain data quality using validation tools such as Great Expectations or Collibra.; Optimize infrastructure with Redshift, BigQuery. Athena, and partitioning techniques.; Apply data security and compliance practices (IAM, encryption, masking).; Minimum Qualifications; Bachelor's degree in Computer Science, Information Systems (Is). Informatics Engineering, Mathematics, or a related field.; Minimum 2 to 3 years of experience as a Data Engineer, particularly in building data pipelines and integrations in cloud environments.; Strong understanding of cloud-based data architecture and modern ETL/ELT processes.; Proficient in SQL and familiar with data modeling and schema design.; Excellent problem-solving, communication, and collaboration skills.; Ability to work effectively in cross-functional teams and fast-paced environments.",,Full time,indonesia
85362475,Data Engineer,PT Simian Technologies,Central Jakarta,2025-07-02 16:17:33,https://id.jobstreet.com/id/job/85362475,"Mengembangkan dan memelihara alur data & proses ETL.; Bekerja sama dengan tim Business Analyst untuk merancang solusi data skalabel.; Memastikan kualitas, integritas, dan konsistensi data.; Mengoptimalkan kinerja database dan query.; Melakukan riset tentang teknologi data terbaru.; Kualifikasi:; Lulusan Sarjana di bidang TI/Ilmu Komputer.; Pengalaman kerja minimal 2 tahun sebagai Data Engineer, dengan pengalaman di industri keuangan diutamakan.; Menguasai SQL dengan kemampuan query, Python, serta ETL tools (seperti Pentaho, Talend, atau lainnya).; Mampu menggunakan BI tools (seperti Cognos, Tableau, atau lainnya); pengalaman dengan BI tools merupakan nilai tambah.; Mampu berbahasa Inggris, terutama dalam membaca dan menulis.; Memahami proses pelaporan regulasi perbankan Indonesia.; Mampu bekerja baik secara tim maupun mandiri.",,Full time,indonesia
85312838,Data Engineer - Banking Syariah Industry,PT. SIGMA GLOBAL TEKNOLOGI (SIGMATECH),Jakarta,2025-07-01 16:17:33,https://id.jobstreet.com/id/job/85312838,"Qualification :; 1. Pengalaman minimal 3 tahun sebagai Data Engineer atau business intelegence.; 2. Memiliki pengetahuan Data Engineering, ETL tools, dan konsep Datawarehouse.; 3. Menguasai bahasa pemrograman Python.; 4. Mengenal environment cloud AWS (Glue, Redshift, StepFunction, S3, Athena).; 5. Menguasai database SQL Server, MySQL, Postgre.; 6. Memahami konsep Data Visualization (Tableau).; 7. Menguasai sistem operasi Window dan Linux.; 8. Memahami konsep CI/CD deployment.; Job Description:; 1. Analisa dan Develop ETL(python) dari source system ke downstream datawarehouse (AWS Cloud) ataupun dari datawarehouse ke upstream (aplikasi); 2. Design datawarehouse dan datamart modelling (banking); 3. Dokumentasi FSD, Implan; 4. Analisa data dari bank regulatory (OJK,BI), external dan internal source system",,Kontrak/Temporer,indonesia
85209272,Data Engineer (for Insurance company),PT. SIGMA GLOBAL TEKNOLOGI (SIGMATECH),Jakarta,2025-06-26 16:17:33,https://id.jobstreet.com/id/job/85209272,"Kualifikasi :; Minimal bergelar S1 dari jurusan IT; Pengalaman minimal 2 tahun sebagai Data Engineer; Menguasai ETL tools (SSIS/Pentaho/dsb.); Menguasai BI tools (Power BI/Tableau); Berpengalaman sebagai Data Engineer di perusahaan asuransi menjadi nilai plus; Tanggung jawab :; Mengumpulkan data dari berbagai macan source seperti dari MySql, SQL Server, Excel dan datasource lainnya; Mengolah data, membersihkan data kotor, serta mampu mencari anomali dengan menggunakan sistem ETL; Mengembangkan serta merancang arsitektur dari datawarehouse yang telah berhasil dianalisa; Melaksanakan semua tugas sesuai dengan prosedur dan kebijakan Perusahaan",,Kontrak/Temporer,indonesia
84386841,Data Engineer,PT Bumi Amartha Teknologi Mandiri,Kebayoran Lama,2025-06-17 16:17:33,https://id.jobstreet.com/id/job/84386841,"Job Description; Design, develop, and manage data pipelines from various sources to data warehouses and MDM platforms using tools like Informatica and SSIS.; Build and maintain complex workflows, mappings, data quality rules, and transformation logic.; Develop solutions based on detailed user requirements and ensure successful testing, implementation, and documentation.; Troubleshoot and resolve data issues across pipelines and systems.; Generate automated reports and manage data transfers via Shell Scripts and FTP.; Modify and optimize existing logic in ETL processes, PL/SQL, and shell scripts.; Act as technical support in project teams, collaborating with internal and third-party stakeholders.; Document all project work, including data models, mappings, and technical solutions.; Participate in strategic planning and help improve data engineering standards and procedures.; Minimum Qualifications; Required:; Strong experience with Informatica MDM (Hub, Data Director, Admin, Provisioning, Developer Tools).; Solid knowledge of ETL/ELT design and development, particularly using Informatica or SSIS.; Proficient in SQL, Oracle PL/SQL, and working with relational databases (e.g., MySQL, PostgreSQL).; Hands-on experience with Shell scripting and generating automated reports to FTP.; Familiarity with API-based data integration and understanding of SDLC practices.; Ability to gather user requirements and turn them into technical solutions.; Preferred:; Experience with BI Tools such as Power BI, Tableau, or Qlik Sense.; Knowledge of data modeling (ERD, star schema) and experience building mock-ups or prototypes.; Detail-oriented with strong analytical and documentation skills.; Proficiency in MS Office (Excel, Word, PowerPoint).; Team player with strong communication and problem-solving skills.",,Kontrak/Temporer,indonesia
85104662,Data Engineer,PT Accelist Lentera Indonesia,West Jakarta,2025-06-23 16:17:33,https://id.jobstreet.com/id/job/85104662,"Responsibilities:; Map columns from PostgreSQL to MongoDB schema; Build ETL pipelines using Pentaho Data Integration (PDI); Implement Change Data Capture (CDC) for real-time data updates; Perform data quality checks, especially on fact tables; Manage database integration using Amazon RDS and MongoDB Atlas; Work with teams to support data needs and solve issues; ; Requirements:; Minimum 2 years of experience as a Data Engineer; Good knowledge of PostgreSQL and MongoDB; Experience with Pentaho PDI for ETL processes; Understanding of CDC and real-time data updates; Familiar with Amazon RDS and MongoDB Atlas; Able to write and understand SQL; Placement: Jakarta Barat",,Kontrak/Temporer,indonesia
85769160,Data Engineer,,Jakarta,2025-07-15 16:17:33,https://id.jobstreet.com/id/job/85769160,"Qualification :; Degree in Computer Science, Electrical/Computer Engineering, Industrial & System Engineering, Mathematics/Statistics; Proficient in Pythons and one or more of the following programming languages: R, Scala, Java, C++; Strong working knowledge of SQL and all function on the SQL and good logic to make efficient query structure. And have knowledge with all data structures and types.; Also handling big data processing with efficient and best performance.; Have experience with Unix/ubuntu, Hadoop, Impala and Hive. Have experience with google cloud platform especially composer, bigquery, storage, Vertex AI, cloud function/run, etc.; Min 3 Years’ Experience as DS, DE, or Data Analyst Have Experience in Industry: Telco / iOT / BFSI; Responsibility :; Design, implement, and operationalize data pipelines to extract and load data from various sources (databases, APIs, logs, etc.) and make the pipelines works efficient.; As a core member of the Data team, attend daily standup to update status on Data development activities, also perform the following activities.; Coordinate with IT/Network Team and IoH Data Management and Quality Team to make sure all the data integrity and quality. Check data for errors and fix any issues to maintain its accessibility and reliability.; Improve the efficiency and speed of data processing to make it faster.; Create rules for data management to ensure appropriate and ethical usage. Stay updated on data privacy laws (like GDPR, CCPA) and ensure compliance. Record data history and characteristics for improved understanding and traceability. 094/Q0M-Q0MA/STR/2025; Help design data systems, thinking about data structures and future growth. Work together with data scientists and analysts to support their data infrastructure needs.; Establish and manage data storage solutions, encompassing both SQL and NoSQL databases as well as data warehouses. Improve data storage efficiency, scalability, and cost-effectiveness. Implement stringent data security measures and access controls to safeguard sensitive information.; To make telco data such mobility, online behavior, communication pattern to be a relevant consideration of other industries decision making such as banking, ecommerce, retail, and government institutions; Monitoring for Data Quality and fixing the data if there are some issues.",Rp 18.000.000 – Rp 20.000.000 per month,Kontrak/Temporer,indonesia
85666744,Senior Data Architect,PT. Berca Hardayaperkasa,Jakarta,2025-07-11 16:17:33,https://id.jobstreet.com/id/job/85666744,"Company Description; PT. Berca Hardayaperkasa (BHp) is a leading provider of Enterprise Information & Communication Technology (ICT) solutions in Indonesia. With diverse business units and over 500 professionals, BHp offers hardware systems, IT consulting, communication technology, and Test & Measurement services to various industries nationwide. The company is committed to facilitating technological changes and going 'Beyond Technology' for its clients.; Role Description; This is a contract Solution Architect role located in South Jakarta. The Data Warehouse Architect will be responsible for designing, implementing, and maintaining data warehouse solutions. The role involves working closely with stakeholders to understand data requirements, design data models, optimize data warehouse performance, and ensure data accuracy and security.; Qualifications; Data modeling, Database Design, and ETL (Extract, Transform, Load) skills; Experience with data warehouse technologies; Strong SQL and scripting language skills (e.g., Python, R); Knowledge of data governance, data quality, and data security best practices; Excellent analytical and problem-solving abilities; Bachelor's degree in Computer Science, Information Systems, or related field",,Full time,indonesia
85214538,Data Migration Engineer (VM Ware to Oracle VM),PT. Amalura Multi Dimensi,Bali,2025-06-27 16:17:33,https://id.jobstreet.com/id/job/85214538,·       Minimum bachelor’s degree from reputable university; ·       More than 3 years’ experience as Data Migration; ·       Have experience to migrate VM Ware into Oracle VM (both on Premise); ·       Experience in dealership; ·       Ready to join immediately and willing to sign 3 months contract.; ·       Willing to work onsite at Client Site at Bali,,Kontrak/Temporer,indonesia
