Job_ID,Role,Company,Location,Publish_Time,URL
84382466,"Senior Software Engineer, Equities (Frontend)",ICAP,Raffles Place,2025-06-03 08:19:38,https://id.jobstreet.com/id/job/84382466
84862673,Research Fellow (Electrochemical Sensing),National University of Singapore,National University Of Singapore,2025-06-12 08:19:38,https://id.jobstreet.com/id/job/84862673
84035036,"Global Banking & Markets, Blockchain Software Engineer, Analyst/ Associate,...",Goldman Sachs,Singapore,2025-06-03 08:19:38,https://id.jobstreet.com/id/job/84035036
85080536,"Senior Application Developer (.Net, MVC) (Central, Upto 7k) (ID: 661057)",PERSOLKELLY Singapore Pte Ltd (Formerly Kelly Services Singapore Pte Ltd),Tai Seng,2025-06-22 08:19:38,https://id.jobstreet.com/id/job/85080536
84957462,Senior Software Engineer,COMTECNOVA PTE. LTD.,Pasir Panjang,2025-06-16 08:19:38,https://id.jobstreet.com/id/job/84957462
85137697,Temporary Bonding & Debonding Process Engineer,SSCK PTE. LTD.,Singapore,2025-06-24 08:19:38,https://id.jobstreet.com/id/job/85137697
84721652,Software Engineer (C++) | Boon Lay Up | to $4500 | 5 Days #5252,PERSOLKELLY Singapore Pte Ltd (Formerly Kelly Services Singapore Pte Ltd),Boon Lay,2025-06-05 08:19:38,https://id.jobstreet.com/id/job/84721652
84956747,Air Traffic Operations Expert,THE MITRE CORPORATION,Changi,2025-06-16 08:19:38,https://id.jobstreet.com/id/job/84956747
85190958,"Product Manager - User, Buyer & Marketing",SHOPEE SINGAPORE PRIVATE LIMITED,Singapore,2025-06-26 08:19:38,https://id.jobstreet.com/id/job/85190958
85173921,AI Automation Intern,Universal Genius Advisory,Singapore,2025-06-03 08:19:38,https://id.jobstreet.com/id/job/85173921
85023573,Lead Electrical Engineer (Power System),Surbana Jurong Consultants Pte Ltd,West Region,2025-06-19 08:19:38,https://id.jobstreet.com/id/job/85023573
85209391,Global Head of IT Security & Cyber Programs,Munich Reinsurance,Singapore,2025-06-27 08:19:38,https://id.jobstreet.com/id/job/85209391
85246343,Full Stack Developer,CONTINENTAL FOOD & LEISURE HOLDINGS,Singapore,2025-06-29 08:19:38,https://id.jobstreet.com/id/job/85246343
85071466,VP of Security Architecture - Empower Partners Search,Empower Partners Search,Singapore,2025-06-21 08:19:38,https://id.jobstreet.com/id/job/85071466
84962568,Project Engineer,INTUIT RECRUITMENT PTE. LTD.,Central Region,2025-06-16 08:19:38,https://id.jobstreet.com/id/job/84962568
85257960,CVD Senior Associate Engineer,Systems on Silicon Manufacturing Co Pte Ltd,Singapore,2025-06-30 08:19:38,https://id.jobstreet.com/id/job/85257960
84875321,Proposal Engineer (Marine) (East/$5.5K) NL (ID: 676106),PERSOLKELLY Singapore Pte Ltd (Formerly Kelly Services Singapore Pte Ltd),Loyang,2025-06-13 08:19:38,https://id.jobstreet.com/id/job/84875321
85237508,Strategic Supply Chain Manager [Individual Contributor / Customer Focused],Celestica Electronics (S) Pte Ltd,Woodlands,2025-06-28 08:19:38,https://id.jobstreet.com/id/job/85237508
84876625,"Engineering Assistant, Separation Technologies Applied Research and Translation",Nanyang Technological University,West Region,2025-06-13 08:19:38,https://id.jobstreet.com/id/job/84876625
85071467,Topside Integration Manager,Seatrium,Singapore,2025-06-20 08:19:38,https://id.jobstreet.com/id/job/85071467
84665110,"Project Manager (Team Lead, AV Industry)",TRUST RECRUIT PTE. LTD.,Kallang,2025-06-04 08:19:38,https://id.jobstreet.com/id/job/84665110
84001793,"Director, AI and Quantum",JAC Recruitment Pte. Ltd.,Central Region,2025-06-03 08:19:38,https://id.jobstreet.com/id/job/84001793
85084372,Supply Chain Executive/ Assistant Manager (Logistic Planning) | 5 Days/ West,STAFFKING PTE LTD,West Region,2025-06-23 08:19:38,https://id.jobstreet.com/id/job/85084372
85173927,Junior Software Engineer - Internship,Express In Music,Singapore,2025-06-10 08:19:38,https://id.jobstreet.com/id/job/85173927
84696465,Senior Frontend Software Engineer | ReactJS,ScienTec Consulting Pte Ltd,Central Region,2025-06-05 08:19:38,https://id.jobstreet.com/id/job/84696465
85424484,Facilities Manager (SOL),CBM Pte Ltd,North Region,2025-07-03 04:19:38,https://id.jobstreet.com/id/job/85424484
84789605,Process Engineer,Tokyo Electron Singapore Pte Ltd,Singapore,2025-06-10 08:19:38,https://id.jobstreet.com/id/job/84789605
83817628,Chemical Engineer,AtkinsRéalis,Singapore,2025-06-03 08:19:38,https://id.jobstreet.com/id/job/83817628
84939592,Software Development Manager,KAIROS GLOBAL SEARCH PTE. LTD.,Central Region,2025-06-15 08:19:38,https://id.jobstreet.com/id/job/84939592
84831015,Project Manager (DSC/JH),ST ENGINEERING INFO-SECURITY PTE. LTD,Jurong East,2025-06-11 08:19:38,https://id.jobstreet.com/id/job/84831015
84670711,"Senior/Cyber Security Specialist, Security Operations",Nanyang Technological University,Singapore,2025-06-04 08:19:38,https://id.jobstreet.com/id/job/84670711
84026850,Program Director (Data Centre),One Seven Consulting,Singapore,2025-06-03 08:19:38,https://id.jobstreet.com/id/job/84026850
84852901,Senior Software Developer (C# .NET),Staizen Pte. Ltd.,Central Region,2025-06-11 08:19:38,https://id.jobstreet.com/id/job/84852901
85273426,Electrochemical Engineer - Electrolyzers,Neu Battery Materials,Singapore,2025-07-01 08:19:38,https://id.jobstreet.com/id/job/85273426
84660623,"Project Manager (C# , ASP.NET) Singaporean & locals preferred",APBA TG Human Resource Pte Ltd,Bendemeer,2025-06-03 08:19:38,https://id.jobstreet.com/id/job/84660623
85002865,Advanced Packaging Characterization Engineering,MICRON SEMICONDUCTOR ASIA OPERATIONS PTE LTD,North Coast,2025-06-18 08:19:38,https://id.jobstreet.com/id/job/85002865
84255937,Senior Frontend Engineer - Hermeneutic Investments,Hermeneutic Investments,Singapore,2025-06-03 08:19:38,https://id.jobstreet.com/id/job/84255937
82893030,Cross-Border Payment Software Engineering Intern (Singapore),Tencent International Service Pte. Ltd.,Singapore,2025-06-03 08:19:38,https://id.jobstreet.com/id/job/82893030
85171610,Software Engineer (C# .NET),THE EDGE CONTRACTING SERVICES PTE. LTD.,Singapore,2025-06-25 08:19:38,https://id.jobstreet.com/id/job/85171610
85173799,AI Intern,M3i,Singapore,2025-06-03 08:19:38,https://id.jobstreet.com/id/job/85173799
84712350,Sales Engineers - Power Generator / Switchboard / 2 Vacancies / $5K-$7K,HKM HR Management Pte. Ltd.,Jurong West,2025-06-05 08:19:38,https://id.jobstreet.com/id/job/84712350
85027482,Senior / Process Engineer (Fire Sprinkler) (ID: 673310) JF,PERSOLKELLY Singapore Pte Ltd (Formerly Kelly Services Singapore Pte Ltd),Pasir Panjang,2025-06-19 08:19:38,https://id.jobstreet.com/id/job/85027482
83613300,Senior Software Quality Engineer,Apple Inc.,Singapore,2025-06-03 08:19:38,https://id.jobstreet.com/id/job/83613300
85380441,Test Lead – Temenos Core Banking (T24),Nagarro Software,Singapore,2025-07-02 13:19:38,https://id.jobstreet.com/id/job/85380441
84916477,"Assistant Engineer, Process x3 - 12 Hours (9AM-9PM)",Adecco Personnel Pte Ltd.,Central Region,2025-06-14 08:19:38,https://id.jobstreet.com/id/job/84916477
84735912,Full Stack Developer (ReactJS + .NET 8),Sheng Siong Group Ltd.,Kranji,2025-06-06 08:19:38,https://id.jobstreet.com/id/job/84735912
84811058,Electrical Design Engineer,Fugro Subsea Technologies Pte Ltd,Loyang,2025-06-10 08:19:38,https://id.jobstreet.com/id/job/84811058
85049220,Java Full stack Developer ( 12 months contract),Evo Outsourcing Solutions,Raffles Place,2025-06-19 08:19:38,https://id.jobstreet.com/id/job/85049220
85033563,"VP/AVP, Specialist, Brand & Customer Research, Group Strategic Marketing &...",DBS Bank Limited,Central Region,2025-06-19 08:19:38,https://id.jobstreet.com/id/job/85033563
83544613,"Fullstack Java Engineer, Enterprise Technology Services",Apple Inc.,Singapore,2025-06-03 08:19:38,https://id.jobstreet.com/id/job/83544613
82944394,Senior Software Engineer - Global E-Commerce (Business Platform),TikTok Pte. Ltd.,Singapore,2025-06-03 08:19:38,https://id.jobstreet.com/id/job/82944394
84649384,Production Manager,Quantum Automation Pte Ltd,North Region,2025-06-03 08:19:38,https://id.jobstreet.com/id/job/84649384
85158071,Risk Transformation Manager/Senior Manager (Archer GRC/ IRM) - Risk Consulting,Ernst & Young Solutions LLP,Singapore,2025-06-03 08:19:38,https://id.jobstreet.com/id/job/85158071
84651117,Electrical Engineer – Battery Energy Storage Systems (BESS),Infinity Cube Pte Ltd,Jurong West,2025-06-03 08:19:38,https://id.jobstreet.com/id/job/84651117
85221012,"Assistant Engineer, Semicon Process x5 - 12 Hours (9AM-9PM)",Adecco Personnel Pte Ltd.,Central Region,2025-06-27 08:19:38,https://id.jobstreet.com/id/job/85221012
84687100,Program Officer,NTUC Fairprice Co-operative Limited,West Region,2025-06-04 08:19:38,https://id.jobstreet.com/id/job/84687100
85234515,OPERATION MANAGER,RMR International,Singapore,2025-06-27 08:19:38,https://id.jobstreet.com/id/job/85234515
84701702,Platform Lead – Cybersecurity,AMSERS CONSULTING PTE. LTD.,Singapore,2025-06-04 08:19:38,https://id.jobstreet.com/id/job/84701702
84760756,Assistant Engineer x5 (Semicon / Day Shift),Adecco Personnel Pte Ltd.,Central Region,2025-06-07 08:19:38,https://id.jobstreet.com/id/job/84760756
84183195,Creative Writing Strategist,Nicoll Curtin,Singapore,2025-06-03 08:19:38,https://id.jobstreet.com/id/job/84183195
84679806,Site Project Assistant Engineer (Electrical) [Entry Level],Corestaff Pte Ltd,Central Region,2025-06-04 08:19:38,https://id.jobstreet.com/id/job/84679806
85159655,"Intern - EY-Parthenon - Financial Services, Strategy and Execution (Offcycle...",Ernst & Young Solutions LLP,Singapore,2025-06-03 08:19:38,https://id.jobstreet.com/id/job/85159655
85273505,Senior Software Engineer,TUODAO (SINGAPORE) PTE. LTD.,North Region,2025-07-01 08:19:38,https://id.jobstreet.com/id/job/85273505
84065946,Senior Manager - SAP specialist,Ernst & Young Solutions LLP,Singapore,2025-06-03 08:19:38,https://id.jobstreet.com/id/job/84065946
85174725,Senior Technical Product Manager (Marketing Technology),Traveloka,Singapore,2025-06-03 08:19:38,https://id.jobstreet.com/id/job/85174725
84287727,Senior Quality Engineering Manager,Traveloka,Singapore,2025-06-03 08:19:38,https://id.jobstreet.com/id/job/84287727
85362520,Senior Research Scientist (Development of III-Nitride HEMT),Nanyang Technological University,Singapore,2025-07-02 08:19:38,https://id.jobstreet.com/id/job/85362520
83648111,"Head of SAP Business Data Cloud (BDC) Sales, APAC",SAP Asia Pte Ltd,Singapore,2025-06-03 08:19:38,https://id.jobstreet.com/id/job/83648111
85155591,Product Manager - Clearing and Settlement - TikTok Money Platform,TikTok Pte. Ltd.,Singapore,2025-06-03 08:19:38,https://id.jobstreet.com/id/job/85155591
84604651,"Senior Product Manager, Payments Application",Airwallex,Singapore,2025-06-03 08:19:38,https://id.jobstreet.com/id/job/84604651
85146473,Senior Manufacturing Process Engineer (Precision Machining/Up to $10k) - YH,Nala Employment Pte Ltd,Pioneer,2025-06-25 08:19:38,https://id.jobstreet.com/id/job/85146473
84429556,"Data Center Facilities Technician, Mechanical",Google Inc.,Singapore,2025-06-03 08:19:38,https://id.jobstreet.com/id/job/84429556
85082799,M&E Engineer (LTA Project),AlwaysHired Pte. Ltd.,Central Region,2025-06-22 08:19:38,https://id.jobstreet.com/id/job/85082799
84695446,Sales Program Executive (BOM),AlwaysHired Pte. Ltd.,Kallang,2025-06-05 08:19:38,https://id.jobstreet.com/id/job/84695446
85042815,[Semiconductor] R&D Manager,Ambition Group Singapore Pte. Ltd. (SG),Central Region,2025-06-20 08:19:38,https://id.jobstreet.com/id/job/85042815
84770974,Software Developer (Java),ScienTec Consulting Pte Ltd,Central Region,2025-06-09 08:19:38,https://id.jobstreet.com/id/job/84770974
85300763,Field Service Assistant Engineer (ID: 678817),PERSOLKELLY Singapore Pte Ltd (Formerly Kelly Services Singapore Pte Ltd),East Region,2025-07-01 08:19:38,https://id.jobstreet.com/id/job/85300763
83426766,"Vice President, SAP LE (Asia Pacific)",NTT Communications,East Region,2025-06-03 08:19:38,https://id.jobstreet.com/id/job/83426766
85384417,Intern - Tank Management (Maintenance),PetroSeraya,Singapore,2025-07-02 12:19:38,https://id.jobstreet.com/id/job/85384417
84751969,Project Manager,BTI Executive Search Pte Ltd,Central Region,2025-06-07 08:19:38,https://id.jobstreet.com/id/job/84751969
84830525,Engineering and Business Development Manager (New Energy),ComfortDelGro Corporation Limited,Braddell,2025-06-11 08:19:38,https://id.jobstreet.com/id/job/84830525
84720330,Assistant Cost Manager (Project Controls),AtkinsRéalis,Central Region,2025-06-05 08:19:38,https://id.jobstreet.com/id/job/84720330
84939691,Senior Java Developer,KAIROS GLOBAL SEARCH PTE. LTD.,Central Region,2025-06-15 08:19:38,https://id.jobstreet.com/id/job/84939691
85049212,Director -Operations,ZIMMER AUTOMATION PTE. LTD.,Woodlands,2025-06-19 08:19:38,https://id.jobstreet.com/id/job/85049212
85041704,Senior Java Developer,M-DAQ GLOBAL PTE. LTD.,Central Region,2025-06-19 08:19:38,https://id.jobstreet.com/id/job/85041704
84944146,Lead Electrical Engineer | Robotics | JIAW (ID:674053),PERSOLKELLY Singapore Pte Ltd (Formerly Kelly Services Singapore Pte Ltd),Changi,2025-06-16 08:19:38,https://id.jobstreet.com/id/job/84944146
84811944,Student Support and Engagement Advisor,National University of Singapore,Kent Ridge,2025-06-10 08:19:38,https://id.jobstreet.com/id/job/84811944
85003178,"Scientist / Senior Scientist I/II (National Quantum Federated Foundry), IMRE","Agency for Science, Technology and Research (A*STAR)",One North,2025-06-18 08:19:38,https://id.jobstreet.com/id/job/85003178
84261533,"Manager/Senior Manager, IT Support Engineering",Gilead Sciences,Singapore,2025-06-03 08:19:38,https://id.jobstreet.com/id/job/84261533
85246682,QA Engineer (Various Discipline),Seatrium,Tuas,2025-06-29 08:19:38,https://id.jobstreet.com/id/job/85246682
84722635,Cost Manager (Project Controls),AtkinsRéalis,Central Region,2025-06-05 08:19:38,https://id.jobstreet.com/id/job/84722635
85138997,QA Production Compliance Specialist,Ventas Bio,West Region,2025-06-24 08:19:38,https://id.jobstreet.com/id/job/85138997
84664987,BIM Lead - M&E - A1 Main Con - IMMEDIATE,TRUST RECRUIT PTE. LTD.,West Region,2025-06-04 08:19:38,https://id.jobstreet.com/id/job/84664987
85205549,Head (Upstream Logistics),NTUC Fairprice Co-operative Limited,West Region,2025-06-27 08:19:38,https://id.jobstreet.com/id/job/85205549
84673206,Junior .NET Developer,CAPGEMINI SINGAPORE PTE. LTD.,Marina South,2025-06-03 08:19:38,https://id.jobstreet.com/id/job/84673206
84819142,HSE Officer,Element Construction Testing (S) Pte Ltd,Sungei Kadut,2025-06-11 08:19:38,https://id.jobstreet.com/id/job/84819142
84701428,"Laboratory Officer (Electrical & Electronics), TCOMS","Technology Centre For Offshore And Marine, Singapore",Singapore,2025-06-04 08:19:38,https://id.jobstreet.com/id/job/84701428
84852112,iOS Developer,Life Fitness,East Region,2025-06-11 08:19:38,https://id.jobstreet.com/id/job/84852112
84755290,Head of Strategy,Ramboll Group A/S,Singapore,2025-06-07 08:19:38,https://id.jobstreet.com/id/job/84755290
85367478,Secondary School Principal,JF SMART LEARNING PTE. LTD.,Singapore,2025-07-02 08:19:38,https://id.jobstreet.com/id/job/85367478
85072698,Manufacturing Station in Malaysia Precision Engineering Fastener -...,JOB CHOICES SOLUTION PTE. LTD.,Singapore,2025-06-20 08:19:38,https://id.jobstreet.com/id/job/85072698
85227088,"Senior Engineer, Civil Structure",STA PHARMACEUTICAL SINGAPORE PTE. LTD.,East Region,2025-06-27 08:19:38,https://id.jobstreet.com/id/job/85227088
84070277,"Game Development AI Tools, Manager",Razer Inc.,Singapore,2025-06-03 08:19:38,https://id.jobstreet.com/id/job/84070277
85205956,IT Specialist,LETSCOOL AIRCON ENGINEERING PTE. LTD.,Singapore,2025-06-26 08:19:38,https://id.jobstreet.com/id/job/85205956
85070263,Assistant Assembly and Testing Technician | Boon Lay | $2800 | 5 Days #1627,PERSOLKELLY Singapore Pte Ltd (Formerly Kelly Services Singapore Pte Ltd),Boon Lay,2025-06-21 08:19:38,https://id.jobstreet.com/id/job/85070263
84719249,Cost Manager (Sourcing & Procurement),AtkinsRéalis,Central Region,2025-06-05 08:19:38,https://id.jobstreet.com/id/job/84719249
85173945,Process Engineering Intern (Semiconductor Process Optimization),Nanyte Pte Ltd,Singapore,2025-06-03 08:19:38,https://id.jobstreet.com/id/job/85173945
85160632,Production Supervisor | Boon Lay| Up to $3500 + Bonus | Shift #5252,PERSOLKELLY Singapore Pte Ltd (Formerly Kelly Services Singapore Pte Ltd),Boon Lay,2025-06-25 08:19:38,https://id.jobstreet.com/id/job/85160632
84722830,Chief Executive Officer – Fintech Startup,Exponent Global Consulting Pte Ltd,Raffles Place,2025-06-05 08:19:38,https://id.jobstreet.com/id/job/84722830
85169442,Senior Logistics Manager,Sinologistics Overseas Pte Ltd,Downtown Core,2025-06-26 08:19:38,https://id.jobstreet.com/id/job/85169442
85161094,Assistant Cost Manager,AtkinsRéalis,Singapore,2025-06-03 08:19:38,https://id.jobstreet.com/id/job/85161094
85072783,Manufacturing Station in Malaysia Precision Engineering Fastener - Senior...,JOB CHOICES SOLUTION PTE. LTD.,Singapore,2025-06-20 08:19:38,https://id.jobstreet.com/id/job/85072783
85138331,Architectural Designer,HKS Asia Pacific Design Consulting,Central Region,2025-06-23 08:19:38,https://id.jobstreet.com/id/job/85138331
85173203,"Deals – Merger & Acquisition Operation, Director",PricewaterhouseCoopers,Singapore,2025-06-03 08:19:38,https://id.jobstreet.com/id/job/85173203
85140823,Assistant Corporate Quality Manager,CHINA HARBOUR (SINGAPORE) ENGINEERING COMPANY PTE. LTD.,Jurong East,2025-06-25 08:19:38,https://id.jobstreet.com/id/job/85140823
85246670,Construction Manager,Seatrium,Tuas,2025-06-29 08:19:38,https://id.jobstreet.com/id/job/85246670
84751051,Assistant Assembly and Testing Technician | Boon Lay | $2800 | 5 Days #1627,PERSOLKELLY Singapore Pte Ltd (Formerly Kelly Services Singapore Pte Ltd),Boon Lay,2025-06-06 08:19:38,https://id.jobstreet.com/id/job/84751051
84852554,"VP of Sales, APAC",DUETTO ASIA PRIVATE LIMITED,Maritime Square,2025-06-10 08:19:38,https://id.jobstreet.com/id/job/84852554
85113988,Head of Discipline (HOD) - Topside Process,HANWHA OFFSHORE SOLUTIONS SINGAPORE PTE. LTD.,Singapore,2025-06-23 08:19:38,https://id.jobstreet.com/id/job/85113988
85089418,"Senior Assistant Manager / Assistant Manager, Clinical Service Planning",Tengah General and Community Hospital,Central Region,2025-06-23 08:19:38,https://id.jobstreet.com/id/job/85089418
84759430,Machine Mechanic,LINK2 MANPOWER PTE. LTD.,Tuas,2025-06-06 08:19:38,https://id.jobstreet.com/id/job/84759430
85131180,"Manager, EH&S",Pratt & Whitney,Loyang,2025-06-24 08:19:38,https://id.jobstreet.com/id/job/85131180
84516321,Research Fellow,National Healthcare Group Corporate Office (HQ),Singapore,2025-06-03 08:19:38,https://id.jobstreet.com/id/job/84516321
85207899,Legal Project Manager,ALLEN OVERY SHEARMAN STERLING LLP,Central Region,2025-06-25 08:19:38,https://id.jobstreet.com/id/job/85207899
85173569,Crewing Assistant (Intern),KST Maritime,Tiong Bahru,2025-06-04 08:19:38,https://id.jobstreet.com/id/job/85173569
84754075,"Vice Plant Manager, Operations",Molex Singapore Pte Ltd,Joo Koon,2025-06-07 08:19:38,https://id.jobstreet.com/id/job/84754075
85251259,"Legal Assistant, Corporate",Google,Singapore River,2025-06-30 08:19:38,https://id.jobstreet.com/id/job/85251259
84939425,Data Engineer,GECO Asia Pte. Ltd,Jurong East,2025-06-16 08:19:38,https://id.jobstreet.com/id/job/84939425
85379782,Data Engineer - TEKsystems (Allegis Group Singapore Pte Ltd),Allegis Group Singapore Pte Ltd,Singapore,2025-07-02 12:19:38,https://id.jobstreet.com/id/job/85379782
84989653,Data Engineer,ASTEK Singapore Innovation Technology Pte. Ltd.,Central Region,2025-06-18 08:19:38,https://id.jobstreet.com/id/job/84989653
85187447,Data Engineer,Goldtech Resources Pte Ltd,Singapore,2025-06-26 08:19:38,https://id.jobstreet.com/id/job/85187447
85167337,Contract Data Engineer (2-year contract),Public Service Division,Singapore,2025-06-03 08:19:38,https://id.jobstreet.com/id/job/85167337
84963224,Data Engineer,Kaplan Singapore,Singapore,2025-06-17 08:19:38,https://id.jobstreet.com/id/job/84963224
85382629,Data Modeler - Telecom Domain,Unison Consulting Pte. Ltd.,Singapore,2025-07-02 10:19:38,https://id.jobstreet.com/id/job/85382629
84701300,G07 - Data Engineer,FPT Asia Pacific Pte Ltd,Singapore,2025-06-05 08:19:38,https://id.jobstreet.com/id/job/84701300
84918193,Data Engineer,Evolution Recruitment Solutions Pte Ltd,Singapore,2025-06-13 08:19:38,https://id.jobstreet.com/id/job/84918193
84910361,Data Engineer,Fong's Engineering & Manufacturing Pte Ltd,East Region,2025-06-13 08:19:38,https://id.jobstreet.com/id/job/84910361
84880483,Data Engineer (Denodo | AWS | Python | Tableau),FPT Asia Pacific Pte Ltd,Singapore,2025-06-12 08:19:38,https://id.jobstreet.com/id/job/84880483
85073505,Data Engineer (Singapore Citizen Only),ASTEK Singapore Innovation Technology Pte. Ltd.,Central Region,2025-06-20 08:19:38,https://id.jobstreet.com/id/job/85073505
85430135,Data Architect – SAS VI,THAKRAL ONE PTE LTD,Singapore,2025-07-03 06:19:38,https://id.jobstreet.com/id/job/85430135
84822778,G08 - Data Engineer,FPT Asia Pacific Pte Ltd,Singapore,2025-06-11 08:19:38,https://id.jobstreet.com/id/job/84822778
85384351,Software Data Engineer,Allegis Group Singapore Pte Ltd,Singapore,2025-07-02 08:19:38,https://id.jobstreet.com/id/job/85384351
84852504,Data Engineer,SMRT Trains Ltd,Katong,2025-06-10 08:19:38,https://id.jobstreet.com/id/job/84852504
84762308,Data Engineer for SportSG (Contract),Websparks Pte Ltd,East Region,2025-06-07 08:19:38,https://id.jobstreet.com/id/job/84762308
83482854,Data Engineer,SMRT Corporation Ltd,Singapore,2025-06-03 08:19:38,https://id.jobstreet.com/id/job/83482854
85383172,Technical Consultant,Ingram Micro Asia Pte Ltd,Boon Keng,2025-07-02 08:19:38,https://id.jobstreet.com/id/job/85383172
85381719,Data Platform Engineer - RCIC,Beyondsoft International (Singapore) Pte Ltd,Singapore,2025-07-02 08:19:38,https://id.jobstreet.com/id/job/85381719
85019312,Senior Data Engineer,GC ASIA DENTAL PTE LTD,Tampines,2025-06-19 08:19:38,https://id.jobstreet.com/id/job/85019312
83923444,"Data Engineer, ITD (1 year contract)",Public Service Division,Singapore,2025-06-03 08:19:38,https://id.jobstreet.com/id/job/83923444
84850677,Data Engineer with 4 years exp for WSG (Contract),Websparks Pte Ltd,East Region,2025-06-11 08:19:38,https://id.jobstreet.com/id/job/84850677
84760538,Data Engineer (Familiar with Tableau and Scripting),Assurity Trusted Solutions Pte Ltd,Singapore,2025-06-07 08:19:38,https://id.jobstreet.com/id/job/84760538
85072996,"Data Engineer (Azure Synapse Analytics, PySpark)",SembCorp Utilities Pte. Ltd.,East Region,2025-06-20 08:19:38,https://id.jobstreet.com/id/job/85072996
84988101,"Software Engineer, Autonomy Data & Metrics",Motional,Pasir Panjang,2025-06-18 08:19:38,https://id.jobstreet.com/id/job/84988101
85241795,Data Engineer – Big Data & ETL,ANTAS PTE. LTD.,Singapore,2025-06-28 08:19:38,https://id.jobstreet.com/id/job/85241795
83448441,ART 1284 Data Engineer,FPT Asia Pacific Pte Ltd,Singapore,2025-06-03 08:19:38,https://id.jobstreet.com/id/job/83448441
85293565,BIG DATA PLATFORM ENGINEER,Matrix Process Automation Pte Ltd,Central Region,2025-07-01 08:19:38,https://id.jobstreet.com/id/job/85293565
85156590,Senior Data Engineer (Networks),Singapore Telecommunications Limited,Singapore,2025-06-19 08:19:38,https://id.jobstreet.com/id/job/85156590
85054557,Data Engineer,Assurity Trusted Solutions Pte Ltd,Singapore,2025-06-03 08:19:38,https://id.jobstreet.com/id/job/85054557
84914866,VP (Data) - Sumitomo Mitsui Banking Corporation,Sumitomo Mitsui Banking Corporation,Singapore,2025-06-14 08:19:38,https://id.jobstreet.com/id/job/84914866
85422364,URGENT | Power BI Analyst – Semiconductor Manufacturing,Alpha X Technology Pte. Ltd.,Tampines,2025-07-03 03:19:38,https://id.jobstreet.com/id/job/85422364
85041741,Data and Learning Systems Engineer,XCL World Academy,Khatib,2025-06-19 08:19:38,https://id.jobstreet.com/id/job/85041741
85263838,Industrial and System Engineer,MICRON SEMICONDUCTOR ASIA OPERATIONS PTE LTD,Boon Keng,2025-06-30 08:19:38,https://id.jobstreet.com/id/job/85263838
85156431,ISC Data Analytics ML Engineer (Intern),Becton Dickinson Medical (S) Pte Ltd,Singapore,2025-06-03 08:19:38,https://id.jobstreet.com/id/job/85156431
85107543,Lead Data Engineer,Aon Singapore Pte Ltd,Central Region,2025-06-23 08:19:38,https://id.jobstreet.com/id/job/85107543
85187414,Solution Architect,Goldtech Resources Pte Ltd,Singapore,2025-06-26 08:19:38,https://id.jobstreet.com/id/job/85187414
85077982,"Manager/ Senior Manager, Data Engineering & Architecture (9 month contract)",Public Service Division,Singapore,2025-06-21 08:19:38,https://id.jobstreet.com/id/job/85077982
85381911,"AVP, Software Engineer (Digital Enterprise Services), Technology Group",GIC Private Limited,Singapore,2025-07-02 15:19:38,https://id.jobstreet.com/id/job/85381911
85104265,Solution Engineer,CENTURION CORPORATION LTD,Central Region,2025-06-23 08:19:38,https://id.jobstreet.com/id/job/85104265
84921472,Solution Architect for URA with 7 years experience (Contract),Websparks Pte Ltd,East Region,2025-06-14 08:19:38,https://id.jobstreet.com/id/job/84921472
85041089,IoT Engineer,Evolution Recruitment Solutions Pte Ltd,Central Region,2025-06-19 08:19:38,https://id.jobstreet.com/id/job/85041089
85382058,IE Specialist I,UPS Asia Group Pte. Ltd.,Singapore,2025-07-02 08:19:38,https://id.jobstreet.com/id/job/85382058
85041853,"Software Developer (Automation and Integration), EDDC",A*STAR Research Entities (A*STAR),Singapore,2025-06-19 08:19:38,https://id.jobstreet.com/id/job/85041853
85084438,Data Analyst,Combuilder Pte Ltd,Singapore,2025-06-22 08:19:38,https://id.jobstreet.com/id/job/85084438
85271726,"VP, Data Business Analyst, Data Strategy Group",GIC Private Limited,Singapore,2025-07-01 08:19:38,https://id.jobstreet.com/id/job/85271726
