Job_ID,Role,Company,Location,Publish_Time,URL
83339088,"Site Reliability Engineer, Enterprise Technology Services",Apple Inc.,Singapore,2025-05-06 16:29:33,https://id.jobstreet.com/id/job/83339088
84082220,Senior Application Developer,Innergy Consulting Pte. Ltd.,Central Region,2025-05-08 16:29:33,https://id.jobstreet.com/id/job/84082220
84354198,Research Assistant (Engineer),National University of Singapore,National University Of Singapore,2025-05-20 16:29:33,https://id.jobstreet.com/id/job/84354198
84416522,Senior Solutions Engineer - ASEAN,Okta,Singapore,2025-05-22 16:29:33,https://id.jobstreet.com/id/job/84416522
84540819,Senior Software Developer (C++ | C#),ST ENGINEERING INFO-SECURITY PTE. LTD,Jurong East,2025-05-28 16:29:33,https://id.jobstreet.com/id/job/84540819
84268139,"R&D Staff / Senior Software Engineers (C#, .Net) - Biotechnology",SEARCH STAFFING SERVICES PTE. LTD,Woodlands,2025-05-16 16:29:33,https://id.jobstreet.com/id/job/84268139
84601294,MuleSoft Technical Lead,CAPGEMINI SINGAPORE PTE. LTD.,Singapore,2025-05-30 16:29:33,https://id.jobstreet.com/id/job/84601294
84371012,Senior Software Robotics Developer (Contract/Kallang),Manpower Staffing Services (S) Pte Ltd - Head Office,Kallang,2025-05-21 16:29:33,https://id.jobstreet.com/id/job/84371012
84489003,Cloud Data Architect,CAPGEMINI SINGAPORE PTE. LTD.,Singapore,2025-05-26 16:29:33,https://id.jobstreet.com/id/job/84489003
84203837,Front end developer ( React js),Adecco Personnel Pte Ltd.,Central Region,2025-05-14 16:29:33,https://id.jobstreet.com/id/job/84203837
84577845,Mulesoft Integration Architect,PURVIEW ASIA PACIFIC PTE. LTD.,Singapore,2025-05-29 16:29:33,https://id.jobstreet.com/id/job/84577845
84467789,Mobile App Developer (Tech MNC/ iOS or Android/ UP8.3K),Adecco Personnel Pte Ltd.,Central Region,2025-05-26 16:29:33,https://id.jobstreet.com/id/job/84467789
84447355,Junior Software Developer,VIN'S AUTO PTE. LTD.,Bishan,2025-05-23 16:29:33,https://id.jobstreet.com/id/job/84447355
84219496,Software Engineer (Mobile App Dev),VisionPower Semiconductor Manufacturing Company Pte Ltd (VSMC),Tampines,2025-05-14 16:29:33,https://id.jobstreet.com/id/job/84219496
84078462,jr. Software Developer/Programmer (VB.NET | C++) - West,GMP Group HQ,Pioneer,2025-05-08 16:29:33,https://id.jobstreet.com/id/job/84078462
84109127,Java Developer | Spring Boot,ScienTec Consulting Pte Ltd,Central Region,2025-05-09 16:29:33,https://id.jobstreet.com/id/job/84109127
84497809,Senior App Developer (React Native),ScienTec Consulting Pte Ltd,Central Region,2025-05-27 16:29:33,https://id.jobstreet.com/id/job/84497809
78043721,"ServiceNow Developer, Digital and Emerging Tech, Technology Consulting",Ernst & Young Solutions LLP,Central Region,2025-05-06 16:29:33,https://id.jobstreet.com/id/job/78043721
84415016,Senior/Software Engineer (Full-stack Developer),HEPMIL SINGAPORE PTE. LTD.,Central Region,2025-05-22 16:29:33,https://id.jobstreet.com/id/job/84415016
84125472,Application Developer | React.JS,ScienTec Consulting Pte Ltd,Central Region,2025-05-09 16:29:33,https://id.jobstreet.com/id/job/84125472
83998108,Software Developer,Veridien,Singapore,2025-05-06 16:29:33,https://id.jobstreet.com/id/job/83998108
84225012,System Engineer,Tech Mahindra,Singapore,2025-05-14 16:29:33,https://id.jobstreet.com/id/job/84225012
84515606,Software Developer,ACHIEVE HR CONSULTING PTE. LTD.,Eunos,2025-05-27 16:29:33,https://id.jobstreet.com/id/job/84515606
84446978,Junior Software Developer,VIN'S CREDIT PTE. LTD.,Singapore,2025-05-23 16:29:33,https://id.jobstreet.com/id/job/84446978
84381944,Senior Software Robotics Developer,PERSOLKELLY Singapore Pte Ltd (Formerly Kelly Services Singapore Pte Ltd),Central Region,2025-05-21 16:29:33,https://id.jobstreet.com/id/job/84381944
84684675,iOS Application Developer,DA SOFTWARE PTE. LTD.,Central Region,2025-06-03 16:29:33,https://id.jobstreet.com/id/job/84684675
84516131,SOFTWARE DEVELOPER,TALENTWORKZ PTE. LTD.,Crawford,2025-05-27 16:29:33,https://id.jobstreet.com/id/job/84516131
84252268,Software Engineer (Mobile App Dev),VISIONPOWER SEMICONDUCTOR MANUFACTURING COMPANY PTE. LTD.,Tampines,2025-05-15 16:29:33,https://id.jobstreet.com/id/job/84252268
82724341,Lead Engineer (Iseries) AS400 #MBSCareer,Marina Bay Sands Pte Ltd,Jurong East,2025-05-09 16:29:33,https://id.jobstreet.com/id/job/82724341
84544282,Application Developer (Asp.net),NITYO 3P SOLUTIONS PTE. LTD.,Kampong Ubi,2025-05-28 16:29:33,https://id.jobstreet.com/id/job/84544282
84649606,ServiceNow Lead Architect,JonDavidson Pte Ltd,Central Region,2025-06-03 16:29:33,https://id.jobstreet.com/id/job/84649606
83914284,CMI Software Developer,Crédit Agricole CIB,Singapore,2025-05-06 16:29:33,https://id.jobstreet.com/id/job/83914284
83636852,AI Research Associate,Sonar,Singapore,2025-05-06 16:29:33,https://id.jobstreet.com/id/job/83636852
84109126,Software Developer | ReactJS,ScienTec Consulting Pte Ltd,Central Region,2025-05-09 16:29:33,https://id.jobstreet.com/id/job/84109126
84583678,Senior Software Developer (Web-React),Trinity Consulting Services,Singapore,2025-05-29 16:29:33,https://id.jobstreet.com/id/job/84583678
84316658,Senior Application Engineer (ServiceNow),Systems on Silicon Manufacturing Co Pte Ltd,Pasir Ris Wafer Fab Park,2025-05-19 16:29:33,https://id.jobstreet.com/id/job/84316658
84003698,Application Developer,Aon Life,Singapore,2025-05-06 16:29:33,https://id.jobstreet.com/id/job/84003698
83941310,MuleSoft Developer,CAPGEMINI SINGAPORE PTE. LTD.,Singapore,2025-05-06 16:29:33,https://id.jobstreet.com/id/job/83941310
84516226,SOFTWARE DEVELOPER,TALENTWORKZ PTE. LTD.,Crawford,2025-05-27 16:29:33,https://id.jobstreet.com/id/job/84516226
84329842,Software Developer (Java Applications),CAPGEMINI SINGAPORE PTE. LTD.,Marina South,2025-05-19 16:29:33,https://id.jobstreet.com/id/job/84329842
84413391,Software Developer,BUTTERFLY EFFECT PTE. LTD.,Central Region,2025-05-22 16:29:33,https://id.jobstreet.com/id/job/84413391
84515427,Software Developer,AVN DIGITAL PTE. LTD.,Ang Mo Kio,2025-05-27 16:29:33,https://id.jobstreet.com/id/job/84515427
83941164,MuleSoft Senior Developer,CAPGEMINI SINGAPORE PTE. LTD.,Singapore,2025-05-06 16:29:33,https://id.jobstreet.com/id/job/83941164
84447085,Software developer,ENFACTUM PTE. LTD.,Singapore,2025-05-23 16:29:33,https://id.jobstreet.com/id/job/84447085
84516242,Senior Software Developer (Java & ReactJS),THE EDGE CONTRACTING SERVICES PTE. LTD.,Raffles Place,2025-05-27 16:29:33,https://id.jobstreet.com/id/job/84516242
84328306,Senior Data Architect,HURON CONSULTING ASIA-PACIFIC PTE. LTD.,Central Region,2025-05-19 16:29:33,https://id.jobstreet.com/id/job/84328306
82954854,"IFRS17 Solutions (Financial Services - Insurance) Senior Consultant, Business",Ernst & Young Solutions LLP,Singapore,2025-05-06 16:29:33,https://id.jobstreet.com/id/job/82954854
84387299,Software Developer,Avatar Techno Services,Central Region,2025-05-21 16:29:33,https://id.jobstreet.com/id/job/84387299
83869983,Backend Software Developer Intern,Univers Pte. Ltd.,Maritime Square,2025-05-06 16:29:33,https://id.jobstreet.com/id/job/83869983
84458953,"Senior Software Developer – C#, SG",NAMIC Singapore,Singapore,2025-05-25 16:29:33,https://id.jobstreet.com/id/job/84458953
84290759,(f2pool) Software Engineer - Back-end / Full-stack,stakefish,Singapore,2025-05-06 16:29:33,https://id.jobstreet.com/id/job/84290759
83869631,App Developer,Total Shape,Singapore,2025-05-06 16:29:33,https://id.jobstreet.com/id/job/83869631
84411240,IT Project Manager,TSP The Software Practice,Singapore,2025-05-22 16:29:33,https://id.jobstreet.com/id/job/84411240
84731437,Informatica Developer - ETL & IDMC,Unison Consulting Pte. Ltd.,Singapore,2025-06-05 06:29:33,https://id.jobstreet.com/id/job/84731437
84127462,Hiring for ETL Informatica Developer,Path Infotech Pte Ltd,Central Region,2025-05-09 16:29:33,https://id.jobstreet.com/id/job/84127462
84128838,Associate Data Engineer - ETL (Data Mgt Div),Synapxe,Singapore,2025-05-09 16:29:33,https://id.jobstreet.com/id/job/84128838
81967684,Assistant Lead Engineer - ETL (Software Development),Synapxe,Singapore,2025-05-06 16:29:33,https://id.jobstreet.com/id/job/81967684
84448955,Informatica IMDC Developer,Unison Consulting Pte. Ltd.,Singapore,2025-05-23 16:29:33,https://id.jobstreet.com/id/job/84448955
84318999,BI Engineer,USER EXPERIENCE RESEARCHERS PTE. LTD,Ang Mo Kio,2025-05-19 16:29:33,https://id.jobstreet.com/id/job/84318999
84328326,BI Engineer,USER EXPERIENCE RESEARCHERS PTE. LTD,North Region,2025-05-19 16:29:33,https://id.jobstreet.com/id/job/84328326
84637189,Tagetik Developer,LUXOFT INFORMATION TECHNOLOGY (SINGAPORE) PTE. LTD.,Singapore,2025-06-02 16:29:33,https://id.jobstreet.com/id/job/84637189
84544488,Informatica Engineer,Unison Consulting Pte. Ltd.,Changi,2025-05-28 16:29:33,https://id.jobstreet.com/id/job/84544488
84323416,Data Engineer - eClerx Private Ltd,ECLERX PRIVATE LIMITED,Singapore,2025-05-19 16:29:33,https://id.jobstreet.com/id/job/84323416
84225638,Informatica/IDMC Engineer,Evolution Recruitment Solutions Pte Ltd,Singapore,2025-05-14 16:29:33,https://id.jobstreet.com/id/job/84225638
84673116,Tagetik Developer,LUXOFT INFORMATION TECHNOLOGY (SINGAPORE) PTE. LTD.,Singapore,2025-06-03 16:29:33,https://id.jobstreet.com/id/job/84673116
84520695,Data Engineer,Goldtech Resources Pte Ltd,Singapore,2025-05-27 16:29:33,https://id.jobstreet.com/id/job/84520695
84356308,Data Engineer,AZENDIAN SOLUTIONS PTE. LTD.,Braddell,2025-05-20 16:29:33,https://id.jobstreet.com/id/job/84356308
84380194,Data Analyst,MSI Global Pte Ltd,East Region,2025-05-21 16:29:33,https://id.jobstreet.com/id/job/84380194
84008894,Qlik / Business Intelligence Developer,NCS Pte Ltd,Singapore,2025-05-06 16:29:33,https://id.jobstreet.com/id/job/84008894
84714510,Automation Software Developer,Innowave Tech Pte Ltd,East Region,2025-06-05 04:29:33,https://id.jobstreet.com/id/job/84714510
84544247,Data Engineer,Unison Consulting Pte. Ltd.,Changi,2025-05-28 16:29:33,https://id.jobstreet.com/id/job/84544247
84288081,Senior Business Intelligence Analyst,Duotech Pte. Ltd.,East Region,2025-05-16 16:29:33,https://id.jobstreet.com/id/job/84288081
83615679,Data Engineer,Eastspring Investments (Singapore) Limited,Singapore,2025-05-06 16:29:33,https://id.jobstreet.com/id/job/83615679
84568885,Data Engineer,Network Guard,North Region,2025-05-29 16:29:33,https://id.jobstreet.com/id/job/84568885
83482854,Data Engineer,SMRT Corporation Ltd,Singapore,2025-05-06 16:29:33,https://id.jobstreet.com/id/job/83482854
84539613,Power BI Consultant,Goldtech Resources Pte Ltd,Singapore,2025-05-28 16:29:33,https://id.jobstreet.com/id/job/84539613
83448441,ART 1284 Data Engineer,FPT Asia Pacific Pte Ltd,Singapore,2025-05-06 16:29:33,https://id.jobstreet.com/id/job/83448441
84202109,Data Engineer,Innowave Tech Pte Ltd,East Region,2025-05-14 16:29:33,https://id.jobstreet.com/id/job/84202109
84074537,Data Engineer,AsiaPac Technology Pte Ltd,Tiong Bahru,2025-05-07 16:29:33,https://id.jobstreet.com/id/job/84074537
84536151,Web Application Support Developer,M1 Limited,Henderson Hill,2025-05-28 16:29:33,https://id.jobstreet.com/id/job/84536151
84536151,Web Application Support Developer,M1 Limited,Henderson Hill,2025-05-28 16:29:33,https://id.jobstreet.com/id/job/84536151
82357566,"Vice President, Azure Data Technical Lead (JRI-4391)",Sumitomo Mitsui Banking Corporation,Singapore,2025-05-06 16:29:33,https://id.jobstreet.com/id/job/82357566
84667228,Backend Software Developer,MSI Global Pte Ltd,East Region,2025-06-03 16:29:33,https://id.jobstreet.com/id/job/84667228
83729756,Senior Data Engineer,WSH Experts Pte Ltd,Singapore,2025-05-06 16:29:33,https://id.jobstreet.com/id/job/83729756
84454689,Data Engineer( Banking Domain),Ridik,Singapore,2025-05-24 16:29:33,https://id.jobstreet.com/id/job/84454689
84380454,Backend Software Developer,MSI Global Pte Ltd,East Region,2025-05-21 16:29:33,https://id.jobstreet.com/id/job/84380454
84443167,Web Application Developer,Simple Solution Systems Pte Ltd,Singapore,2025-05-23 16:29:33,https://id.jobstreet.com/id/job/84443167
84694595,Principal Consultant PS,Informatica S.E.A. Pte Ltd,Singapore,2025-05-06 16:29:33,https://id.jobstreet.com/id/job/84694595
84382221,Full Stack Software Developer,MSI Global Pte Ltd,East Region,2025-05-21 16:29:33,https://id.jobstreet.com/id/job/84382221
84189768,Developer (Cloud Based Risk Management Software),CoreTRM Pte. Ltd.,Central Region,2025-05-13 16:29:33,https://id.jobstreet.com/id/job/84189768
84668777,Software Developer (MTI),AvePoint,Singapore,2025-06-03 16:29:33,https://id.jobstreet.com/id/job/84668777
84704376,.Net Developer,ANTAES ASIA PTE. LTD.,Marina South,2025-06-04 16:29:33,https://id.jobstreet.com/id/job/84704376
84424354,Software Developer,,Kallang,2025-05-23 16:29:33,https://id.jobstreet.com/id/job/84424354
84516091,Software Developer,Saksoft Pte Ltd,Little India,2025-05-27 16:29:33,https://id.jobstreet.com/id/job/84516091
84489166,Software Developer,Singapore Telecommunications Limited,Eunos,2025-05-26 16:29:33,https://id.jobstreet.com/id/job/84489166
84516004,Oracle OBIEE Developer,Unison Consulting Pte. Ltd.,Singapore,2025-05-27 16:29:33,https://id.jobstreet.com/id/job/84516004
84569452,Java / NodeJS - Full Stack Web Application Developer (Banking Technology),D L Resources Pte Ltd,Singapore,2025-05-29 16:29:33,https://id.jobstreet.com/id/job/84569452
84324445,FullStack Developer (with Backbase Certification) - Remote from anywhere & WFH,Mindteck Singapore Pte Ltd,Downtown Tanjong Pagar,2025-05-19 16:29:33,https://id.jobstreet.com/id/job/84324445
84344931,Senior Backend Software Developer,PLUVIA PTE. LTD.,National University Of Singapore,2025-05-20 16:29:33,https://id.jobstreet.com/id/job/84344931
80522755,Tagetik Application Developer,Unison Consulting Pte. Ltd.,Singapore,2025-05-06 16:29:33,https://id.jobstreet.com/id/job/80522755
84357249,Software Developer,TechCom Solutions Pte Ltd,Singapore,2025-05-20 16:29:33,https://id.jobstreet.com/id/job/84357249
78511436,"Data Engineer, Digital Government Blueprint (DGB 2.0)",Public Service Division,Singapore,2025-05-06 16:29:33,https://id.jobstreet.com/id/job/78511436
84379956,Backend Software Developer (Senior),MSI Global Pte Ltd,East Region,2025-05-21 16:29:33,https://id.jobstreet.com/id/job/84379956
84568838,Data Strategy & Transformation (VP/Director),Evolution Recruitment Solutions Pte Ltd,Central Region,2025-05-29 16:29:33,https://id.jobstreet.com/id/job/84568838
84514400,Staff Software Engineer,VISA WORLDWIDE PTE. LIMITED,Singapore,2025-05-27 16:29:33,https://id.jobstreet.com/id/job/84514400
84252525,SOFTWARE ANALYST,Chuan Lim Construction Pte Ltd,North Region,2025-05-15 16:29:33,https://id.jobstreet.com/id/job/84252525
84447058,Backend Developer,TechnoPals Pte Ltd,West Region,2025-05-23 16:29:33,https://id.jobstreet.com/id/job/84447058
84329868,Software Developer,TechCom Solutions Pte Ltd,Singapore,2025-05-19 16:29:33,https://id.jobstreet.com/id/job/84329868
84578072,Full Stack Developer (Hybrid Work),CFB BOTS PTE. LTD.,Singapore,2025-05-29 16:29:33,https://id.jobstreet.com/id/job/84578072
84504373,IT FULL STACK DEVELOPER,SOLO PTE. LTD.,Boon Lay,2025-05-27 16:29:33,https://id.jobstreet.com/id/job/84504373
84606913,"AVP, Software Developer (Investment Services), Technology Group (1 Year",GIC Private Limited,Singapore,2025-05-31 16:29:33,https://id.jobstreet.com/id/job/84606913
84704370,System Analyst,Abeam Consulting (Singapore) Pte Ltd,Singapore,2025-06-04 16:29:33,https://id.jobstreet.com/id/job/84704370
84070250,Senior Platform Engineer – Data & AI,Equinix Asia Pacific,Singapore,2025-05-08 16:29:33,https://id.jobstreet.com/id/job/84070250
84387213,Software Developer,ASTEK Singapore Innovation Technology Pte. Ltd.,Central Region,2025-05-21 16:29:33,https://id.jobstreet.com/id/job/84387213
84387199,Software Developer- OpenText AppWorks,Nucleus Software Solutions Pte Ltd,Singapore,2025-05-21 16:29:33,https://id.jobstreet.com/id/job/84387199
84138952,Software Engineer (Embedded Systems),Thales,Singapore,2025-05-09 16:29:33,https://id.jobstreet.com/id/job/84138952
84707697,Assoc Software Engineer (Tech Management),Synapxe,One North,2025-06-04 16:29:33,https://id.jobstreet.com/id/job/84707697
84413021,Software Developer,Saksoft Pte Ltd,Little India,2025-05-22 16:29:33,https://id.jobstreet.com/id/job/84413021
84295008,Senior Staff/Staff Engineer System Developer (Contract),Infineon Technologies,Singapore,2025-05-17 16:29:33,https://id.jobstreet.com/id/job/84295008
84640769,Lead Application Developer (AEM/ Java),Temus Pte. Ltd.,Singapore,2025-06-02 16:29:33,https://id.jobstreet.com/id/job/84640769
84668692,Fullstack Software Developer (Java / Scala),Combuilder Pte Ltd,Singapore,2025-06-03 16:29:33,https://id.jobstreet.com/id/job/84668692
84668190,Lead Software Engineer,Triple A Technologies Pte Ltd,Singapore,2025-06-03 16:29:33,https://id.jobstreet.com/id/job/84668190
84515383,Software Developer,Saksoft Pte Ltd,Little India,2025-05-27 16:29:33,https://id.jobstreet.com/id/job/84515383
84702177,Software Developer,CGG Services (Singapore) Pte Ltd,North Region,2025-06-04 16:29:33,https://id.jobstreet.com/id/job/84702177
84310937,Senior GIS Software Developer,PLUVIA PTE. LTD.,National University Of Singapore,2025-05-19 16:29:33,https://id.jobstreet.com/id/job/84310937
84697728,Senior Software Developer,Allegis Group Singapore Pte Ltd,Singapore,2025-06-03 16:29:33,https://id.jobstreet.com/id/job/84697728
84669627,Salesforce Developer,AvePoint,Singapore,2025-06-03 16:29:33,https://id.jobstreet.com/id/job/84669627
84697153,Senior Frontend Developer,Allegis Group Singapore Pte Ltd,Singapore,2025-06-03 16:29:33,https://id.jobstreet.com/id/job/84697153
84641379,Senior Software Engineer,Triple A Technologies Pte Ltd,Anson,2025-06-02 16:29:33,https://id.jobstreet.com/id/job/84641379
84701592,Expert Java Software Developer (Must have Banking industry experience),LUXOFT INFORMATION TECHNOLOGY (SINGAPORE) PTE. LTD.,Singapore,2025-06-04 16:29:33,https://id.jobstreet.com/id/job/84701592
84382524,Software and Applications Developer,Saksoft Pte Ltd,Little India,2025-05-21 16:29:33,https://id.jobstreet.com/id/job/84382524
84515998,IT Application Developer,KGI Securities (Singapore) Pte. Ltd.,Central Region,2025-05-27 16:29:33,https://id.jobstreet.com/id/job/84515998
84503386,Software Developer (MS .Net),Innovate Consulting LLP,Singapore,2025-05-27 16:29:33,https://id.jobstreet.com/id/job/84503386
84384991,Senior Business Analyst II,MICRON SEMICONDUCTOR ASIA OPERATIONS PTE LTD,Singapore,2025-05-20 16:29:33,https://id.jobstreet.com/id/job/84384991
84355183,Front-End Developer (AI Lab) (2-Year Contract),Prudential (WM Group- Linda Quah),Singapore,2025-05-20 16:29:33,https://id.jobstreet.com/id/job/84355183
84447377,FULL STACK SOFTWARE DEVELOPER,G-TECH METAL PTE. LTD.,North Region,2025-05-23 16:29:33,https://id.jobstreet.com/id/job/84447377
84286048,Software Developer,Saksoft Pte Ltd,Little India,2025-05-16 16:29:33,https://id.jobstreet.com/id/job/84286048
84222983,"Sr. Engineering Manager (Golang, React)",VISA WORLDWIDE PTE. LIMITED,Singapore,2025-05-14 16:29:33,https://id.jobstreet.com/id/job/84222983
84329147,Junior Software Developer,ATT Digiverse,Singapore,2025-05-19 16:29:33,https://id.jobstreet.com/id/job/84329147
84517040,Senior ServiceNow Developer,DXC TECHNOLOGY SERVICES SINGAPORE PTE. LTD.,Singapore,2025-05-27 16:29:33,https://id.jobstreet.com/id/job/84517040
84654637,Software Development Manager (ServiceNow),CLOUDGO PTE. LTD.,Central Region,2025-06-02 16:29:33,https://id.jobstreet.com/id/job/84654637
84387740,Software Developer,IBASE TECHNOLOGY PRIVATE LIMITED,Paya Lebar Air Base,2025-05-21 16:29:33,https://id.jobstreet.com/id/job/84387740
84603417,C++ Software Developer,MSI Global Pte Ltd,East Region,2025-05-30 16:29:33,https://id.jobstreet.com/id/job/84603417
84515524,Software Developer (1-year contract),AXS Pte Ltd,Boon Keng,2025-05-27 16:29:33,https://id.jobstreet.com/id/job/84515524
84128774,Software Developer (Python),FINSURGE PTE. LTD.,Changi,2025-05-09 16:29:33,https://id.jobstreet.com/id/job/84128774
84323773,Full Stack Developer,DIGITAL BIZ SOLUTIONS PTE. LTD.,Changi,2025-05-19 16:29:33,https://id.jobstreet.com/id/job/84323773
84447554,C++ Database Developer,Ahrefs Pte Ltd,Singapore,2025-05-23 16:29:33,https://id.jobstreet.com/id/job/84447554
84728099,Software Engineer (Java),Aquariux Pte. Ltd.,Singapore,2025-06-05 05:29:33,https://id.jobstreet.com/id/job/84728099
84101413,Software Developer,Solderfield Pte Ltd,Paya Lebar Air Base,2025-05-08 16:29:33,https://id.jobstreet.com/id/job/84101413
84646898,Software Developer (Java/ Spring Boot/ Google Cloud),Steenbok Pte Ltd,Singapore,2025-06-02 16:29:33,https://id.jobstreet.com/id/job/84646898
84603515,Systems Programmer,Coilcraft Singapore Pte Ltd,Bedok,2025-05-30 16:29:33,https://id.jobstreet.com/id/job/84603515
84293982,"Software Developer (career change, no experience required)",Singapore Institute of Career Development Pte. Ltd.,Central Region,2025-05-17 16:29:33,https://id.jobstreet.com/id/job/84293982
84381775,Full-Stack Software Developer,Aegis Technologies Pte. Ltd.,Singapore,2025-05-21 16:29:33,https://id.jobstreet.com/id/job/84381775
84568509,Developer/Software Developer – Spring Boot and React (109),Success IT Consultancy & Services Pte Ltd,Singapore,2025-05-29 16:29:33,https://id.jobstreet.com/id/job/84568509
84276970,C++ Application Developer,UST Global (M) Sdn Bhd,Yishun Central,2025-05-16 16:29:33,https://id.jobstreet.com/id/job/84276970
84572455,Software Engineer,AvePoint,Singapore,2025-05-29 16:29:33,https://id.jobstreet.com/id/job/84572455
84459446,Application Developer,Thomson Medical Pte Ltd,Singapore,2025-05-06 16:29:33,https://id.jobstreet.com/id/job/84459446
84572446,Software Developer,Xtremax Pte Ltd,Lavender,2025-05-29 16:29:33,https://id.jobstreet.com/id/job/84572446
84641570,MCF - Senior Software Developer - RPA UiPath,Abeam Consulting (Singapore) Pte Ltd,Singapore,2025-06-02 16:29:33,https://id.jobstreet.com/id/job/84641570
84225650,Software Developer C++/Rust,Grasshopper Pte. Ltd.,Anson,2025-05-14 16:29:33,https://id.jobstreet.com/id/job/84225650
84278287,Senior Software Engineer (Mobile Developer),,Marina Centre,2025-05-16 16:29:33,https://id.jobstreet.com/id/job/84278287
84225448,Software Developer,Solderfield Pte Ltd,Paya Lebar Air Base,2025-05-14 16:29:33,https://id.jobstreet.com/id/job/84225448
84641124,Senior Application Consultant (Java),Activate Interactive Pte Ltd,Eunos,2025-06-02 16:29:33,https://id.jobstreet.com/id/job/84641124
84641675,Senior Application Consultant (Java),Activate Interactive Pte Ltd,East Region,2025-06-03 16:29:33,https://id.jobstreet.com/id/job/84641675
84298059,Junior Software Engineer,FDM Group Limited,Singapore,2025-05-18 16:29:33,https://id.jobstreet.com/id/job/84298059
83943442,CMI Software Developer,Credit Agricole Corporate And Investment Bank,Singapore,2025-05-06 16:29:33,https://id.jobstreet.com/id/job/83943442
84442295,Cloud Software Developer,BIOTRONIK APM PTE. LTD.,Boon Keng,2025-05-23 16:29:33,https://id.jobstreet.com/id/job/84442295
84542931,Application Developer (Learning Applications),Singapore University of Social Sciences,Singapore,2025-05-06 16:29:33,https://id.jobstreet.com/id/job/84542931
84197118,Application Developer (.Net),Activants Pte Ltd,North Region,2025-05-13 16:29:33,https://id.jobstreet.com/id/job/84197118
84257172,"Engineering Director, Software Infrastructure",Motional,Pasir Panjang,2025-05-15 16:29:33,https://id.jobstreet.com/id/job/84257172
84556065,Job Title Principal Software Engineer,Waters Corporation,Singapore,2025-05-29 16:29:33,https://id.jobstreet.com/id/job/84556065
83199672,Sr. SW Test Engineer,VISA WORLDWIDE PTE. LIMITED,Singapore,2025-05-06 16:29:33,https://id.jobstreet.com/id/job/83199672
83895972,Junior .Net Developer,LUXOFT INFORMATION TECHNOLOGY (SINGAPORE) PTE. LTD.,Singapore,2025-05-06 16:29:33,https://id.jobstreet.com/id/job/83895972
83452297,Internship - IT Application Developer,Infineon Technologies,Singapore,2025-05-06 16:29:33,https://id.jobstreet.com/id/job/83452297
84603444,Java Developer (Spring Boot / Google Cloud Platform),Steenbok Pte Ltd,Singapore,2025-05-30 16:29:33,https://id.jobstreet.com/id/job/84603444
84516168,Software Developer( Java),Ridik,Paya Lebar Air Base,2025-05-27 16:29:33,https://id.jobstreet.com/id/job/84516168
84386027,Developer - L1,Wipro Limited (Singapore Branch),Tampines,2025-05-21 16:29:33,https://id.jobstreet.com/id/job/84386027
83261687,Java Software Developer,LUXOFT INFORMATION TECHNOLOGY (SINGAPORE) PTE. LTD.,Singapore,2025-05-06 16:29:33,https://id.jobstreet.com/id/job/83261687
83213780,G13 - Software Developer,FPT Asia Pacific Pte Ltd,Singapore,2025-05-06 16:29:33,https://id.jobstreet.com/id/job/83213780
84386539,Senior Software Robotics Developer,Unison Consulting Pte. Ltd.,Singapore,2025-05-21 16:29:33,https://id.jobstreet.com/id/job/84386539
83931372,Senior Software Developer,Prime Supermarket Limited,North Region,2025-05-06 16:29:33,https://id.jobstreet.com/id/job/83931372
84441613,Google Cloud Engineer (AMK),Combuilder Pte Ltd,Ang Mo Kio,2025-05-23 16:29:33,https://id.jobstreet.com/id/job/84441613
83199556,Staff SW Test Engineer,VISA WORLDWIDE PTE. LIMITED,Singapore,2025-05-06 16:29:33,https://id.jobstreet.com/id/job/83199556
84384106,Senior Software Robotics Developer,Bureau Veritas Singapore Pte Ltd,Singapore,2025-05-21 16:29:33,https://id.jobstreet.com/id/job/84384106
83454032,Software Engineer (Platform Developer),Unison Consulting Pte. Ltd.,Singapore,2025-05-06 16:29:33,https://id.jobstreet.com/id/job/83454032
84132221,SOFTWARE DEVELOPER,SPARK SYSTEMS PTE. LTD.,Central Region,2025-05-09 16:29:33,https://id.jobstreet.com/id/job/84132221
83199869,SW Engineer,VISA WORLDWIDE PTE. LIMITED,Singapore,2025-05-06 16:29:33,https://id.jobstreet.com/id/job/83199869
