Job_ID,Role,Company,Location,Publish_Time,URL
85235275,Software Engineer (Microsoft Dynamics),EPAM SYSTEMS PTE LTD,Singapore,2025-06-28 08:19:38,https://id.jobstreet.com/id/job/85235275
85074546,Software Integration Engineer,Tescom (S) Software Systems Testing Pte Ltd,Central Region,2025-06-21 08:19:38,https://id.jobstreet.com/id/job/85074546
80701492,Data Engineer (Credit Assessment) (In Partnership with IMDA),Phillip Securities Pte Ltd,Singapore,2025-06-03 08:19:38,https://id.jobstreet.com/id/job/80701492
85139088,"System Engineer, Banking (1-year renewable contract)",Evolution Recruitment Solutions Pte Ltd,Central Region,2025-06-24 08:19:38,https://id.jobstreet.com/id/job/85139088
83921619,Data Architect [DSAD],Public Service Division,Paya Lebar Air Base,2025-06-03 08:19:38,https://id.jobstreet.com/id/job/83921619
85434444,Intermediate Quality Assurance - Chennai,UPS Asia Group Pte. Ltd.,Singapore,2025-07-03 08:04:38,https://id.jobstreet.com/id/job/85434444
85263772,Application Development Consultant,Abeam Consulting (Singapore) Pte Ltd,Singapore,2025-06-30 08:19:38,https://id.jobstreet.com/id/job/85263772
85090431,AI / ML Engineer (DSC/CY/16612),ST Engineering Advanced Networks & Sensors Pte Ltd,Jurong East,2025-06-23 08:19:38,https://id.jobstreet.com/id/job/85090431
84476740,"Data Analyst, Management Information",Sengkang General Hospital Pte. Ltd.,Sengkang,2025-06-03 08:19:38,https://id.jobstreet.com/id/job/84476740
84929389,Data Scientist,Singapore Telecommunications Limited,Singapore,2025-06-15 08:19:38,https://id.jobstreet.com/id/job/84929389
85164740,Technical Lead – Service Operations and Analytics,Abbott Laboratories Pte Ltd,Singapore,2025-06-25 08:19:38,https://id.jobstreet.com/id/job/85164740
85379100,AI Product Management and Operation (Evaluation) - Flow,BYTEDANCE PTE. LTD.,Singapore,2025-07-02 11:19:38,https://id.jobstreet.com/id/job/85379100
85309683,Systems Engineer (DIgital Workplace),PLOY ASIA PTE. LTD.,Singapore,2025-07-02 08:19:38,https://id.jobstreet.com/id/job/85309683
85048723,Microsoft Dynamics Expert,Viseo Pte Ltd Inc.,Central Region,2025-06-19 08:19:38,https://id.jobstreet.com/id/job/85048723
85382880,Manager/ Senior Manager (Data Engineering),Inland Revenue Authority of Singapore (IRAS),Newton,2025-07-02 08:19:38,https://id.jobstreet.com/id/job/85382880
85307978,"Business Process Engineer – Analyst, Project Manager, and Operations Support",ADVANTEST (SINGAPORE) PTE. LTD.,Ang Mo Kio,2025-07-01 08:19:38,https://id.jobstreet.com/id/job/85307978
84918908,Senior Digitalization Specialist - Microsoft Power Platform & Python Development,Kellogg Brown & Root Asia Pacific Pte Ltd,Singapore,2025-06-14 08:19:38,https://id.jobstreet.com/id/job/84918908
85207040,AI/ML Engineer,EVERSAFE ACADEMY PTE. LTD.,Little India,2025-06-26 08:19:38,https://id.jobstreet.com/id/job/85207040
85080081,"Manager/ Senior Manager, Data Engineering & Architecture (9 month contract)",Health Promotion Board - HPB,Singapore,2025-06-21 08:19:38,https://id.jobstreet.com/id/job/85080081
85233769,Collaboration Technical Services Systems Integration Specialist,NTT DATA SERVICES SINGAPORE PTE. LTD.,Central Region,2025-06-28 08:19:38,https://id.jobstreet.com/id/job/85233769
83015218,G01 - Solution Architect,FPT Asia Pacific Pte Ltd,Singapore,2025-06-03 08:19:38,https://id.jobstreet.com/id/job/83015218
84767741,"Intermediate Application Developer -Azure, ADF, PySpark",UPS Asia Group Pte. Ltd.,Singapore,2025-07-02 08:19:38,https://id.jobstreet.com/id/job/84767741
83649507,Senior Data Engineer,Mediacorp Pte Ltd,Singapore,2025-06-03 08:19:38,https://id.jobstreet.com/id/job/83649507
85019267,Outsystems Developer,Temus Pte. Ltd.,Singapore,2025-06-18 08:19:38,https://id.jobstreet.com/id/job/85019267
85145409,MES Engineer - POMSNet,Cognizant Technology Solutions Asia Pacific Pte Ltd,Singapore,2025-06-24 08:19:38,https://id.jobstreet.com/id/job/85145409
84915226,Intelligent Computing Architecture and Operating System Researcher-Soaring...,BYTEDANCE PTE. LTD.,Central Region,2025-06-13 08:19:38,https://id.jobstreet.com/id/job/84915226
85015487,Applications Support Engineer,Singapore American School Limited,Woodlands,2025-06-18 08:19:38,https://id.jobstreet.com/id/job/85015487
82131033,Platinion Principal Data/AI Architect,THE BOSTON CONSULTING GROUP PTE. LTD.,Singapore,2025-06-03 08:19:38,https://id.jobstreet.com/id/job/82131033
85263747,Application Development Senior Consultant,Abeam Consulting (Singapore) Pte Ltd,Singapore,2025-06-30 08:19:38,https://id.jobstreet.com/id/job/85263747
84568563,Data Strategy & Architecture Manager,Evolution Recruitment Solutions Pte Ltd,Central Region,2025-06-03 08:19:38,https://id.jobstreet.com/id/job/84568563
84936777,Machine Learning Software Engineer,Innowave Tech Pte Ltd,Paya Lebar East,2025-06-16 08:19:38,https://id.jobstreet.com/id/job/84936777
85158936,SAS Administrator,Saksoft Pte Ltd,Singapore,2025-06-25 08:19:38,https://id.jobstreet.com/id/job/85158936
84517050,"Integration, Verification and Validation Engineer",Thales,Singapore,2025-06-03 08:19:38,https://id.jobstreet.com/id/job/84517050
84915025,"Vice President, Data Platform Lead, Technology Service Delivery Group",Sumitomo Mitsui Banking Corporation,Singapore,2025-06-14 08:19:38,https://id.jobstreet.com/id/job/84915025
84568838,Data Strategy & Transformation (VP/Director),Evolution Recruitment Solutions Pte Ltd,Central Region,2025-06-03 08:19:38,https://id.jobstreet.com/id/job/84568838
85226890,Process Engineer,Winner Engineering Pte Ltd,Woodlands,2025-06-27 08:19:38,https://id.jobstreet.com/id/job/85226890
84219657,Cloud Data Engineer,PLOY ASIA PTE. LTD.,Singapore,2025-06-03 08:19:38,https://id.jobstreet.com/id/job/84219657
84853981,AI Engineer,AppsPOS Pte Ltd,Singapore,2025-06-11 08:19:38,https://id.jobstreet.com/id/job/84853981
85207859,R&D Engineer,DOCTOR WORLD PTE. LTD.,Singapore,2025-06-25 08:19:38,https://id.jobstreet.com/id/job/85207859
84955607,"Senior Solutions Integration Architect, DxD Hub",A*STAR Research Entities (A*STAR),Singapore,2025-06-16 08:19:38,https://id.jobstreet.com/id/job/84955607
85247329,Engineering Specialist (2 Years' Contract),UPS Asia Group Pte. Ltd.,Gul Circle,2025-06-30 08:19:38,https://id.jobstreet.com/id/job/85247329
81967684,Assistant Lead Engineer - Java & OSB (Software Development),Synapxe,Singapore,2025-06-03 08:19:38,https://id.jobstreet.com/id/job/81967684
85238036,Senior Business Intelligence Analyst,MICRON SEMICONDUCTOR ASIA OPERATIONS PTE LTD,Singapore,2025-06-27 08:19:38,https://id.jobstreet.com/id/job/85238036
84672517,Enterprise Architect,Virtusa Singapore Private Limited,Moulmein,2025-06-04 08:19:38,https://id.jobstreet.com/id/job/84672517
84577766,"AVP, Observability Engineer, Technology Group (1-year Contract)",GIC Private Limited,Tampines,2025-06-03 08:19:38,https://id.jobstreet.com/id/job/84577766
85135422,Senior Machine Learning Engineer,Ensign InfoSecurity (Singapore) Pte. Ltd.,Central Region,2025-06-25 08:19:38,https://id.jobstreet.com/id/job/85135422
85226806,AS400 Developer,Saksoft Pte Ltd,Little India,2025-06-27 08:19:38,https://id.jobstreet.com/id/job/85226806
85310579,Internship – AIOps at Factory Integration Operation Center,Infineon Technologies,Singapore,2025-07-01 08:19:38,https://id.jobstreet.com/id/job/85310579
85107206,Assistant Business Analyst - Data (Engineering & Ops),Synapxe,Singapore,2025-06-23 08:19:38,https://id.jobstreet.com/id/job/85107206
85007222,Infrastructure Engineer (Data Center) (Contract),Public Service Division,Singapore,2025-06-18 08:19:38,https://id.jobstreet.com/id/job/85007222
83384091,"VP, Senior Azure Data Platform Solution Architect (JRI-4695)",Sumitomo Mitsui Banking Corporation,Singapore,2025-06-03 08:19:38,https://id.jobstreet.com/id/job/83384091
85008097,Digital Business Analyst [DTD],Public Service Division,Paya Lebar Air Base,2025-06-18 08:19:38,https://id.jobstreet.com/id/job/85008097
85227678,Ai Engineer,IZIA,Jurong Gateway,2025-06-27 08:19:38,https://id.jobstreet.com/id/job/85227678
85074630,"Senior Director, Data Platform Mgmt",Singapore Telecommunications Limited,Singapore,2025-06-18 08:19:38,https://id.jobstreet.com/id/job/85074630
85263671,Senior/ Consultant (Lab/Enterprise IT Computer System Validation)...,NNIT Singapore Pte Ltd,Tuas,2025-06-30 08:19:38,https://id.jobstreet.com/id/job/85263671
85019027,AI Engineer- Artificial Intelligence,WSH Experts Pte Ltd,Singapore,2025-06-19 08:19:38,https://id.jobstreet.com/id/job/85019027
85312500,Software Developer,Saksoft Pte Ltd,Little India,2025-07-01 08:19:38,https://id.jobstreet.com/id/job/85312500
84992511,"Permanent Solution Architect – Data Analytics and AI Singapore, South West,...","BNP PARIBAS, Singapore Branch",West Region,2025-06-18 08:19:38,https://id.jobstreet.com/id/job/84992511
85174896,Cloudera Engineer,NCS Pte Ltd,Singapore,2025-06-26 08:19:38,https://id.jobstreet.com/id/job/85174896
84910911,Manufacturing Associate Engineer - HPCJ,Beyondsoft International (Singapore) Pte Ltd,Singapore,2025-06-13 08:19:38,https://id.jobstreet.com/id/job/84910911
85044055,Staff SW Engineer - AIOPS developer,VISA WORLDWIDE PTE. LIMITED,Singapore,2025-06-20 08:19:38,https://id.jobstreet.com/id/job/85044055
85115415,System Engineer,Saksoft Pte Ltd,Little India,2025-06-24 08:19:38,https://id.jobstreet.com/id/job/85115415
85145603,Enterprise Architect (CRM and Data),Income Insurance Limited,Bras Basah,2025-06-24 08:19:38,https://id.jobstreet.com/id/job/85145603
85168018,Uni Internship Jan to May 2026 - Development on Search and Retrieval Strategies,Synapxe,Singapore,2025-06-25 08:19:38,https://id.jobstreet.com/id/job/85168018
85367235,Senior Storage and Backup Engineer - Netbackup,MCITS TECHNOLOGIES PTE. LTD.,Singapore,2025-07-02 08:19:38,https://id.jobstreet.com/id/job/85367235
85267468,IT SYSTEM ENGINEER,Vizzio Technologies Pte Ltd,Kampong Ubi,2025-07-01 08:19:38,https://id.jobstreet.com/id/job/85267468
85298212,Reliability Engineering Specialist,Advanced Micro Devices (S) Pte Ltd,Singapore,2025-07-01 08:19:38,https://id.jobstreet.com/id/job/85298212
85156635,API & Web Developer (Networks),Singapore Telecommunications Limited,Singapore,2025-06-19 08:19:38,https://id.jobstreet.com/id/job/85156635
84821890,Application Engineer,AIMFLEX Singapore Pte Ltd,Kallang,2025-06-12 08:19:38,https://id.jobstreet.com/id/job/84821890
85382975,Postgres Software Engineer,Combuilder Pte Ltd,Singapore,2025-07-02 08:19:38,https://id.jobstreet.com/id/job/85382975
85068751,Cloud Solution Architect,Upskills Pte Ltd,Singapore,2025-06-20 08:19:38,https://id.jobstreet.com/id/job/85068751
84842831,Senior System Administrator/Engineer (SA/E),MSI Global Pte Ltd,East Region,2025-06-11 08:19:38,https://id.jobstreet.com/id/job/84842831
84912159,"Specialist, AI Engineering",MSD,Singapore,2025-06-14 08:19:38,https://id.jobstreet.com/id/job/84912159
84915186,Solutions Architect (Apps & DevOps),CTC Global Pte. Ltd.,Tiong Bahru,2025-06-13 08:19:38,https://id.jobstreet.com/id/job/84915186
85050056,IT Operations Support,WSH Experts Pte Ltd,Central Region,2025-06-20 08:19:38,https://id.jobstreet.com/id/job/85050056
84989799,Digital Business Analyst [DTD],Workforce Singapore (WSG),Paya Lebar Air Base,2025-06-18 08:19:38,https://id.jobstreet.com/id/job/84989799
84877010,"Senior/Principal Engineer, IT (Technical Solutions)",Scoot Pte Ltd,Singapore,2025-06-12 08:19:38,https://id.jobstreet.com/id/job/84877010
84935046,AI Solution Engineer,GECO Asia Pte. Ltd,Jurong East,2025-06-16 08:19:38,https://id.jobstreet.com/id/job/84935046
84846914,Machine Learning / GenAI Engineer,Regask Pte. Ltd.,Singapore,2025-06-11 08:19:38,https://id.jobstreet.com/id/job/84846914
84444685,Analyst-Senior Principal Analyst (Data Systems & Technology/ DAD),Public Service Division,Singapore,2025-06-03 08:19:38,https://id.jobstreet.com/id/job/84444685
85167790,Uni Internship Jan to May 2026 - SingHealth Queue Management System (QMS)...,Synapxe,Singapore,2025-06-25 08:19:38,https://id.jobstreet.com/id/job/85167790
85374631,"Lead Software Engr, Intelligent Transp.",NCS Pte Ltd,Singapore,2025-07-02 09:19:38,https://id.jobstreet.com/id/job/85374631
85207549,AI Architect,Infosys Limited,Maritime Square,2025-06-25 08:19:38,https://id.jobstreet.com/id/job/85207549
85072530,AI Solutions Associate,Singapore Productivity Centre,Eunos,2025-06-20 08:19:38,https://id.jobstreet.com/id/job/85072530
85308559,Software Engineer – Java / Sybase/SQL / Unix,ANTAS PTE. LTD.,Singapore,2025-07-02 08:19:38,https://id.jobstreet.com/id/job/85308559
85169193,Solution Architect,AvePoint,Singapore,2025-06-16 08:19:38,https://id.jobstreet.com/id/job/85169193
80701481,Database Security Engineer (In Partnership with IMDA),Phillip Securities Pte Ltd,Singapore,2025-06-03 08:19:38,https://id.jobstreet.com/id/job/80701481
84852634,Intern AI Engineer / Junior AI Engineer,THE PLATTERING CO PTE. LTD.,Bedok,2025-06-10 08:19:38,https://id.jobstreet.com/id/job/84852634
85234747,Automation Architect - TEKsystems (Allegis Group Singapore Pte Ltd),Allegis Group Singapore Pte Ltd,Singapore,2025-06-28 08:19:38,https://id.jobstreet.com/id/job/85234747
84070250,Senior Platform Engineer – Data & AI,Equinix Asia Pacific,Singapore,2025-06-03 08:19:38,https://id.jobstreet.com/id/job/84070250
85431918,Mainframe Senior Software Development Engineer,UPS Asia Group Pte. Ltd.,Singapore,2025-07-03 03:19:38,https://id.jobstreet.com/id/job/85431918
84995483,Backend Engineer,GECO Asia Pte. Ltd,Jurong East,2025-06-18 08:19:38,https://id.jobstreet.com/id/job/84995483
84983577,Sr. SW Engineer,VISA WORLDWIDE PTE. LIMITED,Singapore,2025-06-17 08:19:38,https://id.jobstreet.com/id/job/84983577
84957022,Analyst Programmer Tech Lead,WPH Digital Pte Ltd,Pasir Panjang,2025-06-16 08:19:38,https://id.jobstreet.com/id/job/84957022
84959819,Group Product Manager (API Platform),WORKATO PTE. LTD,Singapore,2025-06-17 08:19:38,https://id.jobstreet.com/id/job/84959819
85145799,"Principal Engineer, NTI NAND Process Integration (CMOS)",MICRON SEMICONDUCTOR ASIA OPERATIONS PTE LTD,North Region,2025-06-25 08:19:38,https://id.jobstreet.com/id/job/85145799
80894075,Outsystems Engineer,WSH Experts Pte Ltd,Singapore,2025-06-03 08:19:38,https://id.jobstreet.com/id/job/80894075
85115989,MES Senior Engineer,Hi-P International Pte. Ltd,West Region,2025-06-23 08:19:38,https://id.jobstreet.com/id/job/85115989
85056609,VP - Technology - IT Operations,NETS,Central Region,2025-06-20 08:19:38,https://id.jobstreet.com/id/job/85056609
81230670,Engineer data center,Princeton Digital Group (Singapore) SG1 Pte Ltd,Singapore,2025-06-03 08:19:38,https://id.jobstreet.com/id/job/81230670
85244506,Full-Stack Engineer (GovTech CEP- StackOps) (Contract),Websparks Pte Ltd,East Region,2025-06-29 08:19:38,https://id.jobstreet.com/id/job/85244506
85018571,Automation Software Engineer,Illumina Singapore Pte Ltd,Woodlands,2025-06-18 08:19:38,https://id.jobstreet.com/id/job/85018571
84813057,"AVP, Software Engineer (Investment Services), Technology Group",GIC Private Limited,Singapore,2025-06-10 08:19:38,https://id.jobstreet.com/id/job/84813057
85018514,SAN Implementation engineer (Cisco & Brocade),MTS Global Pte Ltd,Boon Keng,2025-06-19 08:19:38,https://id.jobstreet.com/id/job/85018514
84836692,AI Engineer Intern,THE PLATTERING CO PTE. LTD.,Bedok,2025-06-11 08:19:38,https://id.jobstreet.com/id/job/84836692
85234742,Senior Software Engineer - TEKsystems (Allegis Group Singapore Pte Ltd),Allegis Group Singapore Pte Ltd,Singapore,2025-06-28 08:19:38,https://id.jobstreet.com/id/job/85234742
85207889,Application Engineer,Applied Materials South East Asia Pte Ltd,Changi,2025-06-25 08:19:38,https://id.jobstreet.com/id/job/85207889
84983632,Machine Learning Engineer,Goldtech Resources Pte Ltd,Singapore,2025-06-17 08:19:38,https://id.jobstreet.com/id/job/84983632
85407252,Lead DevOps Engineer (Robust background in Google Cloud Platform (GCP) |...,UPS Asia Group Pte. Ltd.,Singapore,2025-07-02 12:19:38,https://id.jobstreet.com/id/job/85407252
81631680,Cloud Infrastructure Engineer (System and ServiceNow Experience),Assurity Trusted Solutions Pte Ltd,Singapore,2025-06-12 08:19:38,https://id.jobstreet.com/id/job/81631680
84850459,DevOps Engineer,INNOVATIQ TECHNOLOGIES PTE. LTD.,Central Region,2025-06-11 08:19:38,https://id.jobstreet.com/id/job/84850459
85232557,.NET Developer 0642C,USER EXPERIENCE RESEARCHERS PTE. LTD,Singapore,2025-06-28 08:19:38,https://id.jobstreet.com/id/job/85232557
84726827,Outsource Infrastructure Engineer (12-Month Contract),NTC Integration Pte Ltd,Bukit Merah,2025-06-05 08:19:38,https://id.jobstreet.com/id/job/84726827
84726305,Senior Business Analyst,Illumina Singapore Pte Ltd,Woodlands,2025-06-05 08:19:38,https://id.jobstreet.com/id/job/84726305
85137718,LLM Global Data - Training Operation (Coding) Specialist,BYTEDANCE PTE. LTD.,Central Region,2025-06-24 08:19:38,https://id.jobstreet.com/id/job/85137718
85186938,Business Analyst - Collateral Management,LUXOFT INFORMATION TECHNOLOGY (SINGAPORE) PTE. LTD.,Central Region,2025-06-26 08:19:38,https://id.jobstreet.com/id/job/85186938
85272427,Principal SAP SuccessFactors Consultant,Systems on Silicon Manufacturing Co Pte Ltd,Pasir Ris,2025-07-01 08:19:38,https://id.jobstreet.com/id/job/85272427
84883711,Package Development Engineering Metro Real-time Defect Analysis (MRDA)...,MICRON SEMICONDUCTOR ASIA OPERATIONS PTE LTD,Singapore,2025-06-13 08:19:38,https://id.jobstreet.com/id/job/84883711
85168020,Uni Internship Jan to May 2026 - Collaborative AI Systems with Agentic...,Synapxe,Singapore,2025-06-25 08:19:38,https://id.jobstreet.com/id/job/85168020
84882070,"Manager, Data Partnerships & Technologies",Singapore Telecommunications Limited,Singapore,2025-06-13 08:19:38,https://id.jobstreet.com/id/job/84882070
85108164,Staff DFT Digital Design Engineer,Marvell Asia Pte Ltd,Singapore,2025-06-23 08:19:38,https://id.jobstreet.com/id/job/85108164
84881869,Lead Solution Designer,Singapore Telecommunications Limited,Singapore,2025-06-13 08:19:38,https://id.jobstreet.com/id/job/84881869
85120498,Application Developer & Assistant IT Project Manager (SCDS/EL),ST Engineering,Jurong East,2025-06-24 08:19:38,https://id.jobstreet.com/id/job/85120498
84881149,"Software Engineer, CIP Platform (AE05)",WPH Digital Pte Ltd,Singapore,2025-06-12 08:19:38,https://id.jobstreet.com/id/job/84881149
83549444,Staff Solution Engineer,InstaReM Pte Limited,Singapore,2025-06-03 08:19:38,https://id.jobstreet.com/id/job/83549444
85307382,Software Quality Manager,Thales,Queenstown,2025-07-01 08:19:38,https://id.jobstreet.com/id/job/85307382
84983375,Sensor / IoT Engineer,PLOY ASIA PTE. LTD.,Singapore,2025-06-17 08:19:38,https://id.jobstreet.com/id/job/84983375
84515279,Recommendation System Architecture Engineer- Soaring Star Talent Program,BYTEDANCE PTE. LTD.,Singapore,2025-06-03 08:19:38,https://id.jobstreet.com/id/job/84515279
84880947,Junior Systems Engineer (DevOps),EPAM SYSTEMS PTE LTD,Singapore,2025-06-12 08:19:38,https://id.jobstreet.com/id/job/84880947
84728134,"Director, Global Manufacturing Excellence",Excelitas Technologies Singapore Pte. Ltd.,Boon Lay,2025-06-05 08:19:38,https://id.jobstreet.com/id/job/84728134
85404883,IT Lead – Payroll Systems,Oneness M&C Pte Ltd,Tai Seng,2025-07-03 02:19:38,https://id.jobstreet.com/id/job/85404883
85073006,System Engineer,Acronis Asia Research and Development Pte Ltd,Central Region,2025-06-20 08:19:38,https://id.jobstreet.com/id/job/85073006
85167896,Uni Internship Jan to May 2026 - Development of Small Language Models (SLMs)...,Synapxe,Singapore,2025-06-25 08:19:38,https://id.jobstreet.com/id/job/85167896
84852181,Business IT Analyst,A. P. Moller - Maersk Group,Singapore,2025-06-11 08:19:38,https://id.jobstreet.com/id/job/84852181
84963176,Seed LLM Global Data - Model Safety Analyst,BYTEDANCE PTE. LTD.,Singapore,2025-06-17 08:19:38,https://id.jobstreet.com/id/job/84963176
84813879,Perception Engineer,Augmentus Pte. Ltd.,West Region,2025-06-10 08:19:38,https://id.jobstreet.com/id/job/84813879
84666952,Associate Software Engineer - CRM Dynamics 365 (Software Development),Synapxe,Singapore,2025-06-04 08:19:38,https://id.jobstreet.com/id/job/84666952
84754995,Cloud Application Architect,Temus Pte. Ltd.,Singapore,2025-06-06 08:19:38,https://id.jobstreet.com/id/job/84754995
84728383,Software Engineer – Engineering Solutions / Cloud / AI,BIMAGE CONSULTING PTE LTD,Singapore,2025-06-05 08:19:38,https://id.jobstreet.com/id/job/84728383
84764513,Foundation IP Memory Verification Engineer,Broadcom Singapore Pte Ltd,Khatib,2025-06-05 08:19:38,https://id.jobstreet.com/id/job/84764513
85048969,NTI Real-Time Defect Analysis (RDA) Engineer Process Development - NAND,MICRON SEMICONDUCTOR ASIA OPERATIONS PTE LTD,Singapore,2025-06-17 08:19:38,https://id.jobstreet.com/id/job/85048969
83666981,Principal Geomatics Engineer (Business Analyst - Data),Public Service Division,Singapore,2025-06-03 08:19:38,https://id.jobstreet.com/id/job/83666981
84274870,Senior Database Administrator,NCS Pte Ltd,Singapore,2025-06-03 08:19:38,https://id.jobstreet.com/id/job/84274870
84753772,Product Manager - Enabler,SCB-JULIUS BAER (SINGAPORE) PTE. LTD.,Singapore,2025-06-06 08:19:38,https://id.jobstreet.com/id/job/84753772
84755366,Reports Deputy Team Lead (SAP BI & Data),Evolution Recruitment Solutions Pte Ltd,Singapore,2025-06-06 08:19:38,https://id.jobstreet.com/id/job/84755366
85206267,Presales Engineer - Data Security,Thales,Queenstown,2025-06-26 08:19:38,https://id.jobstreet.com/id/job/85206267
85206300,"Software Engineer (AML, OpenText)- Contract",QUESS SINGAPORE,Singapore,2025-06-26 08:19:38,https://id.jobstreet.com/id/job/85206300
85072685,"Intermediate DevOps Engineer (Capital Markets Front-to-Back Office, AWS...",ANTAES ASIA PTE. LTD.,Marina South,2025-06-20 08:19:38,https://id.jobstreet.com/id/job/85072685
84957268,DevSecOps Engineer (AC14),WPH Digital Pte Ltd,Singapore,2025-06-16 08:19:38,https://id.jobstreet.com/id/job/84957268
85115081,Business Analyst,TechnoPals Pte Ltd,West Region,2025-06-23 08:19:38,https://id.jobstreet.com/id/job/85115081
85231436,"Associate Director, Supply Chain Process Transformation",Becton Dickinson Medical (S) Pte Ltd,Singapore,2025-06-27 08:19:38,https://id.jobstreet.com/id/job/85231436
84127551,"Project Manager, Business Intelligence, Digital Solutions",INSEAD,Singapore,2025-06-03 08:19:38,https://id.jobstreet.com/id/job/84127551
85050038,Prompt Engineer,BELIVE TECHNOLOGY PTE LTD,Central Region,2025-06-19 08:19:38,https://id.jobstreet.com/id/job/85050038
85079318,"Engineering Manager, Managed Agencies (NEA)",Public Service Division,Singapore,2025-06-21 08:19:38,https://id.jobstreet.com/id/job/85079318
85206121,Dot Net Developer,Unison Consulting Pte. Ltd.,Singapore,2025-06-26 08:19:38,https://id.jobstreet.com/id/job/85206121
84756095,Cloud Infrastructure Engineer - MS,Beyondsoft International (Singapore) Pte Ltd,Singapore,2025-06-06 08:19:38,https://id.jobstreet.com/id/job/84756095
81409467,AI Engineer,Public Service Division,Singapore,2025-06-03 08:19:38,https://id.jobstreet.com/id/job/81409467
84804312,"Lead / Senior Software Engineer (Applications Consultant), Consulting Practice",Public Service Division,Singapore,2025-06-10 08:19:38,https://id.jobstreet.com/id/job/84804312
84516245,Intelligent Computing Architecture and Operating System Researcher-Soaring...,BYTEDANCE PTE. LTD.,Singapore,2025-06-03 08:19:38,https://id.jobstreet.com/id/job/84516245
85241562,Area Product Owner - Trading & Execution Platform (Manager/AVP) - Bank of...,Bank of Singapore Limited,Singapore,2025-06-29 08:19:38,https://id.jobstreet.com/id/job/85241562
85273467,K2 Principal Programmer,Systems on Silicon Manufacturing Co Pte Ltd,Pasir Ris,2025-07-01 08:19:38,https://id.jobstreet.com/id/job/85273467
84791716,Backend Engineer - Applied Machine Learning Platform,BYTEDANCE PTE. LTD.,Central Region,2025-06-09 08:19:38,https://id.jobstreet.com/id/job/84791716
85224880,Presales Principal Solution Architect (Public Sector),Oracle Corporation,Central Region,2025-06-27 08:19:38,https://id.jobstreet.com/id/job/85224880
84602814,"Software Engr, Infra Arch & Svc Mgt",NCS Pte Ltd,Singapore,2025-06-03 08:19:38,https://id.jobstreet.com/id/job/84602814
85233494,Pioneer Talent Program - Frontend Engineer (Compliance AI),Binance,Central Region,2025-06-28 08:19:38,https://id.jobstreet.com/id/job/85233494
85183421,Junior DevOps Engineer,LUXOFT INFORMATION TECHNOLOGY (SINGAPORE) PTE. LTD.,Central Region,2025-06-26 08:19:38,https://id.jobstreet.com/id/job/85183421
85212094,Senior Business Analyst (Technical),EPAM SYSTEMS PTE LTD,Singapore,2025-06-27 08:19:38,https://id.jobstreet.com/id/job/85212094
84707787,Senior Digital Design Staff Engineer,Marvell Asia Pte Ltd,Singapore,2025-06-05 08:19:38,https://id.jobstreet.com/id/job/84707787
84983259,Software Technician,iDLink Systems Pte Ltd,Boon Keng,2025-06-17 08:19:38,https://id.jobstreet.com/id/job/84983259
84756834,Product Development Engineer,Advanced Micro Devices (S) Pte Ltd,Singapore,2025-06-06 08:19:38,https://id.jobstreet.com/id/job/84756834
85382907,Product Leader,LITE-ON SINGAPORE PTE LTD,North Region,2025-07-02 08:19:38,https://id.jobstreet.com/id/job/85382907
84855109,Robotics Engineer (Sensor & Perception),Evolution Recruitment Solutions Pte Ltd,Central Region,2025-06-12 08:19:38,https://id.jobstreet.com/id/job/84855109
85233777,Lead AI Engineer,Singtel Group Treasury Pte. Ltd.,Central Region,2025-06-28 08:19:38,https://id.jobstreet.com/id/job/85233777
85164529,Senior Computer Vision Engineer,Rapsodo Pte Ltd,Singapore,2025-06-03 08:19:38,https://id.jobstreet.com/id/job/85164529
78835405,ATS Engineer,Alstom,Central Region,2025-06-03 08:19:38,https://id.jobstreet.com/id/job/78835405
85207304,Dot Net Developer,INNOVATIQ TECHNOLOGIES PTE. LTD.,Central Region,2025-06-25 08:19:38,https://id.jobstreet.com/id/job/85207304
