Job_ID,Role,Company,Location,Publish_Time,URL
85205308,"Engagement Manager (Delivery), Senior Manager, Technology Consulting, Data &...",Ernst & Young Solutions LLP,Singapore,2025-06-27 08:19:38,https://id.jobstreet.com/id/job/85205308
85106332,Memory Layout Engineer - 12 month contract,PERSOLKELLY Singapore Pte Ltd (Formerly Kelly Services Singapore Pte Ltd),One North,2025-06-24 08:19:38,https://id.jobstreet.com/id/job/85106332
85049821,Automation Engineer,GEA WESTFALIA SEPARATOR (S.E.A.) PTE. LTD.,Boon Keng,2025-06-19 08:19:38,https://id.jobstreet.com/id/job/85049821
84087830,"Fixed Income Index Production Analyst, Singapore",Bloomberg Singapore Pte. Ltd.,Singapore,2025-06-03 08:19:38,https://id.jobstreet.com/id/job/84087830
85015213,Cloud Security Engineer,TOSS-EX PR PTE. LTD.,Singapore,2025-06-18 08:19:38,https://id.jobstreet.com/id/job/85015213
84840444,Senior System Engineer (DSC/TE/18048),ST Engineering Advanced Networks & Sensors Pte Ltd,Ang Mo Kio,2025-06-11 08:19:38,https://id.jobstreet.com/id/job/84840444
85382713,Software Engineer,UBS AG,Central Region,2025-07-02 12:19:38,https://id.jobstreet.com/id/job/85382713
85382542,Fullstack Developer - OCBC,OCBC (Singapore),Singapore,2025-07-02 12:19:38,https://id.jobstreet.com/id/job/85382542
85093023,Design Engineer (Naval Architect),PENGUIN INTERNATIONAL LIMITED,Tuas,2025-06-23 08:19:38,https://id.jobstreet.com/id/job/85093023
85220663,Facilities Engineer,Jones Lang LaSalle Property Consultants Pte Ltd,Central Region,2025-06-27 08:19:38,https://id.jobstreet.com/id/job/85220663
84070177,Senior Data Platform Architect (GCP Expert),Klook (客路旅行),Singapore,2025-06-03 08:19:38,https://id.jobstreet.com/id/job/84070177
85070203,Product Operations Executive (RedeemSG),Open Government Products,Singapore,2025-06-20 08:19:38,https://id.jobstreet.com/id/job/85070203
83976782,"Network, Solutions Architect",NTT Communications,East Region,2025-06-03 08:19:38,https://id.jobstreet.com/id/job/83976782
85202184,Senior / Engineer – Yield & Process Integration,United Test And Assembly Center Limited (UTAC),North-East Region,2025-06-27 08:19:38,https://id.jobstreet.com/id/job/85202184
85092961,Design Engineer (Mechanical),PENGUIN INTERNATIONAL LIMITED,Tuas,2025-06-23 08:19:38,https://id.jobstreet.com/id/job/85092961
84542664,"Associate/Senior Associate (12 months contract), Data & Analytics Enablement",Temasek International Pte. Ltd.,Singapore,2025-06-03 08:19:38,https://id.jobstreet.com/id/job/84542664
84863023,Research Engineer (AI & Fluid Mechanics),National University of Singapore,National University Of Singapore,2025-06-12 08:19:38,https://id.jobstreet.com/id/job/84863023
84030248,Software Engineer (Java) | Contract,GMP Group HQ,Central Region,2025-06-03 08:19:38,https://id.jobstreet.com/id/job/84030248
84687960,Research Associate (Audio LLM) for AI Singapore (Products),National University of Singapore,National University Of Singapore,2025-06-04 08:19:38,https://id.jobstreet.com/id/job/84687960
85273025,Software Engineer,Spring Professional,Central Region,2025-06-30 08:19:38,https://id.jobstreet.com/id/job/85273025
84574068,Data Scientist,StarHub Ltd,Singapore,2025-06-03 08:19:38,https://id.jobstreet.com/id/job/84574068
85426117,"Lead / Manager Software Engineer, Issuing Platform Team",Airwallex,Singapore,2025-07-03 05:19:38,https://id.jobstreet.com/id/job/85426117
85182643,Research Engineer (Technical and Environmental Analysis),National University of Singapore,National University Of Singapore,2025-06-26 08:19:38,https://id.jobstreet.com/id/job/85182643
84722009,Senior MEMS Process Integration Engineer,Vanguard International Semiconductor Singapore Pte. Ltd.,East Region,2025-06-05 08:19:38,https://id.jobstreet.com/id/job/84722009
84687956,Research Associate (Audio LLM) for AI Singapore (Products),National University of Singapore,National University Of Singapore,2025-06-04 08:19:38,https://id.jobstreet.com/id/job/84687956
84688559,"Engineer | Rail System, Operations & Maintenance",Adecco Personnel Pte Ltd.,Central Region,2025-06-04 08:19:38,https://id.jobstreet.com/id/job/84688559
85274143,DevOps Engineer,NTT Communications,East Region,2025-06-06 08:19:38,https://id.jobstreet.com/id/job/85274143
84733501,Software Engineer,RSM STONE FOREST ACCOUNTSERVE PTE. LTD.,Central Region,2025-06-06 08:19:38,https://id.jobstreet.com/id/job/84733501
84723671,System Engineer,ST Engineering Urban Solutions,Ang Mo Kio,2025-06-06 08:19:38,https://id.jobstreet.com/id/job/84723671
84785600,DevOps Engineer,36TY CONSULTANCY PTE. LTD.,Singapore,2025-06-09 08:19:38,https://id.jobstreet.com/id/job/84785600
84787343,Full-Stack Engineer (Frontend Focus),36TY CONSULTANCY PTE. LTD.,Singapore,2025-06-09 08:19:38,https://id.jobstreet.com/id/job/84787343
84416283,Machine Learning Engineer,99 Group (99.co),Singapore,2025-06-03 08:19:38,https://id.jobstreet.com/id/job/84416283
78102339,"Cloud Engineer, Senior Associate, Technology Consulting",Ernst & Young Solutions LLP,Singapore,2025-06-03 08:19:38,https://id.jobstreet.com/id/job/78102339
84767112,Sales Engineer (Generator / Data Center Segment),MMC Success Pte. Ltd.,Jurong East,2025-06-08 08:19:38,https://id.jobstreet.com/id/job/84767112
84936823,"Logistics Planning & Development Assistant Manager, Forwarding MNC (ID: 677530)",PERSOLKELLY Singapore Pte Ltd (Formerly Kelly Services Singapore Pte Ltd),Jurong East,2025-06-16 08:19:38,https://id.jobstreet.com/id/job/84936823
84522721,"Core Engineering, Entitlements Platform Engineering, Associate, Singapore",Goldman Sachs,Singapore,2025-06-03 08:19:38,https://id.jobstreet.com/id/job/84522721
84821701,"Engineer, Counter Unmanned Aerial Systems (CUAS) (DSC/CY/KL)",ST Engineering Advanced Networks & Sensors Pte Ltd,Jurong East,2025-06-11 08:19:38,https://id.jobstreet.com/id/job/84821701
85159936,"Intern - Technology Consulting, Platforms (Jul - Dec 2025)",Ernst & Young Solutions LLP,Singapore,2025-06-03 08:19:38,https://id.jobstreet.com/id/job/85159936
84765183,AI Software Engineer,ALLIED SEARCH PTE. LTD.,East Region,2025-06-08 08:19:38,https://id.jobstreet.com/id/job/84765183
85155337,"Software Engineer, Ads Measurement Signal",TikTok Pte. Ltd.,Singapore,2025-06-03 08:19:38,https://id.jobstreet.com/id/job/85155337
85428395,Product Manager (Product Development) – Geylang Bahru ~,PERSOLKELLY Singapore Pte Ltd (Formerly Kelly Services Singapore Pte Ltd),Geylang Bahru,2025-07-03 06:19:38,https://id.jobstreet.com/id/job/85428395
83828407,"Solutions Engineer, Partnerships",TikTok Pte. Ltd.,Singapore,2025-06-03 08:19:38,https://id.jobstreet.com/id/job/83828407
79737168,Singapore NLP Algorithm Engineer - TikTok Search,"Hireio, Inc.",Central Region,2025-06-03 08:19:38,https://id.jobstreet.com/id/job/79737168
84798042,"Senior Associate Consultant, Hybrid Workspace",NTT Communications,East Region,2025-06-09 08:19:38,https://id.jobstreet.com/id/job/84798042
83012931,Cloud Engineer | Yearly renewable contract | Up to $8k,PERSOLKELLY Singapore Pte Ltd (Formerly Kelly Services Singapore Pte Ltd),Central Region,2025-06-03 08:19:38,https://id.jobstreet.com/id/job/83012931
85154104,Chief Technology Officer (CTO),Sleek Hong Kong Limited,Singapore,2025-06-24 08:19:38,https://id.jobstreet.com/id/job/85154104
85379864,Product Manager,INTERNATIONAL CENTRE FOR INDUSTRIAL TRANSFORMATION LTD.,Singapore,2025-07-02 08:19:38,https://id.jobstreet.com/id/job/85379864
84676669,"Staff Backend Engineer, Issuing Platform",Airwallex,Singapore,2025-06-04 08:19:38,https://id.jobstreet.com/id/job/84676669
84728287,Research Engineer,H3 ZOOM PTE. LTD.,Singapore,2025-06-05 08:19:38,https://id.jobstreet.com/id/job/84728287
84732990,Backend Development Engineer (Digital Systems),ECHO TECHNICAL PTE. LTD.,Central Region,2025-06-06 08:19:38,https://id.jobstreet.com/id/job/84732990
84875584,"Project Engineer, Separation Technologies Applied Research and Translation",Nanyang Technological University,West Region,2025-06-13 08:19:38,https://id.jobstreet.com/id/job/84875584
84759142,Senior Equipment Automation Engineer,VISIONPOWER SEMICONDUCTOR MANUFACTURING COMPANY PTE. LTD.,Tampines,2025-06-07 08:19:38,https://id.jobstreet.com/id/job/84759142
85155289,Product Operation Manager - AI/LLM Operation,TikTok Pte. Ltd.,Singapore,2025-06-03 08:19:38,https://id.jobstreet.com/id/job/85155289
84726667,Solution Strategist – ServiceNow (Public Sector & WOG Initiatives),ServiceNow,Singapore,2025-06-05 08:19:38,https://id.jobstreet.com/id/job/84726667
84253597,Cross Technology Technical Architect,NTT Communications,East Region,2025-06-03 08:19:38,https://id.jobstreet.com/id/job/84253597
84765767,Principal Equipment Automation Engineer,VISIONPOWER SEMICONDUCTOR MANUFACTURING COMPANY PTE. LTD.,Singapore,2025-06-08 08:19:38,https://id.jobstreet.com/id/job/84765767
85157884,"Associate/Senior Associate, Data & Analytics, Technology Consulting",Ernst & Young Solutions LLP,Singapore,2025-06-03 08:19:38,https://id.jobstreet.com/id/job/85157884
85109295,Microsoft Security Engineer (1 year contract),Michael Page International Pte Ltd,Central Region,2025-06-24 08:19:38,https://id.jobstreet.com/id/job/85109295
84847017,(Staff/Sr. Staff) NPU Design Engineer,OVT group,Singapore,2025-06-11 08:19:38,https://id.jobstreet.com/id/job/84847017
84675856,"Senior Manager, Enterprise Architect - Data & AI. Asia Pacific",Allianz,Singapore,2025-06-03 08:19:38,https://id.jobstreet.com/id/job/84675856
84671583,Engineering Lead (Founding Team Member),our Client,Singapore,2025-06-03 08:19:38,https://id.jobstreet.com/id/job/84671583
84937401,Product Solutions Sales Engineer,Vector InfoTech Pte Ltd,Macpherson,2025-06-16 08:19:38,https://id.jobstreet.com/id/job/84937401
84878956,Inertial Navigation Systems Engineer,Atomionics,West Region,2025-06-12 08:19:38,https://id.jobstreet.com/id/job/84878956
84584652,"Senior Software Engineer, Machine Learning Platform",Airwallex,Singapore,2025-06-03 08:19:38,https://id.jobstreet.com/id/job/84584652
85168255,Product Manager (Product Development) – Geylang Bahru ~,PERSOLKELLY Singapore Pte Ltd (Formerly Kelly Services Singapore Pte Ltd),Geylang Bahru,2025-06-26 08:19:38,https://id.jobstreet.com/id/job/85168255
85015390,Technical Account Manager/Implementation Consultant New,Placements.io,Singapore,2025-06-18 08:19:38,https://id.jobstreet.com/id/job/85015390
84913062,Cloud and Infrastructure Engineer,EQUATIVE SOLUTIONS PTE. LTD.,Singapore,2025-06-13 08:19:38,https://id.jobstreet.com/id/job/84913062
84988722,Senior Mulesoft Engineer,Menrva,Marina South,2025-06-17 08:19:38,https://id.jobstreet.com/id/job/84988722
84819553,Hardware Design Engineer (FPGA design),SimpliVity,Central Region,2025-06-11 08:19:38,https://id.jobstreet.com/id/job/84819553
85383235,Robotics Software Engineer - AI and Robotics Company,DCONSTRUCT ROBOTICS PTE. LTD.,Central Region,2025-07-02 08:19:38,https://id.jobstreet.com/id/job/85383235
85063457,Mobile Device Management (MDM) Solution Architect (Ref 26103),Jobline Resources Pte Ltd,Central Region,2025-06-20 08:19:38,https://id.jobstreet.com/id/job/85063457
84843702,Field Technical Support Engineer | 6 months renewable | East | Up to 4k,PERSOLKELLY Singapore Pte Ltd (Formerly Kelly Services Singapore Pte Ltd),Changi Airport,2025-06-12 08:19:38,https://id.jobstreet.com/id/job/84843702
85177095,Principal Instrument Engineer/Designer (SPI Admin),Santech Engineering,Singapore,2025-06-26 08:19:38,https://id.jobstreet.com/id/job/85177095
85171934,Product Development Manager / Kallang Sector / 12 Months Extendable,PERSOLKELLY Singapore Pte Ltd (Formerly Kelly Services Singapore Pte Ltd),Geylang Bahru,2025-06-26 08:19:38,https://id.jobstreet.com/id/job/85171934
85251992,Software Engineer (NodeJS / API / XML) - Singaporean Only,APBA TG Human Resource Pte Ltd,North Region,2025-06-30 08:19:38,https://id.jobstreet.com/id/job/85251992
84512034,Enterprise Architect - Meliora,Meliora,Singapore,2025-06-03 08:19:38,https://id.jobstreet.com/id/job/84512034
84484231,"System Architect, Rates & FX",ICAP,Raffles Place,2025-06-03 08:19:38,https://id.jobstreet.com/id/job/84484231
84957491,Senior Software Functional Consultant (AI & Regional PM),ZENEX TECHNOLOGIES PTE. LTD.,Tuas,2025-06-16 08:19:38,https://id.jobstreet.com/id/job/84957491
84520906,"Storage Cloud Engineer, Associate",Blackrock Expert Services,Singapore,2025-06-03 08:19:38,https://id.jobstreet.com/id/job/84520906
85297342,Senior Technical Service Engineer,SPTel Pte Ltd,Ang Mo Kio Town Centre,2025-07-01 08:19:38,https://id.jobstreet.com/id/job/85297342
85044312,Technology Risk Manager - OCBC,OCBC (Singapore),Singapore,2025-06-20 08:19:38,https://id.jobstreet.com/id/job/85044312
84227775,"Lead Analyst - Global Security Organisation Client Services - TikTok, Singapore",TikTok Pte. Ltd.,Singapore,2025-06-03 08:19:38,https://id.jobstreet.com/id/job/84227775
84976600,"VP, Data Science & AI (Singapore)",Nomura Singapore Limited,Singapore,2025-06-17 08:19:38,https://id.jobstreet.com/id/job/84976600
85145345,Backend Engineer,ONDEMANDTALENT PTE. LTD.,Singapore,2025-06-25 08:19:38,https://id.jobstreet.com/id/job/85145345
84691802,Cybersecurity Product Service Engineer (Deployment | Network),ST ENGINEERING INFO-SECURITY PTE. LTD,Jurong East,2025-06-04 08:19:38,https://id.jobstreet.com/id/job/84691802
79662246,Senior BE Engineer – Python (1 pos),Totm Technology,Central Region,2025-06-03 08:19:38,https://id.jobstreet.com/id/job/79662246
84998097,Technical Manager,ST Engineering Urban Solutions,Ang Mo Kio,2025-06-18 08:19:38,https://id.jobstreet.com/id/job/84998097
85383565,DevOps Consultant,JALANDHAR SC PTE. LTD.,Pasir Ris,2025-07-02 13:19:38,https://id.jobstreet.com/id/job/85383565
85122016,Product Development Engineer [ System Level Test FTR (First Time Right) ],The Supreme HR Advisory Pte Ltd,Central Region,2025-06-24 08:19:38,https://id.jobstreet.com/id/job/85122016
84759467,Full Stack Developer,Kyndryl,West Region,2025-06-03 08:19:38,https://id.jobstreet.com/id/job/84759467
85382548,Head of Service Management - London Stock Exchange Group,London Stock Exchange Group,Singapore,2025-07-02 12:19:38,https://id.jobstreet.com/id/job/85382548
85061598,"SME, Mechanical",Keppel (Data Centres and Networks Division),East Region,2025-06-20 08:19:38,https://id.jobstreet.com/id/job/85061598
84867208,Research Scientist (Security),Nanyang Technological University,Singapore,2025-06-12 08:19:38,https://id.jobstreet.com/id/job/84867208
84346392,Information Technology - Lead Systems Engineer End User Computing (EUC),Singapore Airlines,Singapore,2025-06-03 08:19:38,https://id.jobstreet.com/id/job/84346392
85155120,Backend Engineer - Global E-Commerce (Commercial Platform),TikTok Pte. Ltd.,Singapore,2025-06-03 08:19:38,https://id.jobstreet.com/id/job/85155120
84359211,Chief Technology Officer (Brokerage CRM System),Doo Group,Singapore,2025-06-03 08:19:38,https://id.jobstreet.com/id/job/84359211
85196803,Post-Sales Project Delivery Executive (ASEAN Region),China Unicom (Singapore) Operations Pte Ltd,Central Region,2025-06-26 08:19:38,https://id.jobstreet.com/id/job/85196803
83941264,System Security Engineer,CAPGEMINI SINGAPORE PTE. LTD.,Singapore,2025-06-03 08:19:38,https://id.jobstreet.com/id/job/83941264
85270625,Product Manager (Product Development) – Geylang Bahru ~,PERSOLKELLY Singapore Pte Ltd (Formerly Kelly Services Singapore Pte Ltd),Geylang Bahru,2025-07-01 08:19:38,https://id.jobstreet.com/id/job/85270625
84227484,Sales Solutions Architect,NCS Hong Kong and Singapore,Ang Mo Kio,2025-06-03 08:19:38,https://id.jobstreet.com/id/job/84227484
83897037,Tencent Cloud - Senior Cloud Architect (R&D & Solution Design),Tencent International Service Pte. Ltd.,Singapore,2025-06-03 08:19:38,https://id.jobstreet.com/id/job/83897037
85168304,Product Manager (User Experience Design) – East ~,PERSOLKELLY Singapore Pte Ltd (Formerly Kelly Services Singapore Pte Ltd),Geylang Bahru,2025-06-26 08:19:38,https://id.jobstreet.com/id/job/85168304
84875871,Project Manager (Security Solutions) - JD1837,RK Recruitment Pte. Ltd.,Jurong East,2025-06-13 08:19:38,https://id.jobstreet.com/id/job/84875871
84763323,"Core Engineering, SDLC Continuous Deployment Engineer, Associate/ Vice...",Goldman Sachs,Singapore,2025-06-07 08:19:38,https://id.jobstreet.com/id/job/84763323
84288052,Senior Software Engineer,"Bain & Company SE Asia, Inc.",Singapore,2025-06-03 08:19:38,https://id.jobstreet.com/id/job/84288052
84111889,"AI Engineers, Associate - Manager / AI & Data / Technology Consulting",Ernst & Young Solutions LLP,Singapore,2025-06-03 08:19:38,https://id.jobstreet.com/id/job/84111889
82659065,Regional IT and Cloud Specialist (APAC) | Yearly renewable contract | Up to $8k,PERSOLKELLY Singapore Pte Ltd (Formerly Kelly Services Singapore Pte Ltd),Central Region,2025-06-03 08:19:38,https://id.jobstreet.com/id/job/82659065
84727091,Automation Test Engineer | Selenium | TestNG,ScienTec Consulting Pte Ltd,Central Region,2025-06-06 08:19:38,https://id.jobstreet.com/id/job/84727091
85426749,Automation C&Q (Commissioning & Qualification) Lead,APBA TG Human Resource Pte Ltd,Tuas,2025-07-03 05:19:38,https://id.jobstreet.com/id/job/85426749
84165567,Location-Based Services Algorithm Engineer (LBS) - TikTok Local Service,TikTok Pte. Ltd.,Singapore,2025-06-03 08:19:38,https://id.jobstreet.com/id/job/84165567
84807013,Research Fellow (Distributed Energy Resources Management System (DERMS)),Nanyang Technological University,Pioneer,2025-06-10 08:19:38,https://id.jobstreet.com/id/job/84807013
85155101,"Backend Software Engineer (Libra), Data Platform",TikTok Pte. Ltd.,Singapore,2025-06-03 08:19:38,https://id.jobstreet.com/id/job/85155101
84528789,Principal Machine Learning Engineer (Marketplace Simulation),PLT Engineering,Singapore,2025-06-03 08:19:38,https://id.jobstreet.com/id/job/84528789
84098753,"Security Automation & Operations Engineer, Global SOC",TikTok Pte. Ltd.,Singapore,2025-06-03 08:19:38,https://id.jobstreet.com/id/job/84098753
84770972,Automation QA Engineer (Selenium/Python),ScienTec Consulting Pte Ltd,Central Region,2025-06-09 08:19:38,https://id.jobstreet.com/id/job/84770972
85155192,"Backend Software Engineer (Mirror), Data Platform",TikTok Pte. Ltd.,Singapore,2025-06-03 08:19:38,https://id.jobstreet.com/id/job/85155192
84818092,IT Applications Manager (Software Solutions),Charles & Keith (Singapore) Pte Ltd,Singapore,2025-06-10 08:19:38,https://id.jobstreet.com/id/job/84818092
84165590,"Backend Software Engineer (Location-Based Services), TikTok Local Service",TikTok Pte. Ltd.,Singapore,2025-06-03 08:19:38,https://id.jobstreet.com/id/job/84165590
84576935,Data Center Inventory Control Specialist 4,Oracle Corporation,Singapore,2025-06-03 08:19:38,https://id.jobstreet.com/id/job/84576935
84853948,Field Engineer,ENX SYSTEMS PTE. LTD.,East Region,2025-06-12 08:19:38,https://id.jobstreet.com/id/job/84853948
84764707,Developer - sap,SAP Asia Pte Ltd,Singapore,2025-06-08 08:19:38,https://id.jobstreet.com/id/job/84764707
85152106,Software Engineer (Backend),Leoch Battery Pte Ltd,Bugis,2025-06-25 08:19:38,https://id.jobstreet.com/id/job/85152106
84517776,Principal Machine Learning Engineer (Marketplace Simulation),GRABTAXI HOLDINGS PTE. LTD.,Singapore,2025-06-03 08:19:38,https://id.jobstreet.com/id/job/84517776
84453195,Senior Cyber Security Engineer,Recorded Future Pte. Ltd.,Singapore,2025-06-03 08:19:38,https://id.jobstreet.com/id/job/84453195
84986389,SAP FTM Consultant,CAPGEMINI SINGAPORE PTE. LTD.,Singapore,2025-06-17 08:19:38,https://id.jobstreet.com/id/job/84986389
83756440,Senior Networking Technical Service System Integration Specialist / Technical...,NTT Communications,East Region,2025-06-03 08:19:38,https://id.jobstreet.com/id/job/83756440
85270630,Product Manager (User Experience Design) – East ~,PERSOLKELLY Singapore Pte Ltd (Formerly Kelly Services Singapore Pte Ltd),Geylang Bahru,2025-07-01 08:19:38,https://id.jobstreet.com/id/job/85270630
85155263,"Backend Engineer, TikTok Machine Learning Platform",TikTok Pte. Ltd.,Singapore,2025-06-03 08:19:38,https://id.jobstreet.com/id/job/85155263
84886769,"Systems Executive (Level 1/ Radio Frequency Engineering, Networking)",People Advantage Pte Ltd,North-East Region,2025-06-13 08:19:38,https://id.jobstreet.com/id/job/84886769
84725887,"Senior Software Engineer (Full-Stack, DevOps)",Assurity Trusted Solutions Pte Ltd,Singapore River,2025-06-06 08:19:38,https://id.jobstreet.com/id/job/84725887
84093068,[LPS] Senior Storage Engineer,Lenovo PCCW Solutions,Central Region,2025-06-03 08:19:38,https://id.jobstreet.com/id/job/84093068
84693668,Cloud Security Engineer,Peoplebank Singapore Pte Ltd,Central Region,2025-06-05 08:19:38,https://id.jobstreet.com/id/job/84693668
85311876,Network Technical Lead (DSC/JH),ST ENGINEERING INFO-SECURITY PTE. LTD,Jurong East,2025-07-02 08:19:38,https://id.jobstreet.com/id/job/85311876
84914828,System Architect (PDA),HITACHI RAIL GTS SINGAPORE PTE. LTD.,Kampong Ubi,2025-06-13 08:19:38,https://id.jobstreet.com/id/job/84914828
85061157,Test Engineer (contactless card) (Transportation) (Contract) (ID: 677707),PERSOLKELLY Singapore Pte Ltd (Formerly Kelly Services Singapore Pte Ltd),East Region,2025-06-20 08:19:38,https://id.jobstreet.com/id/job/85061157
85269518,Principal QA Engineer (IT).,Marina Bay Sands Pte Ltd,Marina South,2025-07-01 08:19:38,https://id.jobstreet.com/id/job/85269518
84415727,Senior ML Engineer,"Bain & Company SE Asia, Inc.",Singapore,2025-06-03 08:19:38,https://id.jobstreet.com/id/job/84415727
84950805,"[SG] Senior Executive, Business Excellence",DOCTOR ANYWHERE OPERATIONS PTE. LTD.,North-East Region,2025-06-17 08:19:38,https://id.jobstreet.com/id/job/84950805
85300703,Senior Engineer (Mechanical Design),LITE-ON SINGAPORE PTE LTD,Lorong Chuan,2025-07-01 08:19:38,https://id.jobstreet.com/id/job/85300703
84818103,Research Fellow (Machine Sensing and Perception),Nanyang Technological University,West Region,2025-06-11 08:19:38,https://id.jobstreet.com/id/job/84818103
85206869,Intern - IT Programming (Business Systems Integration),HAO BIZCON PTE. LTD.,West Region,2025-06-03 08:19:38,https://id.jobstreet.com/id/job/85206869
85207178,Senior Windows System Engineer,Keyrus Singapore Pte. Ltd.,Central Region,2025-06-26 08:19:38,https://id.jobstreet.com/id/job/85207178
84415060,"AI/HPC Consulting Field Solutions Architect Singapore, Singapore","Pure Storage, Inc.",Singapore,2025-06-03 08:19:38,https://id.jobstreet.com/id/job/84415060
85359755,Software Engineer (Digital BSS),SPTel Pte Ltd,Ang Mo Kio Town Centre,2025-07-02 08:19:38,https://id.jobstreet.com/id/job/85359755
85411540,Node.js Developer,PERSOLKELLY Singapore Pte Ltd (Formerly Kelly Services Singapore Pte Ltd),Central Region,2025-07-03 03:19:38,https://id.jobstreet.com/id/job/85411540
85122500,Product Manager (Product Development) – Geylang Bahru ~,PERSOLKELLY Singapore Pte Ltd (Formerly Kelly Services Singapore Pte Ltd),Geylang Bahru,2025-06-24 08:19:38,https://id.jobstreet.com/id/job/85122500
85243177,Associate Product Manager - Onboarding & KYC (APAC),Wise Holdings,Singapore,2025-06-29 08:19:38,https://id.jobstreet.com/id/job/85243177
84756111,DevOps Engineer,POLYTRON.AI PTE. LTD.,Singapore,2025-06-06 08:19:38,https://id.jobstreet.com/id/job/84756111
85122557,Product Manager (User Experience Design) – East ~,PERSOLKELLY Singapore Pte Ltd (Formerly Kelly Services Singapore Pte Ltd),Geylang Bahru,2025-06-24 08:19:38,https://id.jobstreet.com/id/job/85122557
85165046,Head of IT Infrastructure,RCL Feeder Pte Ltd / RCL Shipmanagement Pte Ltd,Downtown Tanjong Pagar,2025-06-25 08:19:38,https://id.jobstreet.com/id/job/85165046
85200132,Digital Research Intern,Boeing,Singapore,2025-06-03 08:19:38,https://id.jobstreet.com/id/job/85200132
85016354,"Technology Risk Manager, Risk & Prevention, Group Operations & Technology (AVP)",OCBC Bank Berhad OCBC Al Amin Bank Berhad,Singapore,2025-06-05 08:19:38,https://id.jobstreet.com/id/job/85016354
85421896,Applications Scientist (R4537),ONTO INNOVATION SOUTHEAST ASIA PTE. LIMITED,Serangoon North,2025-07-03 03:19:38,https://id.jobstreet.com/id/job/85421896
84130338,"Recall Algorithm Expert Engineer - Search, Recommendations and Ads",SHOPEE SINGAPORE PRIVATE LIMITED,Singapore,2025-06-03 08:19:38,https://id.jobstreet.com/id/job/84130338
84963279,"Staff Product Manager, Payments for Platforms",Airwallex,Singapore,2025-06-17 08:19:38,https://id.jobstreet.com/id/job/84963279
83442059,Fullstack Engineer- Algorithm Engineering Platform,TikTok Pte. Ltd.,Singapore,2025-06-03 08:19:38,https://id.jobstreet.com/id/job/83442059
85174511,Manager (Digital Product Development) @ Kallang Sector / Up $6200,PERSOLKELLY Singapore Pte Ltd (Formerly Kelly Services Singapore Pte Ltd),Geylang Bahru,2025-06-26 08:19:38,https://id.jobstreet.com/id/job/85174511
84581642,Lead Consultant – Wifi Tier 3 (Network) | Yearly renewable contract | Up to 7k,PERSOLKELLY Singapore Pte Ltd (Formerly Kelly Services Singapore Pte Ltd),Paya Lebar,2025-06-16 08:19:38,https://id.jobstreet.com/id/job/84581642
82916068,Cloud Architect,PricewaterhouseCoopers,Singapore,2025-06-03 08:19:38,https://id.jobstreet.com/id/job/82916068
83868869,Software Development Engineer,8x8 Inc,Singapore,2025-06-03 08:19:38,https://id.jobstreet.com/id/job/83868869
84854061,Associate Network Consultant,EPERGNE SOLUTIONS PTE. LTD.,Singapore,2025-06-12 08:19:38,https://id.jobstreet.com/id/job/84854061
85162026,Senior Engineer (Campus Redevelopment),EnviroDynamics Solutions Pte Ltd,West Region,2025-06-25 08:19:38,https://id.jobstreet.com/id/job/85162026
84692480,"QA Engineer (Automation Testing - Selenium, Python)",ScienTec Consulting Pte Ltd,Central Region,2025-06-04 08:19:38,https://id.jobstreet.com/id/job/84692480
83333527,AI Engineer - 1 year Contract (East / Perm) (ID: 669689),PERSOLKELLY Singapore Pte Ltd (Formerly Kelly Services Singapore Pte Ltd),East Region,2025-06-03 08:19:38,https://id.jobstreet.com/id/job/83333527
