Job_ID,Role,Company,Location,Publish_Time,URL
84541038,Staff Services Engineer - Market Management Systems Integration,GE VERNOVA INTERNATIONAL LLC Singapore Branch,One North,2025-05-28 12:17:00,https://id.jobstreet.com/id/job/84541038
84416522,Senior Solutions Engineer - ASEAN,Okta,Singapore,2025-05-23 12:17:00,https://id.jobstreet.com/id/job/84416522
84601294,MuleSoft Technical Lead,CAPGEMINI SINGAPORE PTE. LTD.,Singapore,2025-05-30 12:17:00,https://id.jobstreet.com/id/job/84601294
84489003,Cloud Data Architect,CAPGEMINI SINGAPORE PTE. LTD.,Singapore,2025-05-26 12:17:00,https://id.jobstreet.com/id/job/84489003
84415016,Senior/Software Engineer (Full-stack Developer),HEPMIL SINGAPORE PTE. LTD.,Central Region,2025-05-22 12:17:00,https://id.jobstreet.com/id/job/84415016
78043721,"ServiceNow Developer, Digital and Emerging Tech, Technology Consulting",Ernst & Young Solutions LLP,Central Region,2025-05-09 12:17:00,https://id.jobstreet.com/id/job/78043721
84540819,Senior Software Developer (C++ | C#),ST ENGINEERING INFO-SECURITY PTE. LTD,Jurong East,2025-05-28 12:17:00,https://id.jobstreet.com/id/job/84540819
84515606,Software Developer,ACHIEVE HR CONSULTING PTE. LTD.,Eunos,2025-05-27 12:17:00,https://id.jobstreet.com/id/job/84515606
84516131,SOFTWARE DEVELOPER,TALENTWORKZ PTE. LTD.,Crawford,2025-05-27 12:17:00,https://id.jobstreet.com/id/job/84516131
84467789,Mobile App Developer (Tech MNC/ iOS or Android/ UP8.3K),Adecco Personnel Pte Ltd.,Central Region,2025-05-26 12:17:00,https://id.jobstreet.com/id/job/84467789
83998108,Software Developer,Veridien,Singapore,2025-05-09 12:17:00,https://id.jobstreet.com/id/job/83998108
84497809,Senior App Developer (React Native),ScienTec Consulting Pte Ltd,Central Region,2025-05-27 12:17:00,https://id.jobstreet.com/id/job/84497809
84577845,Mulesoft Integration Architect,PURVIEW ASIA PACIFIC PTE. LTD.,Singapore,2025-05-30 12:17:00,https://id.jobstreet.com/id/job/84577845
84381944,Senior Software Robotics Developer,PERSOLKELLY Singapore Pte Ltd (Formerly Kelly Services Singapore Pte Ltd),Central Region,2025-05-21 12:17:00,https://id.jobstreet.com/id/job/84381944
84447355,Junior Software Developer,VIN'S AUTO PTE. LTD.,Bishan,2025-05-23 12:17:00,https://id.jobstreet.com/id/job/84447355
84203837,Front end developer ( React js),Adecco Personnel Pte Ltd.,Central Region,2025-05-14 12:17:00,https://id.jobstreet.com/id/job/84203837
83941310,MuleSoft Developer,CAPGEMINI SINGAPORE PTE. LTD.,Singapore,2025-05-09 12:17:00,https://id.jobstreet.com/id/job/83941310
83914284,CMI Software Developer,Crédit Agricole CIB,Singapore,2025-05-09 12:17:00,https://id.jobstreet.com/id/job/83914284
84673206,Junior .NET Developer,CAPGEMINI SINGAPORE PTE. LTD.,Marina South,2025-06-03 12:17:00,https://id.jobstreet.com/id/job/84673206
84125472,Application Developer | React.JS,ScienTec Consulting Pte Ltd,Central Region,2025-05-09 12:17:00,https://id.jobstreet.com/id/job/84125472
84516226,SOFTWARE DEVELOPER,TALENTWORKZ PTE. LTD.,Crawford,2025-05-27 12:17:00,https://id.jobstreet.com/id/job/84516226
84446978,Junior Software Developer,VIN'S CREDIT PTE. LTD.,Singapore,2025-05-23 12:17:00,https://id.jobstreet.com/id/job/84446978
84219496,Software Engineer (Mobile App Dev),VisionPower Semiconductor Manufacturing Company Pte Ltd (VSMC),Tampines,2025-05-14 12:17:00,https://id.jobstreet.com/id/job/84219496
83636852,AI Research Associate,Sonar,Singapore,2025-05-09 12:17:00,https://id.jobstreet.com/id/job/83636852
84003698,Application Developer,Aon Life,Singapore,2025-05-09 12:17:00,https://id.jobstreet.com/id/job/84003698
82724341,Lead Engineer (Iseries) AS400 #MBSCareer,Marina Bay Sands Pte Ltd,Jurong East,2025-05-09 12:17:00,https://id.jobstreet.com/id/job/82724341
84329842,Software Developer (Java Applications),CAPGEMINI SINGAPORE PTE. LTD.,Marina South,2025-05-19 12:17:00,https://id.jobstreet.com/id/job/84329842
84316658,Senior Application Engineer (ServiceNow),Systems on Silicon Manufacturing Co Pte Ltd,Pasir Ris Wafer Fab Park,2025-05-19 12:17:00,https://id.jobstreet.com/id/job/84316658
84109127,Java Developer | Spring Boot,ScienTec Consulting Pte Ltd,Central Region,2025-05-09 12:17:00,https://id.jobstreet.com/id/job/84109127
83941164,MuleSoft Senior Developer,CAPGEMINI SINGAPORE PTE. LTD.,Singapore,2025-05-09 12:17:00,https://id.jobstreet.com/id/job/83941164
84328306,Senior Data Architect,HURON CONSULTING ASIA-PACIFIC PTE. LTD.,Central Region,2025-05-19 12:17:00,https://id.jobstreet.com/id/job/84328306
84724819,Marketing Executive (AIAP) for AI Singapore,National University of Singapore,National University Of Singapore,2025-06-05 12:17:00,https://id.jobstreet.com/id/job/84724819
84649606,ServiceNow Lead Architect,JonDavidson Pte Ltd,Central Region,2025-06-03 12:17:00,https://id.jobstreet.com/id/job/84649606
84225012,System Engineer,Tech Mahindra,Singapore,2025-05-14 12:17:00,https://id.jobstreet.com/id/job/84225012
84387299,Software Developer,Avatar Techno Services,Central Region,2025-05-21 12:17:00,https://id.jobstreet.com/id/job/84387299
84109126,Software Developer | ReactJS,ScienTec Consulting Pte Ltd,Central Region,2025-05-09 12:17:00,https://id.jobstreet.com/id/job/84109126
84583678,Senior Software Developer (Web-React),Trinity Consulting Services,Singapore,2025-05-29 12:17:00,https://id.jobstreet.com/id/job/84583678
84544282,Application Developer (Asp.net),NITYO 3P SOLUTIONS PTE. LTD.,Kampong Ubi,2025-05-28 12:17:00,https://id.jobstreet.com/id/job/84544282
84515427,Software Developer,AVN DIGITAL PTE. LTD.,Ang Mo Kio,2025-05-27 12:17:00,https://id.jobstreet.com/id/job/84515427
82954854,"IFRS17 Solutions (Financial Services - Insurance) Senior Consultant, Business",Ernst & Young Solutions LLP,Singapore,2025-05-09 12:17:00,https://id.jobstreet.com/id/job/82954854
84252268,Software Engineer (Mobile App Dev),VISIONPOWER SEMICONDUCTOR MANUFACTURING COMPANY PTE. LTD.,Tampines,2025-05-15 12:17:00,https://id.jobstreet.com/id/job/84252268
84447085,Software developer,ENFACTUM PTE. LTD.,Singapore,2025-05-23 12:17:00,https://id.jobstreet.com/id/job/84447085
83869983,Backend Software Developer Intern,Univers Pte. Ltd.,Maritime Square,2025-05-09 12:17:00,https://id.jobstreet.com/id/job/83869983
84290759,(f2pool) Software Engineer - Back-end / Full-stack,stakefish,Singapore,2025-05-09 12:17:00,https://id.jobstreet.com/id/job/84290759
84684675,iOS Application Developer,DA SOFTWARE PTE. LTD.,Central Region,2025-06-04 12:17:00,https://id.jobstreet.com/id/job/84684675
84458953,"Senior Software Developer – C#, SG",NAMIC Singapore,Singapore,2025-05-25 12:17:00,https://id.jobstreet.com/id/job/84458953
83869631,App Developer,Total Shape,Singapore,2025-05-09 12:17:00,https://id.jobstreet.com/id/job/83869631
84411240,IT Project Manager,TSP The Software Practice,Singapore,2025-05-22 12:17:00,https://id.jobstreet.com/id/job/84411240
84731437,Informatica Developer - ETL & IDMC,Unison Consulting Pte. Ltd.,Singapore,2025-06-05 12:17:00,https://id.jobstreet.com/id/job/84731437
84766713,Intermediate Data Developer - Azure Databricks+cosmos DB + SQL + ETL+SSIS,UPS Asia Group Pte. Ltd.,Singapore,2025-05-09 12:17:00,https://id.jobstreet.com/id/job/84766713
84128838,Associate Data Engineer - ETL (Data Mgt Div),Synapxe,Singapore,2025-05-09 12:17:00,https://id.jobstreet.com/id/job/84128838
84767639,Senior Data Developer - Azure Databricks + SQL + ETL+SSIS Permanent,UPS Asia Group Pte. Ltd.,Singapore,2025-05-09 12:17:00,https://id.jobstreet.com/id/job/84767639
81967684,Assistant Lead Engineer - ETL (Software Development),Synapxe,Singapore,2025-05-09 12:17:00,https://id.jobstreet.com/id/job/81967684
84448955,Informatica IMDC Developer,Unison Consulting Pte. Ltd.,Singapore,2025-05-23 12:17:00,https://id.jobstreet.com/id/job/84448955
84318999,BI Engineer,USER EXPERIENCE RESEARCHERS PTE. LTD,Ang Mo Kio,2025-05-19 12:17:00,https://id.jobstreet.com/id/job/84318999
84328326,BI Engineer,USER EXPERIENCE RESEARCHERS PTE. LTD,North Region,2025-05-19 12:17:00,https://id.jobstreet.com/id/job/84328326
84760538,Data Engineer (Familiar with Tableau and Scripting),Assurity Trusted Solutions Pte Ltd,Singapore,2025-06-06 12:17:00,https://id.jobstreet.com/id/job/84760538
84637189,Tagetik Developer,LUXOFT INFORMATION TECHNOLOGY (SINGAPORE) PTE. LTD.,Singapore,2025-06-02 12:17:00,https://id.jobstreet.com/id/job/84637189
84762374,Data Engineer,Telstra Singapore Pte Ltd,Central Region,2025-06-07 12:17:00,https://id.jobstreet.com/id/job/84762374
84544488,Informatica Engineer,Unison Consulting Pte. Ltd.,Changi,2025-05-28 12:17:00,https://id.jobstreet.com/id/job/84544488
84732155,Databricks Developer,Unison Consulting Pte. Ltd.,Singapore,2025-06-05 12:17:00,https://id.jobstreet.com/id/job/84732155
84323416,Data Engineer - eClerx Private Ltd,ECLERX PRIVATE LIMITED,Singapore,2025-05-19 12:17:00,https://id.jobstreet.com/id/job/84323416
84225638,Informatica/IDMC Engineer,Evolution Recruitment Solutions Pte Ltd,Singapore,2025-05-14 12:17:00,https://id.jobstreet.com/id/job/84225638
84356308,Data Engineer,AZENDIAN SOLUTIONS PTE. LTD.,Braddell,2025-05-20 12:17:00,https://id.jobstreet.com/id/job/84356308
84759092,Data Engineer,Savant Infotech Solutions Pte Ltd,Singapore,2025-06-06 12:17:00,https://id.jobstreet.com/id/job/84759092
84520695,Data Engineer,Goldtech Resources Pte Ltd,Singapore,2025-05-27 12:17:00,https://id.jobstreet.com/id/job/84520695
84673116,Tagetik Developer,LUXOFT INFORMATION TECHNOLOGY (SINGAPORE) PTE. LTD.,Singapore,2025-06-03 12:17:00,https://id.jobstreet.com/id/job/84673116
84380194,Data Analyst,MSI Global Pte Ltd,East Region,2025-05-21 12:17:00,https://id.jobstreet.com/id/job/84380194
84008894,Qlik / Business Intelligence Developer,NCS Pte Ltd,Singapore,2025-05-09 12:17:00,https://id.jobstreet.com/id/job/84008894
84544247,Data Engineer,Unison Consulting Pte. Ltd.,Changi,2025-05-28 12:17:00,https://id.jobstreet.com/id/job/84544247
84288081,Senior Business Intelligence Analyst,Duotech Pte. Ltd.,East Region,2025-05-16 12:17:00,https://id.jobstreet.com/id/job/84288081
83615679,Data Engineer,Eastspring Investments (Singapore) Limited,Singapore,2025-05-09 12:17:00,https://id.jobstreet.com/id/job/83615679
83482854,Data Engineer,SMRT Corporation Ltd,Singapore,2025-05-09 12:17:00,https://id.jobstreet.com/id/job/83482854
84568885,Data Engineer,Network Guard,North Region,2025-05-29 12:17:00,https://id.jobstreet.com/id/job/84568885
84539613,Power BI Consultant,Goldtech Resources Pte Ltd,Singapore,2025-05-28 12:17:00,https://id.jobstreet.com/id/job/84539613
83448441,ART 1284 Data Engineer,FPT Asia Pacific Pte Ltd,Singapore,2025-05-09 12:17:00,https://id.jobstreet.com/id/job/83448441
84765394,Developer - TEKsystems (Allegis Group Singapore Pte Ltd),Allegis Group Singapore Pte Ltd,Singapore,2025-06-07 12:17:00,https://id.jobstreet.com/id/job/84765394
84202109,Data Engineer,Innowave Tech Pte Ltd,East Region,2025-05-14 12:17:00,https://id.jobstreet.com/id/job/84202109
84536151,Web Application Support Developer,M1 Limited,Henderson Hill,2025-05-28 12:17:00,https://id.jobstreet.com/id/job/84536151
82357566,"Vice President, Azure Data Technical Lead (JRI-4391)",Sumitomo Mitsui Banking Corporation,Singapore,2025-05-09 12:17:00,https://id.jobstreet.com/id/job/82357566
84767204,Associate Application Developer - DOT Net Full Stack - Chennai Permanent,UPS Asia Group Pte. Ltd.,Singapore,2025-05-09 12:17:00,https://id.jobstreet.com/id/job/84767204
84733295,Junior .Net Developer,LUXOFT INFORMATION TECHNOLOGY (SINGAPORE) PTE. LTD.,Singapore,2025-06-05 12:17:00,https://id.jobstreet.com/id/job/84733295
84733815,Software Developer,ECICS LIMITED,Eunos,2025-06-05 12:17:00,https://id.jobstreet.com/id/job/84733815
84755366,Reports Deputy Team Lead (SAP BI & Data),Evolution Recruitment Solutions Pte Ltd,Singapore,2025-06-06 12:17:00,https://id.jobstreet.com/id/job/84755366
83729756,Senior Data Engineer,WSH Experts Pte Ltd,Singapore,2025-05-09 12:17:00,https://id.jobstreet.com/id/job/83729756
84766737,Data Engineer - GCP Permanent,UPS Asia Group Pte. Ltd.,Singapore,2025-05-09 12:17:00,https://id.jobstreet.com/id/job/84766737
84380454,Backend Software Developer,MSI Global Pte Ltd,East Region,2025-05-21 12:17:00,https://id.jobstreet.com/id/job/84380454
84766800,Intermediate Application Developer - Mainframe Permanent,UPS Asia Group Pte. Ltd.,Singapore,2025-06-06 12:17:00,https://id.jobstreet.com/id/job/84766800
84667228,Backend Software Developer,MSI Global Pte Ltd,East Region,2025-06-03 12:17:00,https://id.jobstreet.com/id/job/84667228
84767894,Intermediate Application Developer - Middleware ITX/WTX Permanent,UPS Asia Group Pte. Ltd.,Singapore,2025-05-09 12:17:00,https://id.jobstreet.com/id/job/84767894
84189768,Developer (Cloud Based Risk Management Software),CoreTRM Pte. Ltd.,Central Region,2025-05-13 12:17:00,https://id.jobstreet.com/id/job/84189768
84382221,Full Stack Software Developer,MSI Global Pte Ltd,East Region,2025-05-21 12:17:00,https://id.jobstreet.com/id/job/84382221
84767601,Intermediate Application Developer Power BI SQL Permanent,UPS Asia Group Pte. Ltd.,Singapore,2025-05-12 12:17:00,https://id.jobstreet.com/id/job/84767601
84758801,AI Application Developer,OOm Pte Ltd,Central Region,2025-06-06 12:17:00,https://id.jobstreet.com/id/job/84758801
84714510,Automation Software Developer,Innowave Tech Pte Ltd,East Region,2025-06-05 12:17:00,https://id.jobstreet.com/id/job/84714510
84516091,Software Developer,Saksoft Pte Ltd,Little India,2025-05-27 12:17:00,https://id.jobstreet.com/id/job/84516091
84704376,.Net Developer,ANTAES ASIA PTE. LTD.,Marina South,2025-06-04 12:17:00,https://id.jobstreet.com/id/job/84704376
84764621,Software Developer,SysNet System and Solutions Pte Ltd,Singapore,2025-06-07 12:17:00,https://id.jobstreet.com/id/job/84764621
84516004,Oracle OBIEE Developer,Unison Consulting Pte. Ltd.,Singapore,2025-05-27 12:17:00,https://id.jobstreet.com/id/job/84516004
84756822,"Analyst, Application Development",Singlife Life Ltd,Singapore,2025-06-06 12:17:00,https://id.jobstreet.com/id/job/84756822
80522755,Tagetik Application Developer,Unison Consulting Pte. Ltd.,Singapore,2025-05-09 12:17:00,https://id.jobstreet.com/id/job/80522755
84489166,Software Developer,Singapore Telecommunications Limited,Eunos,2025-05-26 12:17:00,https://id.jobstreet.com/id/job/84489166
84344931,Senior Backend Software Developer,PLUVIA PTE. LTD.,National University Of Singapore,2025-05-20 12:17:00,https://id.jobstreet.com/id/job/84344931
84324445,FullStack Developer (with Backbase Certification) - Remote from anywhere & WFH,Mindteck Singapore Pte Ltd,Downtown Tanjong Pagar,2025-05-19 12:17:00,https://id.jobstreet.com/id/job/84324445
84766484,"PowerBI developer - PowerBI, DAX, SQL, Python, R, SSAS, C#, .NET, GCP/Azure",UPS Asia Group Pte. Ltd.,Singapore,2025-05-09 12:17:00,https://id.jobstreet.com/id/job/84766484
78511436,"Data Engineer, Digital Government Blueprint (DGB 2.0)",Public Service Division,Singapore,2025-05-09 12:17:00,https://id.jobstreet.com/id/job/78511436
84569452,Java / NodeJS - Full Stack Web Application Developer (Banking Technology),D L Resources Pte Ltd,Singapore,2025-05-29 12:17:00,https://id.jobstreet.com/id/job/84569452
84762475,Full Stack Developer,Telstra Singapore Pte Ltd,Central Region,2025-06-07 12:17:00,https://id.jobstreet.com/id/job/84762475
84357249,Software Developer,TechCom Solutions Pte Ltd,Singapore,2025-05-20 12:17:00,https://id.jobstreet.com/id/job/84357249
84668777,Software Developer (MTI),AvePoint,Singapore,2025-06-03 12:17:00,https://id.jobstreet.com/id/job/84668777
84379956,Backend Software Developer (Senior),MSI Global Pte Ltd,East Region,2025-05-21 12:17:00,https://id.jobstreet.com/id/job/84379956
84252525,SOFTWARE ANALYST,Chuan Lim Construction Pte Ltd,North Region,2025-05-15 12:17:00,https://id.jobstreet.com/id/job/84252525
84514400,Staff Software Engineer,VISA WORLDWIDE PTE. LIMITED,Singapore,2025-05-27 12:17:00,https://id.jobstreet.com/id/job/84514400
84766487,Lead Application Developer- PostgreSQL Permanent,UPS Asia Group Pte. Ltd.,Singapore,2025-05-09 12:17:00,https://id.jobstreet.com/id/job/84766487
84329868,Software Developer,TechCom Solutions Pte Ltd,Singapore,2025-05-19 12:17:00,https://id.jobstreet.com/id/job/84329868
84568838,Data Strategy & Transformation (VP/Director),Evolution Recruitment Solutions Pte Ltd,Central Region,2025-05-29 12:17:00,https://id.jobstreet.com/id/job/84568838
84767283,"Intermediate Applications Developer - IBM Design Studio, Middleware Protocols",UPS Asia Group Pte. Ltd.,Singapore,2025-05-22 12:17:00,https://id.jobstreet.com/id/job/84767283
84070250,Senior Platform Engineer – Data & AI,Equinix Asia Pacific,Singapore,2025-05-09 12:17:00,https://id.jobstreet.com/id/job/84070250
84387199,Software Developer- OpenText AppWorks,Nucleus Software Solutions Pte Ltd,Singapore,2025-05-21 12:17:00,https://id.jobstreet.com/id/job/84387199
84767741,"Intermediate Application Developer -Azure, ADF, PySpark Permanent",UPS Asia Group Pte. Ltd.,Singapore,2025-06-02 12:17:00,https://id.jobstreet.com/id/job/84767741
84756069,Software Application developer,Digiworld Technologies Pte. Ltd.,Singapore,2025-06-06 12:17:00,https://id.jobstreet.com/id/job/84756069
84759163,Software Developer,TOPPAN Ecquaria Pte Ltd,Singapore,2025-06-06 12:17:00,https://id.jobstreet.com/id/job/84759163
84138952,Software Engineer (Embedded Systems),Thales,Singapore,2025-05-09 12:17:00,https://id.jobstreet.com/id/job/84138952
84606913,"AVP, Software Developer (Investment Services), Technology Group (1 Year",GIC Private Limited,Singapore,2025-05-31 12:17:00,https://id.jobstreet.com/id/job/84606913
84767939,Senior Application Developer - Mainframe Permanent,UPS Asia Group Pte. Ltd.,Singapore,2025-06-02 12:17:00,https://id.jobstreet.com/id/job/84767939
84413021,Software Developer,Saksoft Pte Ltd,Little India,2025-05-22 12:17:00,https://id.jobstreet.com/id/job/84413021
84295008,Senior Staff/Staff Engineer System Developer (Contract),Infineon Technologies,Singapore,2025-05-17 12:17:00,https://id.jobstreet.com/id/job/84295008
84702177,Software Developer,CGG Services (Singapore) Pte Ltd,North Region,2025-06-04 12:17:00,https://id.jobstreet.com/id/job/84702177
84767501,Applications Developer - .NET Fixed Term,UPS Asia Group Pte. Ltd.,Singapore,2025-06-06 12:17:00,https://id.jobstreet.com/id/job/84767501
84766777,Associate Application Developer - MS Power Apps Permanent,UPS Asia Group Pte. Ltd.,Singapore,2025-05-29 12:17:00,https://id.jobstreet.com/id/job/84766777
84515383,Software Developer,Saksoft Pte Ltd,Little India,2025-05-27 12:17:00,https://id.jobstreet.com/id/job/84515383
84758962,Python Developer (UnitTest_DevOps_AWS_K8s_Snowflake_Spark_Hive_Airflow_DataDog),Maltem Asia Pte. Ltd.,Raffles Place,2025-06-07 12:17:00,https://id.jobstreet.com/id/job/84758962
84755204,Software Developer,Saksoft Pte Ltd,Little India,2025-06-06 12:17:00,https://id.jobstreet.com/id/job/84755204
84310937,Senior GIS Software Developer,PLUVIA PTE. LTD.,National University Of Singapore,2025-05-19 12:17:00,https://id.jobstreet.com/id/job/84310937
84767810,Senior Application Developer - .NET Permanent,UPS Asia Group Pte. Ltd.,Singapore,2025-06-04 12:17:00,https://id.jobstreet.com/id/job/84767810
84387213,Software Developer,ASTEK Singapore Innovation Technology Pte. Ltd.,Central Region,2025-05-21 12:17:00,https://id.jobstreet.com/id/job/84387213
84424354,Software Developer,,Kallang,2025-05-23 12:17:00,https://id.jobstreet.com/id/job/84424354
84766339,"Associate Application Developer - Java, Openshift, GCP, AI & ML Permanent",UPS Asia Group Pte. Ltd.,Singapore,2025-06-02 12:17:00,https://id.jobstreet.com/id/job/84766339
84707697,Assoc Software Engineer (Tech Management),Synapxe,One North,2025-06-04 12:17:00,https://id.jobstreet.com/id/job/84707697
84767897,Lead Software Development Engineer Permanent,UPS Asia Group Pte. Ltd.,Singapore,2025-06-04 12:17:00,https://id.jobstreet.com/id/job/84767897
84387740,Software Developer,IBASE TECHNOLOGY PRIVATE LIMITED,Paya Lebar Air Base,2025-05-21 12:17:00,https://id.jobstreet.com/id/job/84387740
84286048,Software Developer,Saksoft Pte Ltd,Little India,2025-05-16 12:17:00,https://id.jobstreet.com/id/job/84286048
84355183,Front-End Developer (AI Lab) (2-Year Contract),Prudential (WM Group- Linda Quah),Singapore,2025-05-20 12:17:00,https://id.jobstreet.com/id/job/84355183
84382524,Software and Applications Developer,Saksoft Pte Ltd,Little India,2025-05-21 12:17:00,https://id.jobstreet.com/id/job/84382524
84515998,IT Application Developer,KGI Securities (Singapore) Pte. Ltd.,Central Region,2025-05-27 12:17:00,https://id.jobstreet.com/id/job/84515998
84668190,Lead Software Engineer,Triple A Technologies Pte Ltd,Singapore,2025-06-03 12:17:00,https://id.jobstreet.com/id/job/84668190
84767538,Lead Application Developer - MS Power Apps Permanent,UPS Asia Group Pte. Ltd.,Singapore,2025-05-29 12:17:00,https://id.jobstreet.com/id/job/84767538
84384991,Senior Business Analyst II,MICRON SEMICONDUCTOR ASIA OPERATIONS PTE LTD,Singapore,2025-05-20 12:17:00,https://id.jobstreet.com/id/job/84384991
84447377,FULL STACK SOFTWARE DEVELOPER,G-TECH METAL PTE. LTD.,North Region,2025-05-23 12:17:00,https://id.jobstreet.com/id/job/84447377
84767160,"Associate Application Developer .Net, Angular Permanent",UPS Asia Group Pte. Ltd.,Singapore,2025-05-27 12:17:00,https://id.jobstreet.com/id/job/84767160
84504373,IT FULL STACK DEVELOPER,SOLO PTE. LTD.,Boon Lay,2025-05-27 12:17:00,https://id.jobstreet.com/id/job/84504373
84443167,Web Application Developer,Simple Solution Systems Pte Ltd,Singapore,2025-05-23 12:17:00,https://id.jobstreet.com/id/job/84443167
84329147,Junior Software Developer,ATT Digiverse,Singapore,2025-05-19 12:17:00,https://id.jobstreet.com/id/job/84329147
84640769,Lead Application Developer (AEM/ Java),Temus Pte. Ltd.,Singapore,2025-06-02 12:17:00,https://id.jobstreet.com/id/job/84640769
84578072,Full Stack Developer (Hybrid Work),CFB BOTS PTE. LTD.,Singapore,2025-05-30 12:17:00,https://id.jobstreet.com/id/job/84578072
84766603,Senior Applications Developer - Salesforce Permanent,UPS Asia Group Pte. Ltd.,Singapore,2025-05-22 12:17:00,https://id.jobstreet.com/id/job/84766603
84503386,Software Developer (MS .Net),Innovate Consulting LLP,Singapore,2025-05-27 12:17:00,https://id.jobstreet.com/id/job/84503386
84517040,Senior ServiceNow Developer,DXC TECHNOLOGY SERVICES SINGAPORE PTE. LTD.,Singapore,2025-05-27 12:17:00,https://id.jobstreet.com/id/job/84517040
84697728,Senior Software Developer,Allegis Group Singapore Pte Ltd,Singapore,2025-06-03 12:17:00,https://id.jobstreet.com/id/job/84697728
84704370,System Analyst,Abeam Consulting (Singapore) Pte Ltd,Singapore,2025-06-04 12:17:00,https://id.jobstreet.com/id/job/84704370
84568509,Developer/Software Developer – Spring Boot and React (109),Success IT Consultancy & Services Pte Ltd,Singapore,2025-05-29 12:17:00,https://id.jobstreet.com/id/job/84568509
84669627,Salesforce Developer,AvePoint,Singapore,2025-06-03 12:17:00,https://id.jobstreet.com/id/job/84669627
84447554,C++ Database Developer,Ahrefs Pte Ltd,Singapore,2025-05-24 12:17:00,https://id.jobstreet.com/id/job/84447554
84701592,Expert Java Software Developer (Must have Banking industry experience),LUXOFT INFORMATION TECHNOLOGY (SINGAPORE) PTE. LTD.,Singapore,2025-06-04 12:17:00,https://id.jobstreet.com/id/job/84701592
84381775,Full-Stack Software Developer,Aegis Technologies Pte. Ltd.,Singapore,2025-05-21 12:17:00,https://id.jobstreet.com/id/job/84381775
84641379,Senior Software Engineer,Triple A Technologies Pte Ltd,Anson,2025-06-02 12:17:00,https://id.jobstreet.com/id/job/84641379
84603417,C++ Software Developer,MSI Global Pte Ltd,East Region,2025-05-30 12:17:00,https://id.jobstreet.com/id/job/84603417
84766627,Applications Developer - Salesforce Permanent,UPS Asia Group Pte. Ltd.,Singapore,2025-05-09 12:17:00,https://id.jobstreet.com/id/job/84766627
84515524,Software Developer (1-year contract),AXS Pte Ltd,Boon Keng,2025-05-27 12:17:00,https://id.jobstreet.com/id/job/84515524
84293982,"Software Developer (career change, no experience required)",Singapore Institute of Career Development Pte. Ltd.,Central Region,2025-05-17 12:17:00,https://id.jobstreet.com/id/job/84293982
84222983,"Sr. Engineering Manager (Golang, React)",VISA WORLDWIDE PTE. LIMITED,Singapore,2025-05-14 12:17:00,https://id.jobstreet.com/id/job/84222983
84323773,Full Stack Developer,DIGITAL BIZ SOLUTIONS PTE. LTD.,Changi,2025-05-19 12:17:00,https://id.jobstreet.com/id/job/84323773
84668692,Fullstack Software Developer (Java / Scala),Combuilder Pte Ltd,Singapore,2025-06-03 12:17:00,https://id.jobstreet.com/id/job/84668692
84697153,Senior Frontend Developer,Allegis Group Singapore Pte Ltd,Singapore,2025-06-03 12:17:00,https://id.jobstreet.com/id/job/84697153
84459446,Application Developer,Thomson Medical Pte Ltd,Singapore,2025-05-09 12:17:00,https://id.jobstreet.com/id/job/84459446
84276970,C++ Application Developer,UST Global (M) Sdn Bhd,Yishun Central,2025-05-16 12:17:00,https://id.jobstreet.com/id/job/84276970
84767584,Senior Application Developer - .Net Full Stack Permanent,UPS Asia Group Pte. Ltd.,Singapore,2025-05-14 12:17:00,https://id.jobstreet.com/id/job/84767584
84654637,Software Development Manager (ServiceNow),CLOUDGO PTE. LTD.,Central Region,2025-06-03 12:17:00,https://id.jobstreet.com/id/job/84654637
84572455,Software Engineer,AvePoint,Singapore,2025-05-29 12:17:00,https://id.jobstreet.com/id/job/84572455
84646898,Software Developer (Java/ Spring Boot/ Google Cloud),Steenbok Pte Ltd,Singapore,2025-06-03 12:17:00,https://id.jobstreet.com/id/job/84646898
84603515,Systems Programmer,Coilcraft Singapore Pte Ltd,Bedok,2025-05-30 12:17:00,https://id.jobstreet.com/id/job/84603515
83943442,CMI Software Developer,Credit Agricole Corporate And Investment Bank,Singapore,2025-05-09 12:17:00,https://id.jobstreet.com/id/job/83943442
84278287,Senior Software Engineer (Mobile Developer),,Marina Centre,2025-05-16 12:17:00,https://id.jobstreet.com/id/job/84278287
