Job_ID,Role,Company,Location,Publish_Time,URL
83451808,Internship - IT Application Developer/Innovation,Infineon Technologies,Singapore,2025-05-06 16:29:33,https://id.jobstreet.com/id/job/83451808
82843315,Mulesoft Tech Lead,Unison Consulting Pte. Ltd.,Central Region,2025-05-06 16:29:33,https://id.jobstreet.com/id/job/82843315
83382650,G07 - DevOps Engineer,FPT Asia Pacific Pte Ltd,Singapore,2025-05-06 16:29:33,https://id.jobstreet.com/id/job/83382650
83349717,Java Software Developer,LUXOFT INFORMATION TECHNOLOGY (SINGAPORE) PTE. LTD.,Singapore,2025-05-06 16:29:33,https://id.jobstreet.com/id/job/83349717
83418139,Site Reliability Engineer (SRE) (GovTech),AvePoint,Singapore,2025-05-06 16:29:33,https://id.jobstreet.com/id/job/83418139
83350558,Java Software Developer,LUXOFT INFORMATION TECHNOLOGY (SINGAPORE) PTE. LTD.,Singapore,2025-05-06 16:29:33,https://id.jobstreet.com/id/job/83350558
84543820,Senior Technical Program Manager,Motional,Pasir Panjang,2025-05-28 16:29:33,https://id.jobstreet.com/id/job/84543820
83492128,Senior Software Engineer,Singapore Telecommunications Limited,Singapore,2025-05-06 16:29:33,https://id.jobstreet.com/id/job/83492128
84572338,Senior Java Developer (Backend),ANTAES ASIA PTE. LTD.,Marina South,2025-05-29 16:29:33,https://id.jobstreet.com/id/job/84572338
83017951,ServiceNow Presales Solution Engineer,PLOY ASIA PTE. LTD.,Singapore,2025-05-06 16:29:33,https://id.jobstreet.com/id/job/83017951
83303790,Senior Principal Engineer,Autodesk Asia Pte Ltd,Singapore,2025-05-06 16:29:33,https://id.jobstreet.com/id/job/83303790
84539688,Servicenow Architecture Lead - Cognizant,Cognizant Technology Solutions Asia Pacific Pte Ltd,Singapore,2025-05-28 16:29:33,https://id.jobstreet.com/id/job/84539688
